03:19:41.576579 IP lamp-ubuntu-s-1vcpu-1gb-tor1-01.ssh > bras-base-toroon0817w-grc-26-184-146-121-215.dsl.bell.ca.64650: Flags [P.], seq 101416:101636, ack 37, win 501, length 220
03:19:41.576641 IP lamp-ubuntu-s-1vcpu-1gb-tor1-01.ssh > bras-base-toroon0817w-grc-26-184-146-121-215.dsl.bell.ca.64650: Flags [P.], seq 101636:101856, ack 37, win 501, length 220
03:19:41.576656 IP bras-base-toroon0817w-grc-26-184-146-121-215.dsl.bell.ca.64650 > lamp-ubuntu-s-1vcpu-1gb-tor1-01.ssh: Flags [.], ack 93736, win 1026, length 0
03:19:41.576718 IP lamp-ubuntu-s-1vcpu-1gb-tor1-01.ssh > bras-base-toroon0817w-grc-26-184-146-121-215.dsl.bell.ca.64650: Flags [P.], seq 101856:102236, ack 37, win 501, length 380
03:19:41.576788 IP lamp-ubuntu-s-1vcpu-1gb-tor1-01.ssh > bras-base-toroon0817w-grc-26-184-146-121-215.dsl.bell.ca.64650: Flags [P.], seq 102236:102456, ack 37, win 501, length 220
03:19:41.576845 IP lamp-ubuntu-s-1vcpu-1gb-tor1-01.ssh > bras-base-toroon0817w-grc-26-184-146-121-215.dsl.bell.ca.64650: Flags [P.], seq 102456:102676, ack 37, win 501, length 220
03:19:41.576902 IP lamp-ubuntu-s-1vcpu-1gb-tor1-01.ssh > bras-base-toroon0817w-grc-26-184-146-121-215.dsl.bell.ca.64650: Flags [P.], seq 102676:102896, ack 37, win 501, length 220
03:19:41.576961 IP lamp-ubuntu-s-1vcpu-1gb-tor1-01.ssh > bras-base-toroon0817w-grc-26-184-146-121-215.dsl.bell.ca.64650: Flags [P.], seq 102896:103116, ack 37, win 501, length 220
03:19:41.577012 IP lamp-ubuntu-s-1vcpu-1gb-tor1-01.ssh > bras-base-toroon0817w-grc-26-184-146-121-215.dsl.bell.ca.64650: Flags [P.], seq 103116:103336, ack 37, win 501, length 220
03:19:41.577062 IP lamp-ubuntu-s-1vcpu-1gb-tor1-01.ssh > bras-base-toroon0817w-grc-26-184-146-121-215.dsl.bell.ca.64650: Flags [P.], seq 103336:103556, ack 37, win 501, length 220
03:19:41.577113 IP lamp-ubuntu-s-1vcpu-1gb-tor1-01.ssh > bras-base-toroon0817w-grc-26-184-146-121-215.dsl.bell.ca.64650: Flags [P.], seq 103556:103776, ack 37, win 501, length 220
03:19:41.577166 IP lamp-ubuntu-s-1vcpu-1gb-tor1-01.ssh > bras-base-toroon0817w-grc-26-184-146-121-215.dsl.bell.ca.64650: Flags [P.], seq 103776:103996, ack 37, win 501, length 220
03:19:41.577178 IP bras-base-toroon0817w-grc-26-184-146-121-215.dsl.bell.ca.64650 > lamp-ubuntu-s-1vcpu-1gb-tor1-01.ssh: Flags [.], ack 95876, win 1026, length 0
03:19:41.577230 IP lamp-ubuntu-s-1vcpu-1gb-tor1-01.ssh > bras-base-toroon0817w-grc-26-184-146-121-215.dsl.bell.ca.64650: Flags [P.], seq 103996:104376, ack 37, win 501, length 380
03:19:41.577287 IP lamp-ubuntu-s-1vcpu-1gb-tor1-01.ssh > bras-base-toroon0817w-grc-26-184-146-121-215.dsl.bell.ca.64650: Flags [P.], seq 104376:104596, ack 37, win 501, length 220
03:19:41.577352 IP lamp-ubuntu-s-1vcpu-1gb-tor1-01.ssh > bras-base-toroon0817w-grc-26-184-146-121-215.dsl.bell.ca.64650: Flags [P.], seq 104596:104816, ack 37, win 501, length 220
03:19:41.577450 IP lamp-ubuntu-s-1vcpu-1gb-tor1-01.ssh > bras-base-toroon0817w-grc-26-184-146-121-215.dsl.bell.ca.64650: Flags [P.], seq 104816:105036, ack 37, win 501, length 220
03:19:41.577517 IP lamp-ubuntu-s-1vcpu-1gb-tor1-01.ssh > bras-base-toroon0817w-grc-26-184-146-121-215.dsl.bell.ca.64650: Flags [P.], seq 105036:105256, ack 37, win 501, length 220
03:19:41.577531 IP bras-base-toroon0817w-grc-26-184-146-121-215.dsl.bell.ca.64650 > lamp-ubuntu-s-1vcpu-1gb-tor1-01.ssh: Flags [.], ack 98016, win 1026, length 0
03:19:41.577583 IP lamp-ubuntu-s-1vcpu-1gb-tor1-01.ssh > bras-base-toroon0817w-grc-26-184-146-121-215.dsl.bell.ca.64650: Flags [P.], seq 105256:105636, ack 37, win 501, length 380
03:19:41.577645 IP lamp-ubuntu-s-1vcpu-1gb-tor1-01.ssh > bras-base-toroon0817w-grc-26-184-146-121-215.dsl.bell.ca.64650: Flags [P.], seq 105636:105856, ack 37, win 501, length 220
03:19:41.577713 IP lamp-ubuntu-s-1vcpu-1gb-tor1-01.ssh > bras-base-toroon0817w-grc-26-184-146-121-215.dsl.bell.ca.64650: Flags [P.], seq 105856:106076, ack 37, win 501, length 220
03:19:41.577772 IP lamp-ubuntu-s-1vcpu-1gb-tor1-01.ssh > bras-base-toroon0817w-grc-26-184-146-121-215.dsl.bell.ca.64650: Flags [P.], seq 106076:106296, ack 37, win 501, length 220
03:19:41.577838 IP lamp-ubuntu-s-1vcpu-1gb-tor1-01.ssh > bras-base-toroon0817w-grc-26-184-146-121-215.dsl.bell.ca.64650: Flags [P.], seq 106296:106516, ack 37, win 501, length 220
03:19:41.577901 IP lamp-ubuntu-s-1vcpu-1gb-tor1-01.ssh > bras-base-toroon0817w-grc-26-184-146-121-215.dsl.bell.ca.64650: Flags [P.], seq 106516:106736, ack 37, win 501, length 220
03:19:41.577954 IP lamp-ubuntu-s-1vcpu-1gb-tor1-01.ssh > bras-base-toroon0817w-grc-26-184-146-121-215.dsl.bell.ca.64650: Flags [P.], seq 106736:106956, ack 37, win 501, length 220
03:19:41.578006 IP lamp-ubuntu-s-1vcpu-1gb-tor1-01.ssh > bras-base-toroon0817w-grc-26-184-146-121-215.dsl.bell.ca.64650: Flags [P.], seq 106956:107176, ack 37, win 501, length 220
03:19:41.578056 IP lamp-ubuntu-s-1vcpu-1gb-tor1-01.ssh > bras-base-toroon0817w-grc-26-184-146-121-215.dsl.bell.ca.64650: Flags [P.], seq 107176:107396, ack 37, win 501, length 220
03:19:41.578107 IP lamp-ubuntu-s-1vcpu-1gb-tor1-01.ssh > bras-base-toroon0817w-grc-26-184-146-121-215.dsl.bell.ca.64650: Flags [P.], seq 107396:107616, ack 37, win 501, length 220
03:19:41.578172 IP lamp-ubuntu-s-1vcpu-1gb-tor1-01.ssh > bras-base-toroon0817w-grc-26-184-146-121-215.dsl.bell.ca.64650: Flags [P.], seq 107616:107836, ack 37, win 501, length 220
03:19:41.578184 IP bras-base-toroon0817w-grc-26-184-146-121-215.dsl.bell.ca.64650 > lamp-ubuntu-s-1vcpu-1gb-tor1-01.ssh: Flags [.], ack 99716, win 1026, length 0
03:19:41.578242 IP lamp-ubuntu-s-1vcpu-1gb-tor1-01.ssh > bras-base-toroon0817w-grc-26-184-146-121-215.dsl.bell.ca.64650: Flags [P.], seq 107836:108216, ack 37, win 501, length 380
03:19:41.578310 IP lamp-ubuntu-s-1vcpu-1gb-tor1-01.ssh > bras-base-toroon0817w-grc-26-184-146-121-215.dsl.bell.ca.64650: Flags [P.], seq 108216:108436, ack 37, win 501, length 220
03:19:41.578370 IP lamp-ubuntu-s-1vcpu-1gb-tor1-01.ssh > bras-base-toroon0817w-grc-26-184-146-121-215.dsl.bell.ca.64650: Flags [P.], seq 108436:108656, ack 37, win 501, length 220
03:19:41.578432 IP lamp-ubuntu-s-1vcpu-1gb-tor1-01.ssh > bras-base-toroon0817w-grc-26-184-146-121-215.dsl.bell.ca.64650: Flags [P.], seq 108656:108876, ack 37, win 501, length 220
03:19:41.578442 IP bras-base-toroon0817w-grc-26-184-146-121-215.dsl.bell.ca.64650 > lamp-ubuntu-s-1vcpu-1gb-tor1-01.ssh: Flags [.], ack 101636, win 1026, length 0
03:19:41.578493 IP lamp-ubuntu-s-1vcpu-1gb-tor1-01.ssh > bras-base-toroon0817w-grc-26-184-146-121-215.dsl.bell.ca.64650: Flags [P.], seq 108876:109256, ack 37, win 501, length 380
03:19:41.578547 IP lamp-ubuntu-s-1vcpu-1gb-tor1-01.ssh > bras-base-toroon0817w-grc-26-184-146-121-215.dsl.bell.ca.64650: Flags [P.], seq 109256:109476, ack 37, win 501, length 220
03:19:41.578601 IP lamp-ubuntu-s-1vcpu-1gb-tor1-01.ssh > bras-base-toroon0817w-grc-26-184-146-121-215.dsl.bell.ca.64650: Flags [P.], seq 109476:109696, ack 37, win 501, length 220
03:19:41.578654 IP lamp-ubuntu-s-1vcpu-1gb-tor1-01.ssh > bras-base-toroon0817w-grc-26-184-146-121-215.dsl.bell.ca.64650: Flags [P.], seq 109696:109916, ack 37, win 501, length 220
03:19:41.578706 IP lamp-ubuntu-s-1vcpu-1gb-tor1-01.ssh > bras-base-toroon0817w-grc-26-184-146-121-215.dsl.bell.ca.64650: Flags [P.], seq 109916:110136, ack 37, win 501, length 220
03:19:41.578758 IP lamp-ubuntu-s-1vcpu-1gb-tor1-01.ssh > bras-base-toroon0817w-grc-26-184-146-121-215.dsl.bell.ca.64650: Flags [P.], seq 110136:110356, ack 37, win 501, length 220
03:19:41.578809 IP lamp-ubuntu-s-1vcpu-1gb-tor1-01.ssh > bras-base-toroon0817w-grc-26-184-146-121-215.dsl.bell.ca.64650: Flags [P.], seq 110356:110576, ack 37, win 501, length 220
03:19:41.578861 IP lamp-ubuntu-s-1vcpu-1gb-tor1-01.ssh > bras-base-toroon0817w-grc-26-184-146-121-215.dsl.bell.ca.64650: Flags [P.], seq 110576:110796, ack 37, win 501, length 220
03:19:41.578912 IP lamp-ubuntu-s-1vcpu-1gb-tor1-01.ssh > bras-base-toroon0817w-grc-26-184-146-121-215.dsl.bell.ca.64650: Flags [P.], seq 110796:111016, ack 37, win 501, length 220
03:19:41.578974 IP lamp-ubuntu-s-1vcpu-1gb-tor1-01.ssh > bras-base-toroon0817w-grc-26-184-146-121-215.dsl.bell.ca.64650: Flags [P.], seq 111016:111236, ack 37, win 501, length 220
03:19:41.579039 IP lamp-ubuntu-s-1vcpu-1gb-tor1-01.ssh > bras-base-toroon0817w-grc-26-184-146-121-215.dsl.bell.ca.64650: Flags [P.], seq 111236:111456, ack 37, win 501, length 220
03:19:41.579115 IP lamp-ubuntu-s-1vcpu-1gb-tor1-01.ssh > bras-base-toroon0817w-grc-26-184-146-121-215.dsl.bell.ca.64650: Flags [P.], seq 111456:111676, ack 37, win 501, length 220
03:19:41.579126 IP bras-base-toroon0817w-grc-26-184-146-121-215.dsl.bell.ca.64650 > lamp-ubuntu-s-1vcpu-1gb-tor1-01.ssh: Flags [.], ack 103776, win 1026, length 0
03:19:41.579178 IP lamp-ubuntu-s-1vcpu-1gb-tor1-01.ssh > bras-base-toroon0817w-grc-26-184-146-121-215.dsl.bell.ca.64650: Flags [P.], seq 111676:112056, ack 37, win 501, length 380
03:19:41.579242 IP lamp-ubuntu-s-1vcpu-1gb-tor1-01.ssh > bras-base-toroon0817w-grc-26-184-146-121-215.dsl.bell.ca.64650: Flags [P.], seq 112056:112276, ack 37, win 501, length 220
03:19:41.579306 IP lamp-ubuntu-s-1vcpu-1gb-tor1-01.ssh > bras-base-toroon0817w-grc-26-184-146-121-215.dsl.bell.ca.64650: Flags [P.], seq 112276:112496, ack 37, win 501, length 220
03:19:41.579376 IP lamp-ubuntu-s-1vcpu-1gb-tor1-01.ssh > bras-base-toroon0817w-grc-26-184-146-121-215.dsl.bell.ca.64650: Flags [P.], seq 112496:112716, ack 37, win 501, length 220
03:19:41.579394 IP bras-base-toroon0817w-grc-26-184-146-121-215.dsl.bell.ca.64650 > lamp-ubuntu-s-1vcpu-1gb-tor1-01.ssh: Flags [.], ack 105256, win 1026, length 0
03:19:41.579451 IP lamp-ubuntu-s-1vcpu-1gb-tor1-01.ssh > bras-base-toroon0817w-grc-26-184-146-121-215.dsl.bell.ca.64650: Flags [P.], seq 112716:113096, ack 37, win 501, length 380
03:19:41.579504 IP lamp-ubuntu-s-1vcpu-1gb-tor1-01.ssh > bras-base-toroon0817w-grc-26-184-146-121-215.dsl.bell.ca.64650: Flags [P.], seq 113096:113316, ack 37, win 501, length 220
03:19:41.579556 IP lamp-ubuntu-s-1vcpu-1gb-tor1-01.ssh > bras-base-toroon0817w-grc-26-184-146-121-215.dsl.bell.ca.64650: Flags [P.], seq 113316:113536, ack 37, win 501, length 220
03:19:41.579607 IP lamp-ubuntu-s-1vcpu-1gb-tor1-01.ssh > bras-base-toroon0817w-grc-26-184-146-121-215.dsl.bell.ca.64650: Flags [P.], seq 113536:113756, ack 37, win 501, length 220
03:19:41.579659 IP lamp-ubuntu-s-1vcpu-1gb-tor1-01.ssh > bras-base-toroon0817w-grc-26-184-146-121-215.dsl.bell.ca.64650: Flags [P.], seq 113756:113976, ack 37, win 501, length 220
03:19:41.579713 IP lamp-ubuntu-s-1vcpu-1gb-tor1-01.ssh > bras-base-toroon0817w-grc-26-184-146-121-215.dsl.bell.ca.64650: Flags [P.], seq 113976:114196, ack 37, win 501, length 220
03:19:41.579765 IP lamp-ubuntu-s-1vcpu-1gb-tor1-01.ssh > bras-base-toroon0817w-grc-26-184-146-121-215.dsl.bell.ca.64650: Flags [P.], seq 114196:114416, ack 37, win 501, length 220
03:19:41.579830 IP bras-base-toroon0817w-grc-26-184-146-121-215.dsl.bell.ca.64650 > lamp-ubuntu-s-1vcpu-1gb-tor1-01.ssh: Flags [.], ack 107176, win 1026, length 0
03:19:41.579878 IP lamp-ubuntu-s-1vcpu-1gb-tor1-01.ssh > bras-base-toroon0817w-grc-26-184-146-121-215.dsl.bell.ca.64650: Flags [P.], seq 114416:114636, ack 37, win 501, length 220
03:19:41.579940 IP lamp-ubuntu-s-1vcpu-1gb-tor1-01.ssh > bras-base-toroon0817w-grc-26-184-146-121-215.dsl.bell.ca.64650: Flags [P.], seq 114636:114840, ack 37, win 501, length 204
03:19:41.579956 IP lamp-ubuntu-s-1vcpu-1gb-tor1-01.ssh > bras-base-toroon0817w-grc-26-184-146-121-215.dsl.bell.ca.64650: Flags [P.], seq 114840:115060, ack 37, win 501, length 220
03:19:41.580007 IP lamp-ubuntu-s-1vcpu-1gb-tor1-01.ssh > bras-base-toroon0817w-grc-26-184-146-121-215.dsl.bell.ca.64650: Flags [P.], seq 115060:115456, ack 37, win 501, length 396
03:19:41.580074 IP lamp-ubuntu-s-1vcpu-1gb-tor1-01.ssh > bras-base-toroon0817w-grc-26-184-146-121-215.dsl.bell.ca.64650: Flags [P.], seq 115456:115676, ack 37, win 501, length 220
03:19:41.580125 IP lamp-ubuntu-s-1vcpu-1gb-tor1-01.ssh > bras-base-toroon0817w-grc-26-184-146-121-215.dsl.bell.ca.64650: Flags [P.], seq 115676:115896, ack 37, win 501, length 220
03:19:41.580187 IP lamp-ubuntu-s-1vcpu-1gb-tor1-01.ssh > bras-base-toroon0817w-grc-26-184-146-121-215.dsl.bell.ca.64650: Flags [P.], seq 115896:116116, ack 37, win 501, length 220
03:19:41.580247 IP lamp-ubuntu-s-1vcpu-1gb-tor1-01.ssh > bras-base-toroon0817w-grc-26-184-146-121-215.dsl.bell.ca.64650: Flags [P.], seq 116116:116336, ack 37, win 501, length 220
03:19:41.580313 IP lamp-ubuntu-s-1vcpu-1gb-tor1-01.ssh > bras-base-toroon0817w-grc-26-184-146-121-215.dsl.bell.ca.64650: Flags [P.], seq 116336:116556, ack 37, win 501, length 220
03:19:41.580326 IP bras-base-toroon0817w-grc-26-184-146-121-215.dsl.bell.ca.64650 > lamp-ubuntu-s-1vcpu-1gb-tor1-01.ssh: Flags [.], ack 108876, win 1026, length 0
03:19:41.580376 IP lamp-ubuntu-s-1vcpu-1gb-tor1-01.ssh > bras-base-toroon0817w-grc-26-184-146-121-215.dsl.bell.ca.64650: Flags [P.], seq 116556:116936, ack 37, win 501, length 380
03:19:41.580441 IP lamp-ubuntu-s-1vcpu-1gb-tor1-01.ssh > bras-base-toroon0817w-grc-26-184-146-121-215.dsl.bell.ca.64650: Flags [P.], seq 116936:117156, ack 37, win 501, length 220
03:19:41.580503 IP lamp-ubuntu-s-1vcpu-1gb-tor1-01.ssh > bras-base-toroon0817w-grc-26-184-146-121-215.dsl.bell.ca.64650: Flags [P.], seq 117156:117376, ack 37, win 501, length 220
03:19:41.580565 IP lamp-ubuntu-s-1vcpu-1gb-tor1-01.ssh > bras-base-toroon0817w-grc-26-184-146-121-215.dsl.bell.ca.64650: Flags [P.], seq 117376:117596, ack 37, win 501, length 220
03:19:41.580628 IP lamp-ubuntu-s-1vcpu-1gb-tor1-01.ssh > bras-base-toroon0817w-grc-26-184-146-121-215.dsl.bell.ca.64650: Flags [P.], seq 117596:117816, ack 37, win 501, length 220
03:19:41.580696 IP lamp-ubuntu-s-1vcpu-1gb-tor1-01.ssh > bras-base-toroon0817w-grc-26-184-146-121-215.dsl.bell.ca.64650: Flags [P.], seq 117816:118036, ack 37, win 501, length 220
03:19:41.580760 IP lamp-ubuntu-s-1vcpu-1gb-tor1-01.ssh > bras-base-toroon0817w-grc-26-184-146-121-215.dsl.bell.ca.64650: Flags [P.], seq 118036:118256, ack 37, win 501, length 220
03:19:41.580817 IP lamp-ubuntu-s-1vcpu-1gb-tor1-01.ssh > bras-base-toroon0817w-grc-26-184-146-121-215.dsl.bell.ca.64650: Flags [P.], seq 118256:118476, ack 37, win 501, length 220
03:19:41.580876 IP lamp-ubuntu-s-1vcpu-1gb-tor1-01.ssh > bras-base-toroon0817w-grc-26-184-146-121-215.dsl.bell.ca.64650: Flags [P.], seq 118476:118696, ack 37, win 501, length 220
03:19:41.580935 IP lamp-ubuntu-s-1vcpu-1gb-tor1-01.ssh > bras-base-toroon0817w-grc-26-184-146-121-215.dsl.bell.ca.64650: Flags [P.], seq 118696:118916, ack 37, win 501, length 220
03:19:41.580948 IP bras-base-toroon0817w-grc-26-184-146-121-215.dsl.bell.ca.64650 > lamp-ubuntu-s-1vcpu-1gb-tor1-01.ssh: Flags [.], ack 111016, win 1026, length 0
03:19:41.581000 IP lamp-ubuntu-s-1vcpu-1gb-tor1-01.ssh > bras-base-toroon0817w-grc-26-184-146-121-215.dsl.bell.ca.64650: Flags [P.], seq 118916:119296, ack 37, win 501, length 380
03:19:41.581056 IP lamp-ubuntu-s-1vcpu-1gb-tor1-01.ssh > bras-base-toroon0817w-grc-26-184-146-121-215.dsl.bell.ca.64650: Flags [P.], seq 119296:119516, ack 37, win 501, length 220
03:19:41.581109 IP lamp-ubuntu-s-1vcpu-1gb-tor1-01.ssh > bras-base-toroon0817w-grc-26-184-146-121-215.dsl.bell.ca.64650: Flags [P.], seq 119516:119736, ack 37, win 501, length 220
03:19:41.581163 IP lamp-ubuntu-s-1vcpu-1gb-tor1-01.ssh > bras-base-toroon0817w-grc-26-184-146-121-215.dsl.bell.ca.64650: Flags [P.], seq 119736:119956, ack 37, win 501, length 220
03:19:41.581189 IP bras-base-toroon0817w-grc-26-184-146-121-215.dsl.bell.ca.64650 > lamp-ubuntu-s-1vcpu-1gb-tor1-01.ssh: Flags [.], ack 112496, win 1026, length 0
03:19:41.581242 IP lamp-ubuntu-s-1vcpu-1gb-tor1-01.ssh > bras-base-toroon0817w-grc-26-184-146-121-215.dsl.bell.ca.64650: Flags [P.], seq 119956:120336, ack 37, win 501, length 380
03:19:41.581294 IP lamp-ubuntu-s-1vcpu-1gb-tor1-01.ssh > bras-base-toroon0817w-grc-26-184-146-121-215.dsl.bell.ca.64650: Flags [P.], seq 120336:120556, ack 37, win 501, length 220
03:19:41.581345 IP lamp-ubuntu-s-1vcpu-1gb-tor1-01.ssh > bras-base-toroon0817w-grc-26-184-146-121-215.dsl.bell.ca.64650: Flags [P.], seq 120556:120776, ack 37, win 501, length 220
03:19:41.581421 IP lamp-ubuntu-s-1vcpu-1gb-tor1-01.ssh > bras-base-toroon0817w-grc-26-184-146-121-215.dsl.bell.ca.64650: Flags [P.], seq 120776:120996, ack 37, win 501, length 220
03:19:41.581474 IP lamp-ubuntu-s-1vcpu-1gb-tor1-01.ssh > bras-base-toroon0817w-grc-26-184-146-121-215.dsl.bell.ca.64650: Flags [P.], seq 120996:121216, ack 37, win 501, length 220
03:19:41.581526 IP lamp-ubuntu-s-1vcpu-1gb-tor1-01.ssh > bras-base-toroon0817w-grc-26-184-146-121-215.dsl.bell.ca.64650: Flags [P.], seq 121216:121436, ack 37, win 501, length 220
03:19:41.581538 IP bras-base-toroon0817w-grc-26-184-146-121-215.dsl.bell.ca.64650 > lamp-ubuntu-s-1vcpu-1gb-tor1-01.ssh: Flags [.], ack 114416, win 1026, length 0
03:19:41.581596 IP lamp-ubuntu-s-1vcpu-1gb-tor1-01.ssh > bras-base-toroon0817w-grc-26-184-146-121-215.dsl.bell.ca.64650: Flags [P.], seq 121436:121816, ack 37, win 501, length 380
03:19:41.581651 IP lamp-ubuntu-s-1vcpu-1gb-tor1-01.ssh > bras-base-toroon0817w-grc-26-184-146-121-215.dsl.bell.ca.64650: Flags [P.], seq 121816:122036, ack 37, win 501, length 220
03:19:41.581704 IP lamp-ubuntu-s-1vcpu-1gb-tor1-01.ssh > bras-base-toroon0817w-grc-26-184-146-121-215.dsl.bell.ca.64650: Flags [P.], seq 122036:122256, ack 37, win 501, length 220
03:19:41.581756 IP lamp-ubuntu-s-1vcpu-1gb-tor1-01.ssh > bras-base-toroon0817w-grc-26-184-146-121-215.dsl.bell.ca.64650: Flags [P.], seq 122256:122476, ack 37, win 501, length 220
03:19:41.581807 IP lamp-ubuntu-s-1vcpu-1gb-tor1-01.ssh > bras-base-toroon0817w-grc-26-184-146-121-215.dsl.bell.ca.64650: Flags [P.], seq 122476:122696, ack 37, win 501, length 220
03:19:41.581861 IP lamp-ubuntu-s-1vcpu-1gb-tor1-01.ssh > bras-base-toroon0817w-grc-26-184-146-121-215.dsl.bell.ca.64650: Flags [P.], seq 122696:122916, ack 37, win 501, length 220
03:19:41.581922 IP lamp-ubuntu-s-1vcpu-1gb-tor1-01.ssh > bras-base-toroon0817w-grc-26-184-146-121-215.dsl.bell.ca.64650: Flags [P.], seq 122916:123136, ack 37, win 501, length 220
03:19:41.581984 IP lamp-ubuntu-s-1vcpu-1gb-tor1-01.ssh > bras-base-toroon0817w-grc-26-184-146-121-215.dsl.bell.ca.64650: Flags [P.], seq 123136:123356, ack 37, win 501, length 220
03:19:41.582037 IP lamp-ubuntu-s-1vcpu-1gb-tor1-01.ssh > bras-base-toroon0817w-grc-26-184-146-121-215.dsl.bell.ca.64650: Flags [P.], seq 123356:123576, ack 37, win 501, length 220
03:19:41.582089 IP lamp-ubuntu-s-1vcpu-1gb-tor1-01.ssh > bras-base-toroon0817w-grc-26-184-146-121-215.dsl.bell.ca.64650: Flags [P.], seq 123576:123796, ack 37, win 501, length 220
03:19:41.582151 IP lamp-ubuntu-s-1vcpu-1gb-tor1-01.ssh > bras-base-toroon0817w-grc-26-184-146-121-215.dsl.bell.ca.64650: Flags [P.], seq 123796:124016, ack 37, win 501, length 220
03:19:41.582164 IP bras-base-toroon0817w-grc-26-184-146-121-215.dsl.bell.ca.64650 > lamp-ubuntu-s-1vcpu-1gb-tor1-01.ssh: Flags [.], ack 116336, win 1026, length 0
03:19:41.582216 IP lamp-ubuntu-s-1vcpu-1gb-tor1-01.ssh > bras-base-toroon0817w-grc-26-184-146-121-215.dsl.bell.ca.64650: Flags [P.], seq 124016:124396, ack 37, win 501, length 380
03:19:41.582268 IP lamp-ubuntu-s-1vcpu-1gb-tor1-01.ssh > bras-base-toroon0817w-grc-26-184-146-121-215.dsl.bell.ca.64650: Flags [P.], seq 124396:124616, ack 37, win 501, length 220
03:19:41.582318 IP lamp-ubuntu-s-1vcpu-1gb-tor1-01.ssh > bras-base-toroon0817w-grc-26-184-146-121-215.dsl.bell.ca.64650: Flags [P.], seq 124616:124836, ack 37, win 501, length 220
03:19:41.582372 IP lamp-ubuntu-s-1vcpu-1gb-tor1-01.ssh > bras-base-toroon0817w-grc-26-184-146-121-215.dsl.bell.ca.64650: Flags [P.], seq 124836:125056, ack 37, win 501, length 220
03:19:41.582431 IP lamp-ubuntu-s-1vcpu-1gb-tor1-01.ssh > bras-base-toroon0817w-grc-26-184-146-121-215.dsl.bell.ca.64650: Flags [P.], seq 125056:125276, ack 37, win 501, length 220
03:19:41.582489 IP lamp-ubuntu-s-1vcpu-1gb-tor1-01.ssh > bras-base-toroon0817w-grc-26-184-146-121-215.dsl.bell.ca.64650: Flags [P.], seq 125276:125496, ack 37, win 501, length 220
03:19:41.582540 IP lamp-ubuntu-s-1vcpu-1gb-tor1-01.ssh > bras-base-toroon0817w-grc-26-184-146-121-215.dsl.bell.ca.64650: Flags [P.], seq 125496:125716, ack 37, win 501, length 220
03:19:41.582591 IP lamp-ubuntu-s-1vcpu-1gb-tor1-01.ssh > bras-base-toroon0817w-grc-26-184-146-121-215.dsl.bell.ca.64650: Flags [P.], seq 125716:125936, ack 37, win 501, length 220
03:19:41.582645 IP lamp-ubuntu-s-1vcpu-1gb-tor1-01.ssh > bras-base-toroon0817w-grc-26-184-146-121-215.dsl.bell.ca.64650: Flags [P.], seq 125936:126156, ack 37, win 501, length 220
03:19:41.582657 IP bras-base-toroon0817w-grc-26-184-146-121-215.dsl.bell.ca.64650 > lamp-ubuntu-s-1vcpu-1gb-tor1-01.ssh: Flags [.], ack 118036, win 1026, length 0
03:19:41.582698 IP bras-base-toroon0817w-grc-26-184-146-121-215.dsl.bell.ca.64650 > lamp-ubuntu-s-1vcpu-1gb-tor1-01.ssh: Flags [P.], seq 37:73, ack 118036, win 1026, length 36
03:19:41.582719 IP lamp-ubuntu-s-1vcpu-1gb-tor1-01.ssh > bras-base-toroon0817w-grc-26-184-146-121-215.dsl.bell.ca.64650: Flags [P.], seq 126156:126536, ack 73, win 501, length 380
03:19:41.582776 IP lamp-ubuntu-s-1vcpu-1gb-tor1-01.ssh > bras-base-toroon0817w-grc-26-184-146-121-215.dsl.bell.ca.64650: Flags [P.], seq 126536:126932, ack 73, win 501, length 396
03:19:41.582828 IP lamp-ubuntu-s-1vcpu-1gb-tor1-01.ssh > bras-base-toroon0817w-grc-26-184-146-121-215.dsl.bell.ca.64650: Flags [P.], seq 126932:127152, ack 73, win 501, length 220
03:19:41.582879 IP lamp-ubuntu-s-1vcpu-1gb-tor1-01.ssh > bras-base-toroon0817w-grc-26-184-146-121-215.dsl.bell.ca.64650: Flags [P.], seq 127152:127372, ack 73, win 501, length 220
03:19:41.582930 IP lamp-ubuntu-s-1vcpu-1gb-tor1-01.ssh > bras-base-toroon0817w-grc-26-184-146-121-215.dsl.bell.ca.64650: Flags [P.], seq 127372:127592, ack 73, win 501, length 220
03:19:41.582981 IP lamp-ubuntu-s-1vcpu-1gb-tor1-01.ssh > bras-base-toroon0817w-grc-26-184-146-121-215.dsl.bell.ca.64650: Flags [P.], seq 127592:127812, ack 73, win 501, length 220
03:19:41.583033 IP lamp-ubuntu-s-1vcpu-1gb-tor1-01.ssh > bras-base-toroon0817w-grc-26-184-146-121-215.dsl.bell.ca.64650: Flags [P.], seq 127812:128032, ack 73, win 501, length 220
03:19:41.583045 IP bras-base-toroon0817w-grc-26-184-146-121-215.dsl.bell.ca.64650 > lamp-ubuntu-s-1vcpu-1gb-tor1-01.ssh: Flags [.], ack 119956, win 1026, length 0
03:19:41.583096 IP lamp-ubuntu-s-1vcpu-1gb-tor1-01.ssh > bras-base-toroon0817w-grc-26-184-146-121-215.dsl.bell.ca.64650: Flags [P.], seq 128032:128412, ack 73, win 501, length 380
03:19:41.583148 IP lamp-ubuntu-s-1vcpu-1gb-tor1-01.ssh > bras-base-toroon0817w-grc-26-184-146-121-215.dsl.bell.ca.64650: Flags [P.], seq 128412:128632, ack 73, win 501, length 220
03:19:41.583211 IP lamp-ubuntu-s-1vcpu-1gb-tor1-01.ssh > bras-base-toroon0817w-grc-26-184-146-121-215.dsl.bell.ca.64650: Flags [P.], seq 128632:128852, ack 73, win 501, length 220
03:19:41.583271 IP lamp-ubuntu-s-1vcpu-1gb-tor1-01.ssh > bras-base-toroon0817w-grc-26-184-146-121-215.dsl.bell.ca.64650: Flags [P.], seq 128852:129072, ack 73, win 501, length 220
03:19:41.583323 IP lamp-ubuntu-s-1vcpu-1gb-tor1-01.ssh > bras-base-toroon0817w-grc-26-184-146-121-215.dsl.bell.ca.64650: Flags [P.], seq 129072:129292, ack 73, win 501, length 220
03:19:41.583374 IP lamp-ubuntu-s-1vcpu-1gb-tor1-01.ssh > bras-base-toroon0817w-grc-26-184-146-121-215.dsl.bell.ca.64650: Flags [P.], seq 129292:129512, ack 73, win 501, length 220
03:19:41.583426 IP lamp-ubuntu-s-1vcpu-1gb-tor1-01.ssh > bras-base-toroon0817w-grc-26-184-146-121-215.dsl.bell.ca.64650: Flags [P.], seq 129512:129732, ack 73, win 501, length 220
03:19:41.583438 IP bras-base-toroon0817w-grc-26-184-146-121-215.dsl.bell.ca.64650 > lamp-ubuntu-s-1vcpu-1gb-tor1-01.ssh: Flags [.], ack 121436, win 1026, length 0
03:19:41.583488 IP lamp-ubuntu-s-1vcpu-1gb-tor1-01.ssh > bras-base-toroon0817w-grc-26-184-146-121-215.dsl.bell.ca.64650: Flags [P.], seq 129732:130112, ack 73, win 501, length 380
03:19:41.583539 IP lamp-ubuntu-s-1vcpu-1gb-tor1-01.ssh > bras-base-toroon0817w-grc-26-184-146-121-215.dsl.bell.ca.64650: Flags [P.], seq 130112:130332, ack 73, win 501, length 220
03:19:41.583590 IP lamp-ubuntu-s-1vcpu-1gb-tor1-01.ssh > bras-base-toroon0817w-grc-26-184-146-121-215.dsl.bell.ca.64650: Flags [P.], seq 130332:130552, ack 73, win 501, length 220
03:19:41.583641 IP lamp-ubuntu-s-1vcpu-1gb-tor1-01.ssh > bras-base-toroon0817w-grc-26-184-146-121-215.dsl.bell.ca.64650: Flags [P.], seq 130552:130772, ack 73, win 501, length 220
03:19:41.583693 IP lamp-ubuntu-s-1vcpu-1gb-tor1-01.ssh > bras-base-toroon0817w-grc-26-184-146-121-215.dsl.bell.ca.64650: Flags [P.], seq 130772:130992, ack 73, win 501, length 220
03:19:41.583744 IP lamp-ubuntu-s-1vcpu-1gb-tor1-01.ssh > bras-base-toroon0817w-grc-26-184-146-121-215.dsl.bell.ca.64650: Flags [P.], seq 130992:131212, ack 73, win 501, length 220
03:19:41.583794 IP lamp-ubuntu-s-1vcpu-1gb-tor1-01.ssh > bras-base-toroon0817w-grc-26-184-146-121-215.dsl.bell.ca.64650: Flags [P.], seq 131212:131432, ack 73, win 501, length 220
03:19:41.583862 IP lamp-ubuntu-s-1vcpu-1gb-tor1-01.ssh > bras-base-toroon0817w-grc-26-184-146-121-215.dsl.bell.ca.64650: Flags [P.], seq 131432:131652, ack 73, win 501, length 220
03:19:41.583916 IP lamp-ubuntu-s-1vcpu-1gb-tor1-01.ssh > bras-base-toroon0817w-grc-26-184-146-121-215.dsl.bell.ca.64650: Flags [P.], seq 131652:131872, ack 73, win 501, length 220
03:19:41.583928 IP bras-base-toroon0817w-grc-26-184-146-121-215.dsl.bell.ca.64650 > lamp-ubuntu-s-1vcpu-1gb-tor1-01.ssh: Flags [.], ack 123796, win 1026, length 0
03:19:41.583979 IP lamp-ubuntu-s-1vcpu-1gb-tor1-01.ssh > bras-base-toroon0817w-grc-26-184-146-121-215.dsl.bell.ca.64650: Flags [P.], seq 131872:132252, ack 73, win 501, length 380
03:19:41.584032 IP lamp-ubuntu-s-1vcpu-1gb-tor1-01.ssh > bras-base-toroon0817w-grc-26-184-146-121-215.dsl.bell.ca.64650: Flags [P.], seq 132252:132472, ack 73, win 501, length 220
03:19:41.584082 IP lamp-ubuntu-s-1vcpu-1gb-tor1-01.ssh > bras-base-toroon0817w-grc-26-184-146-121-215.dsl.bell.ca.64650: Flags [P.], seq 132472:132692, ack 73, win 501, length 220
03:19:41.584135 IP lamp-ubuntu-s-1vcpu-1gb-tor1-01.ssh > bras-base-toroon0817w-grc-26-184-146-121-215.dsl.bell.ca.64650: Flags [P.], seq 132692:132912, ack 73, win 501, length 220
03:19:41.584186 IP lamp-ubuntu-s-1vcpu-1gb-tor1-01.ssh > bras-base-toroon0817w-grc-26-184-146-121-215.dsl.bell.ca.64650: Flags [P.], seq 132912:133132, ack 73, win 501, length 220
03:19:41.584236 IP lamp-ubuntu-s-1vcpu-1gb-tor1-01.ssh > bras-base-toroon0817w-grc-26-184-146-121-215.dsl.bell.ca.64650: Flags [P.], seq 133132:133352, ack 73, win 501, length 220
03:19:41.584287 IP lamp-ubuntu-s-1vcpu-1gb-tor1-01.ssh > bras-base-toroon0817w-grc-26-184-146-121-215.dsl.bell.ca.64650: Flags [P.], seq 133352:133572, ack 73, win 501, length 220
03:19:41.584338 IP lamp-ubuntu-s-1vcpu-1gb-tor1-01.ssh > bras-base-toroon0817w-grc-26-184-146-121-215.dsl.bell.ca.64650: Flags [P.], seq 133572:133792, ack 73, win 501, length 220
03:19:41.584389 IP lamp-ubuntu-s-1vcpu-1gb-tor1-01.ssh > bras-base-toroon0817w-grc-26-184-146-121-215.dsl.bell.ca.64650: Flags [P.], seq 133792:134012, ack 73, win 501, length 220
03:19:41.584441 IP lamp-ubuntu-s-1vcpu-1gb-tor1-01.ssh > bras-base-toroon0817w-grc-26-184-146-121-215.dsl.bell.ca.64650: Flags [P.], seq 134012:134232, ack 73, win 501, length 220
03:19:41.584453 IP bras-base-toroon0817w-grc-26-184-146-121-215.dsl.bell.ca.64650 > lamp-ubuntu-s-1vcpu-1gb-tor1-01.ssh: Flags [.], ack 125276, win 1026, length 0
03:19:41.584502 IP lamp-ubuntu-s-1vcpu-1gb-tor1-01.ssh > bras-base-toroon0817w-grc-26-184-146-121-215.dsl.bell.ca.64650: Flags [P.], seq 134232:134612, ack 73, win 501, length 380
03:19:41.584553 IP lamp-ubuntu-s-1vcpu-1gb-tor1-01.ssh > bras-base-toroon0817w-grc-26-184-146-121-215.dsl.bell.ca.64650: Flags [P.], seq 134612:134832, ack 73, win 501, length 220
03:19:41.584604 IP lamp-ubuntu-s-1vcpu-1gb-tor1-01.ssh > bras-base-toroon0817w-grc-26-184-146-121-215.dsl.bell.ca.64650: Flags [P.], seq 134832:135052, ack 73, win 501, length 220
03:19:41.584655 IP lamp-ubuntu-s-1vcpu-1gb-tor1-01.ssh > bras-base-toroon0817w-grc-26-184-146-121-215.dsl.bell.ca.64650: Flags [P.], seq 135052:135272, ack 73, win 501, length 220
03:19:41.584716 IP lamp-ubuntu-s-1vcpu-1gb-tor1-01.ssh > bras-base-toroon0817w-grc-26-184-146-121-215.dsl.bell.ca.64650: Flags [P.], seq 135272:135492, ack 73, win 501, length 220
03:19:41.584775 IP lamp-ubuntu-s-1vcpu-1gb-tor1-01.ssh > bras-base-toroon0817w-grc-26-184-146-121-215.dsl.bell.ca.64650: Flags [P.], seq 135492:135712, ack 73, win 501, length 220
03:19:41.584849 IP lamp-ubuntu-s-1vcpu-1gb-tor1-01.ssh > bras-base-toroon0817w-grc-26-184-146-121-215.dsl.bell.ca.64650: Flags [P.], seq 135712:135932, ack 73, win 501, length 220
03:19:41.584909 IP bras-base-toroon0817w-grc-26-184-146-121-215.dsl.bell.ca.64650 > lamp-ubuntu-s-1vcpu-1gb-tor1-01.ssh: Flags [.], ack 127812, win 1026, length 0
03:19:41.584928 IP lamp-ubuntu-s-1vcpu-1gb-tor1-01.ssh > bras-base-toroon0817w-grc-26-184-146-121-215.dsl.bell.ca.64650: Flags [P.], seq 135932:136152, ack 73, win 501, length 220
03:19:41.584985 IP lamp-ubuntu-s-1vcpu-1gb-tor1-01.ssh > bras-base-toroon0817w-grc-26-184-146-121-215.dsl.bell.ca.64650: Flags [P.], seq 136152:136532, ack 73, win 501, length 380
03:19:41.585038 IP lamp-ubuntu-s-1vcpu-1gb-tor1-01.ssh > bras-base-toroon0817w-grc-26-184-146-121-215.dsl.bell.ca.64650: Flags [P.], seq 136532:136752, ack 73, win 501, length 220
03:19:41.585090 IP lamp-ubuntu-s-1vcpu-1gb-tor1-01.ssh > bras-base-toroon0817w-grc-26-184-146-121-215.dsl.bell.ca.64650: Flags [P.], seq 136752:136972, ack 73, win 501, length 220
03:19:41.585141 IP lamp-ubuntu-s-1vcpu-1gb-tor1-01.ssh > bras-base-toroon0817w-grc-26-184-146-121-215.dsl.bell.ca.64650: Flags [P.], seq 136972:137192, ack 73, win 501, length 220
03:19:41.585205 IP lamp-ubuntu-s-1vcpu-1gb-tor1-01.ssh > bras-base-toroon0817w-grc-26-184-146-121-215.dsl.bell.ca.64650: Flags [P.], seq 137192:137412, ack 73, win 501, length 220
03:19:41.585258 IP lamp-ubuntu-s-1vcpu-1gb-tor1-01.ssh > bras-base-toroon0817w-grc-26-184-146-121-215.dsl.bell.ca.64650: Flags [P.], seq 137412:137632, ack 73, win 501, length 220
03:19:41.585272 IP bras-base-toroon0817w-grc-26-184-146-121-215.dsl.bell.ca.64650 > lamp-ubuntu-s-1vcpu-1gb-tor1-01.ssh: Flags [.], ack 129732, win 1026, length 0
03:19:41.585324 IP lamp-ubuntu-s-1vcpu-1gb-tor1-01.ssh > bras-base-toroon0817w-grc-26-184-146-121-215.dsl.bell.ca.64650: Flags [P.], seq 137632:138012, ack 73, win 501, length 380
03:19:41.585405 IP lamp-ubuntu-s-1vcpu-1gb-tor1-01.ssh > bras-base-toroon0817w-grc-26-184-146-121-215.dsl.bell.ca.64650: Flags [P.], seq 138012:138232, ack 73, win 501, length 220
03:19:41.585471 IP lamp-ubuntu-s-1vcpu-1gb-tor1-01.ssh > bras-base-toroon0817w-grc-26-184-146-121-215.dsl.bell.ca.64650: Flags [P.], seq 138232:138452, ack 73, win 501, length 220
03:19:41.585531 IP lamp-ubuntu-s-1vcpu-1gb-tor1-01.ssh > bras-base-toroon0817w-grc-26-184-146-121-215.dsl.bell.ca.64650: Flags [P.], seq 138452:138672, ack 73, win 501, length 220
03:19:41.585583 IP lamp-ubuntu-s-1vcpu-1gb-tor1-01.ssh > bras-base-toroon0817w-grc-26-184-146-121-215.dsl.bell.ca.64650: Flags [P.], seq 138672:138892, ack 73, win 501, length 220
03:19:41.585633 IP lamp-ubuntu-s-1vcpu-1gb-tor1-01.ssh > bras-base-toroon0817w-grc-26-184-146-121-215.dsl.bell.ca.64650: Flags [P.], seq 138892:139112, ack 73, win 501, length 220
03:19:41.585683 IP lamp-ubuntu-s-1vcpu-1gb-tor1-01.ssh > bras-base-toroon0817w-grc-26-184-146-121-215.dsl.bell.ca.64650: Flags [P.], seq 139112:139332, ack 73, win 501, length 220
03:19:41.585735 IP lamp-ubuntu-s-1vcpu-1gb-tor1-01.ssh > bras-base-toroon0817w-grc-26-184-146-121-215.dsl.bell.ca.64650: Flags [P.], seq 139332:139552, ack 73, win 501, length 220
03:19:41.585788 IP lamp-ubuntu-s-1vcpu-1gb-tor1-01.ssh > bras-base-toroon0817w-grc-26-184-146-121-215.dsl.bell.ca.64650: Flags [P.], seq 139552:139772, ack 73, win 501, length 220
03:19:41.585803 IP bras-base-toroon0817w-grc-26-184-146-121-215.dsl.bell.ca.64650 > lamp-ubuntu-s-1vcpu-1gb-tor1-01.ssh: Flags [.], ack 131872, win 1026, length 0
03:19:41.585856 IP lamp-ubuntu-s-1vcpu-1gb-tor1-01.ssh > bras-base-toroon0817w-grc-26-184-146-121-215.dsl.bell.ca.64650: Flags [P.], seq 139772:140152, ack 73, win 501, length 380
03:19:41.585908 IP lamp-ubuntu-s-1vcpu-1gb-tor1-01.ssh > bras-base-toroon0817w-grc-26-184-146-121-215.dsl.bell.ca.64650: Flags [P.], seq 140152:140372, ack 73, win 501, length 220
03:19:41.585959 IP lamp-ubuntu-s-1vcpu-1gb-tor1-01.ssh > bras-base-toroon0817w-grc-26-184-146-121-215.dsl.bell.ca.64650: Flags [P.], seq 140372:140592, ack 73, win 501, length 220
03:19:41.586009 IP lamp-ubuntu-s-1vcpu-1gb-tor1-01.ssh > bras-base-toroon0817w-grc-26-184-146-121-215.dsl.bell.ca.64650: Flags [P.], seq 140592:140812, ack 73, win 501, length 220
03:19:41.586059 IP lamp-ubuntu-s-1vcpu-1gb-tor1-01.ssh > bras-base-toroon0817w-grc-26-184-146-121-215.dsl.bell.ca.64650: Flags [P.], seq 140812:141032, ack 73, win 501, length 220
03:19:41.586110 IP lamp-ubuntu-s-1vcpu-1gb-tor1-01.ssh > bras-base-toroon0817w-grc-26-184-146-121-215.dsl.bell.ca.64650: Flags [P.], seq 141032:141252, ack 73, win 501, length 220
03:19:41.586161 IP lamp-ubuntu-s-1vcpu-1gb-tor1-01.ssh > bras-base-toroon0817w-grc-26-184-146-121-215.dsl.bell.ca.64650: Flags [P.], seq 141252:141472, ack 73, win 501, length 220
03:19:41.586222 IP lamp-ubuntu-s-1vcpu-1gb-tor1-01.ssh > bras-base-toroon0817w-grc-26-184-146-121-215.dsl.bell.ca.64650: Flags [P.], seq 141472:141692, ack 73, win 501, length 220
03:19:41.586278 IP lamp-ubuntu-s-1vcpu-1gb-tor1-01.ssh > bras-base-toroon0817w-grc-26-184-146-121-215.dsl.bell.ca.64650: Flags [P.], seq 141692:141912, ack 73, win 501, length 220
03:19:41.586289 IP bras-base-toroon0817w-grc-26-184-146-121-215.dsl.bell.ca.64650 > lamp-ubuntu-s-1vcpu-1gb-tor1-01.ssh: Flags [.], ack 134012, win 1026, length 0
03:19:41.586339 IP lamp-ubuntu-s-1vcpu-1gb-tor1-01.ssh > bras-base-toroon0817w-grc-26-184-146-121-215.dsl.bell.ca.64650: Flags [P.], seq 141912:142292, ack 73, win 501, length 380
03:19:41.586391 IP lamp-ubuntu-s-1vcpu-1gb-tor1-01.ssh > bras-base-toroon0817w-grc-26-184-146-121-215.dsl.bell.ca.64650: Flags [P.], seq 142292:142512, ack 73, win 501, length 220
03:19:41.586442 IP lamp-ubuntu-s-1vcpu-1gb-tor1-01.ssh > bras-base-toroon0817w-grc-26-184-146-121-215.dsl.bell.ca.64650: Flags [P.], seq 142512:142732, ack 73, win 501, length 220
03:19:41.586493 IP lamp-ubuntu-s-1vcpu-1gb-tor1-01.ssh > bras-base-toroon0817w-grc-26-184-146-121-215.dsl.bell.ca.64650: Flags [P.], seq 142732:142952, ack 73, win 501, length 220
03:19:41.586544 IP lamp-ubuntu-s-1vcpu-1gb-tor1-01.ssh > bras-base-toroon0817w-grc-26-184-146-121-215.dsl.bell.ca.64650: Flags [P.], seq 142952:143172, ack 73, win 501, length 220
03:19:41.586595 IP lamp-ubuntu-s-1vcpu-1gb-tor1-01.ssh > bras-base-toroon0817w-grc-26-184-146-121-215.dsl.bell.ca.64650: Flags [P.], seq 143172:143392, ack 73, win 501, length 220
03:19:41.586646 IP lamp-ubuntu-s-1vcpu-1gb-tor1-01.ssh > bras-base-toroon0817w-grc-26-184-146-121-215.dsl.bell.ca.64650: Flags [P.], seq 143392:143612, ack 73, win 501, length 220
03:19:41.586698 IP lamp-ubuntu-s-1vcpu-1gb-tor1-01.ssh > bras-base-toroon0817w-grc-26-184-146-121-215.dsl.bell.ca.64650: Flags [P.], seq 143612:143832, ack 73, win 501, length 220
03:19:41.586708 IP bras-base-toroon0817w-grc-26-184-146-121-215.dsl.bell.ca.64650 > lamp-ubuntu-s-1vcpu-1gb-tor1-01.ssh: Flags [.], ack 135932, win 1026, length 0
03:19:41.586758 IP lamp-ubuntu-s-1vcpu-1gb-tor1-01.ssh > bras-base-toroon0817w-grc-26-184-146-121-215.dsl.bell.ca.64650: Flags [P.], seq 143832:144212, ack 73, win 501, length 380
03:19:41.586810 IP lamp-ubuntu-s-1vcpu-1gb-tor1-01.ssh > bras-base-toroon0817w-grc-26-184-146-121-215.dsl.bell.ca.64650: Flags [P.], seq 144212:144432, ack 73, win 501, length 220
03:19:41.586861 IP lamp-ubuntu-s-1vcpu-1gb-tor1-01.ssh > bras-base-toroon0817w-grc-26-184-146-121-215.dsl.bell.ca.64650: Flags [P.], seq 144432:144652, ack 73, win 501, length 220
03:19:41.586912 IP lamp-ubuntu-s-1vcpu-1gb-tor1-01.ssh > bras-base-toroon0817w-grc-26-184-146-121-215.dsl.bell.ca.64650: Flags [P.], seq 144652:144872, ack 73, win 501, length 220
03:19:41.586963 IP lamp-ubuntu-s-1vcpu-1gb-tor1-01.ssh > bras-base-toroon0817w-grc-26-184-146-121-215.dsl.bell.ca.64650: Flags [P.], seq 144872:145092, ack 73, win 501, length 220
03:19:41.587014 IP lamp-ubuntu-s-1vcpu-1gb-tor1-01.ssh > bras-base-toroon0817w-grc-26-184-146-121-215.dsl.bell.ca.64650: Flags [P.], seq 145092:145312, ack 73, win 501, length 220
03:19:41.587065 IP lamp-ubuntu-s-1vcpu-1gb-tor1-01.ssh > bras-base-toroon0817w-grc-26-184-146-121-215.dsl.bell.ca.64650: Flags [P.], seq 145312:145532, ack 73, win 501, length 220
03:19:41.587116 IP lamp-ubuntu-s-1vcpu-1gb-tor1-01.ssh > bras-base-toroon0817w-grc-26-184-146-121-215.dsl.bell.ca.64650: Flags [P.], seq 145532:145752, ack 73, win 501, length 220
03:19:41.587167 IP lamp-ubuntu-s-1vcpu-1gb-tor1-01.ssh > bras-base-toroon0817w-grc-26-184-146-121-215.dsl.bell.ca.64650: Flags [P.], seq 145752:145972, ack 73, win 501, length 220
03:19:41.587218 IP lamp-ubuntu-s-1vcpu-1gb-tor1-01.ssh > bras-base-toroon0817w-grc-26-184-146-121-215.dsl.bell.ca.64650: Flags [P.], seq 145972:146192, ack 73, win 501, length 220
03:19:41.587270 IP lamp-ubuntu-s-1vcpu-1gb-tor1-01.ssh > bras-base-toroon0817w-grc-26-184-146-121-215.dsl.bell.ca.64650: Flags [P.], seq 146192:146412, ack 73, win 501, length 220
03:19:41.587321 IP lamp-ubuntu-s-1vcpu-1gb-tor1-01.ssh > bras-base-toroon0817w-grc-26-184-146-121-215.dsl.bell.ca.64650: Flags [P.], seq 146412:146632, ack 73, win 501, length 220
03:19:41.587372 IP lamp-ubuntu-s-1vcpu-1gb-tor1-01.ssh > bras-base-toroon0817w-grc-26-184-146-121-215.dsl.bell.ca.64650: Flags [P.], seq 146632:146852, ack 73, win 501, length 220
03:19:41.587424 IP lamp-ubuntu-s-1vcpu-1gb-tor1-01.ssh > bras-base-toroon0817w-grc-26-184-146-121-215.dsl.bell.ca.64650: Flags [P.], seq 146852:147072, ack 73, win 501, length 220
03:19:41.587434 IP bras-base-toroon0817w-grc-26-184-146-121-215.dsl.bell.ca.64650 > lamp-ubuntu-s-1vcpu-1gb-tor1-01.ssh: Flags [.], ack 138232, win 1026, length 0
03:19:41.587484 IP lamp-ubuntu-s-1vcpu-1gb-tor1-01.ssh > bras-base-toroon0817w-grc-26-184-146-121-215.dsl.bell.ca.64650: Flags [P.], seq 147072:147452, ack 73, win 501, length 380
03:19:41.587537 IP lamp-ubuntu-s-1vcpu-1gb-tor1-01.ssh > bras-base-toroon0817w-grc-26-184-146-121-215.dsl.bell.ca.64650: Flags [P.], seq 147452:147672, ack 73, win 501, length 220
03:19:41.587588 IP lamp-ubuntu-s-1vcpu-1gb-tor1-01.ssh > bras-base-toroon0817w-grc-26-184-146-121-215.dsl.bell.ca.64650: Flags [P.], seq 147672:147892, ack 73, win 501, length 220
03:19:41.587639 IP lamp-ubuntu-s-1vcpu-1gb-tor1-01.ssh > bras-base-toroon0817w-grc-26-184-146-121-215.dsl.bell.ca.64650: Flags [P.], seq 147892:148112, ack 73, win 501, length 220
03:19:41.587692 IP lamp-ubuntu-s-1vcpu-1gb-tor1-01.ssh > bras-base-toroon0817w-grc-26-184-146-121-215.dsl.bell.ca.64650: Flags [P.], seq 148112:148332, ack 73, win 501, length 220
03:19:41.587702 IP bras-base-toroon0817w-grc-26-184-146-121-215.dsl.bell.ca.64650 > lamp-ubuntu-s-1vcpu-1gb-tor1-01.ssh: Flags [.], ack 139772, win 1026, length 0
03:19:41.587751 IP lamp-ubuntu-s-1vcpu-1gb-tor1-01.ssh > bras-base-toroon0817w-grc-26-184-146-121-215.dsl.bell.ca.64650: Flags [P.], seq 148332:148712, ack 73, win 501, length 380
03:19:41.587803 IP lamp-ubuntu-s-1vcpu-1gb-tor1-01.ssh > bras-base-toroon0817w-grc-26-184-146-121-215.dsl.bell.ca.64650: Flags [P.], seq 148712:148932, ack 73, win 501, length 220
03:19:41.587854 IP lamp-ubuntu-s-1vcpu-1gb-tor1-01.ssh > bras-base-toroon0817w-grc-26-184-146-121-215.dsl.bell.ca.64650: Flags [P.], seq 148932:149152, ack 73, win 501, length 220
