root@lamp-ubuntu-s-1vcpu-1gb-tor1-01:~# tcpdump -i eth0 port 22
tcpdump: verbose output suppressed, use -v or -vv for full protocol decode
listening on eth0, link-type EN10MB (Ethernet), capture size 262144 bytes
03:20:06.030368 IP lamp-ubuntu-s-1vcpu-1gb-tor1-01.ssh > bras-base-toroon0817w-grc-26-184-146-121-215.dsl.bell.ca.64650: Flags [P.], seq 1416744119:1416744227, ack 1339834878, win 501, length 108
03:20:06.030451 IP lamp-ubuntu-s-1vcpu-1gb-tor1-01.ssh > bras-base-toroon0817w-grc-26-184-146-121-215.dsl.bell.ca.64650: Flags [P.], seq 108:252, ack 1, win 501, length 144
03:20:06.030528 IP lamp-ubuntu-s-1vcpu-1gb-tor1-01.ssh > bras-base-toroon0817w-grc-26-184-146-121-215.dsl.bell.ca.64650: Flags [P.], seq 252:288, ack 1, win 501, length 36
03:20:06.032183 IP bras-base-toroon0817w-grc-26-184-146-121-215.dsl.bell.ca.64650 > lamp-ubuntu-s-1vcpu-1gb-tor1-01.ssh: Flags [.], ack 108, win 1024, length 0
03:20:06.032183 IP bras-base-toroon0817w-grc-26-184-146-121-215.dsl.bell.ca.64650 > lamp-ubuntu-s-1vcpu-1gb-tor1-01.ssh: Flags [.], ack 288, win 1024, length 0
03:20:06.033420 IP lamp-ubuntu-s-1vcpu-1gb-tor1-01.ssh > bras-base-toroon0817w-grc-26-184-146-121-215.dsl.bell.ca.64650: Flags [P.], seq 288:524, ack 1, win 501, length 236
03:20:06.033493 IP lamp-ubuntu-s-1vcpu-1gb-tor1-01.ssh > bras-base-toroon0817w-grc-26-184-146-121-215.dsl.bell.ca.64650: Flags [P.], seq 524:772, ack 1, win 501, length 248
03:20:06.033553 IP lamp-ubuntu-s-1vcpu-1gb-tor1-01.ssh > bras-base-toroon0817w-grc-26-184-146-121-215.dsl.bell.ca.64650: Flags [P.], seq 772:1020, ack 1, win 501, length 248
03:20:06.033604 IP lamp-ubuntu-s-1vcpu-1gb-tor1-01.ssh > bras-base-toroon0817w-grc-26-184-146-121-215.dsl.bell.ca.64650: Flags [P.], seq 1020:1056, ack 1, win 501, length 36
03:20:06.033615 IP lamp-ubuntu-s-1vcpu-1gb-tor1-01.ssh > bras-base-toroon0817w-grc-26-184-146-121-215.dsl.bell.ca.64650: Flags [P.], seq 1056:1252, ack 1, win 501, length 196
03:20:06.033656 IP lamp-ubuntu-s-1vcpu-1gb-tor1-01.ssh > bras-base-toroon0817w-grc-26-184-146-121-215.dsl.bell.ca.64650: Flags [P.], seq 1252:1288, ack 1, win 501, length 36
03:20:06.033692 IP lamp-ubuntu-s-1vcpu-1gb-tor1-01.ssh > bras-base-toroon0817w-grc-26-184-146-121-215.dsl.bell.ca.64650: Flags [P.], seq 1288:1484, ack 1, win 501, length 196
03:20:06.033730 IP lamp-ubuntu-s-1vcpu-1gb-tor1-01.ssh > bras-base-toroon0817w-grc-26-184-146-121-215.dsl.bell.ca.64650: Flags [P.], seq 1484:1520, ack 1, win 501, length 36
03:20:06.033767 IP lamp-ubuntu-s-1vcpu-1gb-tor1-01.ssh > bras-base-toroon0817w-grc-26-184-146-121-215.dsl.bell.ca.64650: Flags [P.], seq 1520:1768, ack 1, win 501, length 248
03:20:06.033805 IP lamp-ubuntu-s-1vcpu-1gb-tor1-01.ssh > bras-base-toroon0817w-grc-26-184-146-121-215.dsl.bell.ca.64650: Flags [P.], seq 1768:1980, ack 1, win 501, length 212
03:20:06.035445 IP bras-base-toroon0817w-grc-26-184-146-121-215.dsl.bell.ca.64650 > lamp-ubuntu-s-1vcpu-1gb-tor1-01.ssh: Flags [.], ack 772, win 1022, length 0
03:20:06.035445 IP bras-base-toroon0817w-grc-26-184-146-121-215.dsl.bell.ca.64650 > lamp-ubuntu-s-1vcpu-1gb-tor1-01.ssh: Flags [.], ack 1056, win 1021, length 0
03:20:06.035445 IP bras-base-toroon0817w-grc-26-184-146-121-215.dsl.bell.ca.64650 > lamp-ubuntu-s-1vcpu-1gb-tor1-01.ssh: Flags [.], ack 1288, win 1026, length 0
03:20:06.035479 IP lamp-ubuntu-s-1vcpu-1gb-tor1-01.ssh > bras-base-toroon0817w-grc-26-184-146-121-215.dsl.bell.ca.64650: Flags [P.], seq 1980:4000, ack 1, win 501, length 2020
03:20:06.035546 IP bras-base-toroon0817w-grc-26-184-146-121-215.dsl.bell.ca.64650 > lamp-ubuntu-s-1vcpu-1gb-tor1-01.ssh: Flags [.], ack 1520, win 1025, length 0
03:20:06.035546 IP bras-base-toroon0817w-grc-26-184-146-121-215.dsl.bell.ca.64650 > lamp-ubuntu-s-1vcpu-1gb-tor1-01.ssh: Flags [.], ack 1980, win 1023, length 0
03:20:06.035575 IP lamp-ubuntu-s-1vcpu-1gb-tor1-01.ssh > bras-base-toroon0817w-grc-26-184-146-121-215.dsl.bell.ca.64650: Flags [P.], seq 4000:4196, ack 1, win 501, length 196
03:20:06.035643 IP lamp-ubuntu-s-1vcpu-1gb-tor1-01.ssh > bras-base-toroon0817w-grc-26-184-146-121-215.dsl.bell.ca.64650: Flags [P.], seq 4196:4232, ack 1, win 501, length 36
03:20:06.035728 IP lamp-ubuntu-s-1vcpu-1gb-tor1-01.ssh > bras-base-toroon0817w-grc-26-184-146-121-215.dsl.bell.ca.64650: Flags [P.], seq 4232:4428, ack 1, win 501, length 196
03:20:06.035785 IP lamp-ubuntu-s-1vcpu-1gb-tor1-01.ssh > bras-base-toroon0817w-grc-26-184-146-121-215.dsl.bell.ca.64650: Flags [P.], seq 4428:4660, ack 1, win 501, length 232
03:20:06.035850 IP lamp-ubuntu-s-1vcpu-1gb-tor1-01.ssh > bras-base-toroon0817w-grc-26-184-146-121-215.dsl.bell.ca.64650: Flags [P.], seq 4660:4908, ack 1, win 501, length 248
03:20:06.035907 IP lamp-ubuntu-s-1vcpu-1gb-tor1-01.ssh > bras-base-toroon0817w-grc-26-184-146-121-215.dsl.bell.ca.64650: Flags [P.], seq 4908:4944, ack 1, win 501, length 36
03:20:06.035933 IP lamp-ubuntu-s-1vcpu-1gb-tor1-01.ssh > bras-base-toroon0817w-grc-26-184-146-121-215.dsl.bell.ca.64650: Flags [P.], seq 4944:5140, ack 1, win 501, length 196
03:20:06.035960 IP lamp-ubuntu-s-1vcpu-1gb-tor1-01.ssh > bras-base-toroon0817w-grc-26-184-146-121-215.dsl.bell.ca.64650: Flags [P.], seq 5140:5176, ack 1, win 501, length 36
03:20:06.036001 IP lamp-ubuntu-s-1vcpu-1gb-tor1-01.ssh > bras-base-toroon0817w-grc-26-184-146-121-215.dsl.bell.ca.64650: Flags [P.], seq 5176:5372, ack 1, win 501, length 196
03:20:06.036035 IP lamp-ubuntu-s-1vcpu-1gb-tor1-01.ssh > bras-base-toroon0817w-grc-26-184-146-121-215.dsl.bell.ca.64650: Flags [P.], seq 5372:5408, ack 1, win 501, length 36
03:20:06.036072 IP lamp-ubuntu-s-1vcpu-1gb-tor1-01.ssh > bras-base-toroon0817w-grc-26-184-146-121-215.dsl.bell.ca.64650: Flags [P.], seq 5408:5620, ack 1, win 501, length 212
03:20:06.036108 IP lamp-ubuntu-s-1vcpu-1gb-tor1-01.ssh > bras-base-toroon0817w-grc-26-184-146-121-215.dsl.bell.ca.64650: Flags [P.], seq 5620:5868, ack 1, win 501, length 248
03:20:06.036149 IP lamp-ubuntu-s-1vcpu-1gb-tor1-01.ssh > bras-base-toroon0817w-grc-26-184-146-121-215.dsl.bell.ca.64650: Flags [P.], seq 5868:5904, ack 1, win 501, length 36
03:20:06.036182 IP lamp-ubuntu-s-1vcpu-1gb-tor1-01.ssh > bras-base-toroon0817w-grc-26-184-146-121-215.dsl.bell.ca.64650: Flags [P.], seq 5904:6116, ack 1, win 501, length 212
03:20:06.036218 IP lamp-ubuntu-s-1vcpu-1gb-tor1-01.ssh > bras-base-toroon0817w-grc-26-184-146-121-215.dsl.bell.ca.64650: Flags [P.], seq 6116:6152, ack 1, win 501, length 36
03:20:06.036256 IP lamp-ubuntu-s-1vcpu-1gb-tor1-01.ssh > bras-base-toroon0817w-grc-26-184-146-121-215.dsl.bell.ca.64650: Flags [P.], seq 6152:6400, ack 1, win 501, length 248
03:20:06.036292 IP lamp-ubuntu-s-1vcpu-1gb-tor1-01.ssh > bras-base-toroon0817w-grc-26-184-146-121-215.dsl.bell.ca.64650: Flags [P.], seq 6400:6612, ack 1, win 501, length 212
03:20:06.036329 IP lamp-ubuntu-s-1vcpu-1gb-tor1-01.ssh > bras-base-toroon0817w-grc-26-184-146-121-215.dsl.bell.ca.64650: Flags [P.], seq 6612:6648, ack 1, win 501, length 36
03:20:06.037164 IP bras-base-toroon0817w-grc-26-184-146-121-215.dsl.bell.ca.64650 > lamp-ubuntu-s-1vcpu-1gb-tor1-01.ssh: Flags [.], ack 1980, win 1023, options [nop,nop,sack 1 {3432:4000}], length 0
03:20:06.037188 IP lamp-ubuntu-s-1vcpu-1gb-tor1-01.ssh > bras-base-toroon0817w-grc-26-184-146-121-215.dsl.bell.ca.64650: Flags [P.], seq 6648:9552, ack 1, win 501, length 2904
03:20:06.037565 IP bras-base-toroon0817w-grc-26-184-146-121-215.dsl.bell.ca.64650 > lamp-ubuntu-s-1vcpu-1gb-tor1-01.ssh: Flags [.], ack 4000, win 1026, length 0
03:20:06.037582 IP lamp-ubuntu-s-1vcpu-1gb-tor1-01.ssh > bras-base-toroon0817w-grc-26-184-146-121-215.dsl.bell.ca.64650: Flags [P.], seq 9552:10392, ack 1, win 501, length 840
03:20:06.037643 IP lamp-ubuntu-s-1vcpu-1gb-tor1-01.ssh > bras-base-toroon0817w-grc-26-184-146-121-215.dsl.bell.ca.64650: Flags [P.], seq 10392:10588, ack 1, win 501, length 196
03:20:06.037653 IP bras-base-toroon0817w-grc-26-184-146-121-215.dsl.bell.ca.64650 > lamp-ubuntu-s-1vcpu-1gb-tor1-01.ssh: Flags [.], ack 4232, win 1025, length 0
03:20:06.037653 IP bras-base-toroon0817w-grc-26-184-146-121-215.dsl.bell.ca.64650 > lamp-ubuntu-s-1vcpu-1gb-tor1-01.ssh: Flags [.], ack 4660, win 1024, length 0
03:20:06.037695 IP lamp-ubuntu-s-1vcpu-1gb-tor1-01.ssh > bras-base-toroon0817w-grc-26-184-146-121-215.dsl.bell.ca.64650: Flags [P.], seq 10588:10624, ack 1, win 501, length 36
03:20:06.037716 IP lamp-ubuntu-s-1vcpu-1gb-tor1-01.ssh > bras-base-toroon0817w-grc-26-184-146-121-215.dsl.bell.ca.64650: Flags [P.], seq 10624:10836, ack 1, win 501, length 212
03:20:06.037748 IP lamp-ubuntu-s-1vcpu-1gb-tor1-01.ssh > bras-base-toroon0817w-grc-26-184-146-121-215.dsl.bell.ca.64650: Flags [P.], seq 10836:10872, ack 1, win 501, length 36
03:20:06.037791 IP lamp-ubuntu-s-1vcpu-1gb-tor1-01.ssh > bras-base-toroon0817w-grc-26-184-146-121-215.dsl.bell.ca.64650: Flags [P.], seq 10872:11084, ack 1, win 501, length 212
03:20:06.037797 IP bras-base-toroon0817w-grc-26-184-146-121-215.dsl.bell.ca.64650 > lamp-ubuntu-s-1vcpu-1gb-tor1-01.ssh: Flags [.], ack 4944, win 1022, length 0
03:20:06.037838 IP lamp-ubuntu-s-1vcpu-1gb-tor1-01.ssh > bras-base-toroon0817w-grc-26-184-146-121-215.dsl.bell.ca.64650: Flags [P.], seq 11084:11316, ack 1, win 501, length 232
03:20:06.037880 IP lamp-ubuntu-s-1vcpu-1gb-tor1-01.ssh > bras-base-toroon0817w-grc-26-184-146-121-215.dsl.bell.ca.64650: Flags [P.], seq 11316:11352, ack 1, win 501, length 36
03:20:06.037921 IP lamp-ubuntu-s-1vcpu-1gb-tor1-01.ssh > bras-base-toroon0817w-grc-26-184-146-121-215.dsl.bell.ca.64650: Flags [P.], seq 11352:11584, ack 1, win 501, length 232
03:20:06.037964 IP lamp-ubuntu-s-1vcpu-1gb-tor1-01.ssh > bras-base-toroon0817w-grc-26-184-146-121-215.dsl.bell.ca.64650: Flags [P.], seq 11584:11796, ack 1, win 501, length 212
03:20:06.038008 IP lamp-ubuntu-s-1vcpu-1gb-tor1-01.ssh > bras-base-toroon0817w-grc-26-184-146-121-215.dsl.bell.ca.64650: Flags [P.], seq 11796:12044, ack 1, win 501, length 248
03:20:06.038098 IP lamp-ubuntu-s-1vcpu-1gb-tor1-01.ssh > bras-base-toroon0817w-grc-26-184-146-121-215.dsl.bell.ca.64650: Flags [P.], seq 12044:12080, ack 1, win 501, length 36
03:20:06.038137 IP lamp-ubuntu-s-1vcpu-1gb-tor1-01.ssh > bras-base-toroon0817w-grc-26-184-146-121-215.dsl.bell.ca.64650: Flags [P.], seq 12080:12292, ack 1, win 501, length 212
03:20:06.038178 IP bras-base-toroon0817w-grc-26-184-146-121-215.dsl.bell.ca.64650 > lamp-ubuntu-s-1vcpu-1gb-tor1-01.ssh: Flags [.], ack 5176, win 1022, length 0
03:20:06.038178 IP bras-base-toroon0817w-grc-26-184-146-121-215.dsl.bell.ca.64650 > lamp-ubuntu-s-1vcpu-1gb-tor1-01.ssh: Flags [.], ack 5408, win 1021, length 0
03:20:06.038178 IP bras-base-toroon0817w-grc-26-184-146-121-215.dsl.bell.ca.64650 > lamp-ubuntu-s-1vcpu-1gb-tor1-01.ssh: Flags [.], ack 5868, win 1026, length 0
03:20:06.038178 IP bras-base-toroon0817w-grc-26-184-146-121-215.dsl.bell.ca.64650 > lamp-ubuntu-s-1vcpu-1gb-tor1-01.ssh: Flags [.], ack 6116, win 1025, length 0
03:20:06.038178 IP bras-base-toroon0817w-grc-26-184-146-121-215.dsl.bell.ca.64650 > lamp-ubuntu-s-1vcpu-1gb-tor1-01.ssh: Flags [.], ack 6400, win 1024, length 0
03:20:06.038190 IP lamp-ubuntu-s-1vcpu-1gb-tor1-01.ssh > bras-base-toroon0817w-grc-26-184-146-121-215.dsl.bell.ca.64650: Flags [P.], seq 12292:12328, ack 1, win 501, length 36
03:20:06.038229 IP lamp-ubuntu-s-1vcpu-1gb-tor1-01.ssh > bras-base-toroon0817w-grc-26-184-146-121-215.dsl.bell.ca.64650: Flags [P.], seq 12328:12540, ack 1, win 501, length 212
03:20:06.038279 IP lamp-ubuntu-s-1vcpu-1gb-tor1-01.ssh > bras-base-toroon0817w-grc-26-184-146-121-215.dsl.bell.ca.64650: Flags [P.], seq 12540:12772, ack 1, win 501, length 232
03:20:06.038291 IP bras-base-toroon0817w-grc-26-184-146-121-215.dsl.bell.ca.64650 > lamp-ubuntu-s-1vcpu-1gb-tor1-01.ssh: Flags [.], ack 6648, win 1023, length 0
03:20:06.038327 IP lamp-ubuntu-s-1vcpu-1gb-tor1-01.ssh > bras-base-toroon0817w-grc-26-184-146-121-215.dsl.bell.ca.64650: Flags [P.], seq 12772:12808, ack 1, win 501, length 36
03:20:06.038366 IP lamp-ubuntu-s-1vcpu-1gb-tor1-01.ssh > bras-base-toroon0817w-grc-26-184-146-121-215.dsl.bell.ca.64650: Flags [P.], seq 12808:13020, ack 1, win 501, length 212
03:20:06.038415 IP lamp-ubuntu-s-1vcpu-1gb-tor1-01.ssh > bras-base-toroon0817w-grc-26-184-146-121-215.dsl.bell.ca.64650: Flags [P.], seq 13020:13056, ack 1, win 501, length 36
03:20:06.038436 IP lamp-ubuntu-s-1vcpu-1gb-tor1-01.ssh > bras-base-toroon0817w-grc-26-184-146-121-215.dsl.bell.ca.64650: Flags [P.], seq 13056:13268, ack 1, win 501, length 212
03:20:06.038465 IP lamp-ubuntu-s-1vcpu-1gb-tor1-01.ssh > bras-base-toroon0817w-grc-26-184-146-121-215.dsl.bell.ca.64650: Flags [P.], seq 13268:13304, ack 1, win 501, length 36
03:20:06.038503 IP lamp-ubuntu-s-1vcpu-1gb-tor1-01.ssh > bras-base-toroon0817w-grc-26-184-146-121-215.dsl.bell.ca.64650: Flags [P.], seq 13304:13516, ack 1, win 501, length 212
03:20:06.038552 IP lamp-ubuntu-s-1vcpu-1gb-tor1-01.ssh > bras-base-toroon0817w-grc-26-184-146-121-215.dsl.bell.ca.64650: Flags [P.], seq 13516:13552, ack 1, win 501, length 36
03:20:06.038587 IP lamp-ubuntu-s-1vcpu-1gb-tor1-01.ssh > bras-base-toroon0817w-grc-26-184-146-121-215.dsl.bell.ca.64650: Flags [P.], seq 13552:13764, ack 1, win 501, length 212
03:20:06.038629 IP lamp-ubuntu-s-1vcpu-1gb-tor1-01.ssh > bras-base-toroon0817w-grc-26-184-146-121-215.dsl.bell.ca.64650: Flags [P.], seq 13764:14012, ack 1, win 501, length 248
03:20:06.038672 IP lamp-ubuntu-s-1vcpu-1gb-tor1-01.ssh > bras-base-toroon0817w-grc-26-184-146-121-215.dsl.bell.ca.64650: Flags [P.], seq 14012:14048, ack 1, win 501, length 36
03:20:06.038713 IP lamp-ubuntu-s-1vcpu-1gb-tor1-01.ssh > bras-base-toroon0817w-grc-26-184-146-121-215.dsl.bell.ca.64650: Flags [P.], seq 14048:14296, ack 1, win 501, length 248
03:20:06.038755 IP lamp-ubuntu-s-1vcpu-1gb-tor1-01.ssh > bras-base-toroon0817w-grc-26-184-146-121-215.dsl.bell.ca.64650: Flags [P.], seq 14296:14544, ack 1, win 501, length 248
03:20:06.038798 IP lamp-ubuntu-s-1vcpu-1gb-tor1-01.ssh > bras-base-toroon0817w-grc-26-184-146-121-215.dsl.bell.ca.64650: Flags [P.], seq 14544:14740, ack 1, win 501, length 196
03:20:06.038842 IP lamp-ubuntu-s-1vcpu-1gb-tor1-01.ssh > bras-base-toroon0817w-grc-26-184-146-121-215.dsl.bell.ca.64650: Flags [P.], seq 14740:14972, ack 1, win 501, length 232
03:20:06.038881 IP lamp-ubuntu-s-1vcpu-1gb-tor1-01.ssh > bras-base-toroon0817w-grc-26-184-146-121-215.dsl.bell.ca.64650: Flags [P.], seq 14972:15008, ack 1, win 501, length 36
03:20:06.038918 IP lamp-ubuntu-s-1vcpu-1gb-tor1-01.ssh > bras-base-toroon0817w-grc-26-184-146-121-215.dsl.bell.ca.64650: Flags [P.], seq 15008:15240, ack 1, win 501, length 232
03:20:06.038955 IP lamp-ubuntu-s-1vcpu-1gb-tor1-01.ssh > bras-base-toroon0817w-grc-26-184-146-121-215.dsl.bell.ca.64650: Flags [P.], seq 15240:15436, ack 1, win 501, length 196
03:20:06.038992 IP lamp-ubuntu-s-1vcpu-1gb-tor1-01.ssh > bras-base-toroon0817w-grc-26-184-146-121-215.dsl.bell.ca.64650: Flags [P.], seq 15436:15472, ack 1, win 501, length 36
03:20:06.039030 IP lamp-ubuntu-s-1vcpu-1gb-tor1-01.ssh > bras-base-toroon0817w-grc-26-184-146-121-215.dsl.bell.ca.64650: Flags [P.], seq 15472:15704, ack 1, win 501, length 232
03:20:06.039067 IP lamp-ubuntu-s-1vcpu-1gb-tor1-01.ssh > bras-base-toroon0817w-grc-26-184-146-121-215.dsl.bell.ca.64650: Flags [P.], seq 15704:15916, ack 1, win 501, length 212
03:20:06.039110 IP lamp-ubuntu-s-1vcpu-1gb-tor1-01.ssh > bras-base-toroon0817w-grc-26-184-146-121-215.dsl.bell.ca.64650: Flags [P.], seq 15916:15952, ack 1, win 501, length 36
03:20:06.039116 IP bras-base-toroon0817w-grc-26-184-146-121-215.dsl.bell.ca.64650 > lamp-ubuntu-s-1vcpu-1gb-tor1-01.ssh: Flags [.], ack 6648, win 1023, options [nop,nop,sack 1 {8100:9552}], length 0
03:20:06.039155 IP lamp-ubuntu-s-1vcpu-1gb-tor1-01.ssh > bras-base-toroon0817w-grc-26-184-146-121-215.dsl.bell.ca.64650: Flags [P.], seq 15952:16200, ack 1, win 501, length 248
03:20:06.039200 IP lamp-ubuntu-s-1vcpu-1gb-tor1-01.ssh > bras-base-toroon0817w-grc-26-184-146-121-215.dsl.bell.ca.64650: Flags [P.], seq 16200:16412, ack 1, win 501, length 212
03:20:06.039206 IP bras-base-toroon0817w-grc-26-184-146-121-215.dsl.bell.ca.64650 > lamp-ubuntu-s-1vcpu-1gb-tor1-01.ssh: Flags [.], ack 9552, win 1026, length 0
03:20:06.039206 IP bras-base-toroon0817w-grc-26-184-146-121-215.dsl.bell.ca.64650 > lamp-ubuntu-s-1vcpu-1gb-tor1-01.ssh: Flags [.], ack 10624, win 1022, length 0
03:20:06.039247 IP lamp-ubuntu-s-1vcpu-1gb-tor1-01.ssh > bras-base-toroon0817w-grc-26-184-146-121-215.dsl.bell.ca.64650: Flags [P.], seq 16412:16448, ack 1, win 501, length 36
03:20:06.039286 IP lamp-ubuntu-s-1vcpu-1gb-tor1-01.ssh > bras-base-toroon0817w-grc-26-184-146-121-215.dsl.bell.ca.64650: Flags [P.], seq 16448:16680, ack 1, win 501, length 232
03:20:06.039330 IP lamp-ubuntu-s-1vcpu-1gb-tor1-01.ssh > bras-base-toroon0817w-grc-26-184-146-121-215.dsl.bell.ca.64650: Flags [P.], seq 16680:16892, ack 1, win 501, length 212
03:20:06.039337 IP bras-base-toroon0817w-grc-26-184-146-121-215.dsl.bell.ca.64650 > lamp-ubuntu-s-1vcpu-1gb-tor1-01.ssh: Flags [.], ack 10872, win 1021, length 0
03:20:06.039337 IP bras-base-toroon0817w-grc-26-184-146-121-215.dsl.bell.ca.64650 > lamp-ubuntu-s-1vcpu-1gb-tor1-01.ssh: Flags [.], ack 11084, win 1026, length 0
03:20:06.039337 IP bras-base-toroon0817w-grc-26-184-146-121-215.dsl.bell.ca.64650 > lamp-ubuntu-s-1vcpu-1gb-tor1-01.ssh: Flags [.], ack 11352, win 1025, length 0
03:20:06.039422 IP lamp-ubuntu-s-1vcpu-1gb-tor1-01.ssh > bras-base-toroon0817w-grc-26-184-146-121-215.dsl.bell.ca.64650: Flags [P.], seq 16892:17176, ack 1, win 501, length 284
03:20:06.039471 IP lamp-ubuntu-s-1vcpu-1gb-tor1-01.ssh > bras-base-toroon0817w-grc-26-184-146-121-215.dsl.bell.ca.64650: Flags [P.], seq 17176:17424, ack 1, win 501, length 248
03:20:06.039522 IP lamp-ubuntu-s-1vcpu-1gb-tor1-01.ssh > bras-base-toroon0817w-grc-26-184-146-121-215.dsl.bell.ca.64650: Flags [P.], seq 17424:17636, ack 1, win 501, length 212
03:20:06.039568 IP lamp-ubuntu-s-1vcpu-1gb-tor1-01.ssh > bras-base-toroon0817w-grc-26-184-146-121-215.dsl.bell.ca.64650: Flags [P.], seq 17636:17672, ack 1, win 501, length 36
03:20:06.039617 IP lamp-ubuntu-s-1vcpu-1gb-tor1-01.ssh > bras-base-toroon0817w-grc-26-184-146-121-215.dsl.bell.ca.64650: Flags [P.], seq 17884:17920, ack 1, win 501, length 36
03:20:06.039668 IP lamp-ubuntu-s-1vcpu-1gb-tor1-01.ssh > bras-base-toroon0817w-grc-26-184-146-121-215.dsl.bell.ca.64650: Flags [P.], seq 17920:18168, ack 1, win 501, length 248
03:20:06.039755 IP lamp-ubuntu-s-1vcpu-1gb-tor1-01.ssh > bras-base-toroon0817w-grc-26-184-146-121-215.dsl.bell.ca.64650: Flags [P.], seq 18380:18416, ack 1, win 501, length 36
03:20:06.039797 IP lamp-ubuntu-s-1vcpu-1gb-tor1-01.ssh > bras-base-toroon0817w-grc-26-184-146-121-215.dsl.bell.ca.64650: Flags [P.], seq 18416:18664, ack 1, win 501, length 248
03:20:06.039895 IP lamp-ubuntu-s-1vcpu-1gb-tor1-01.ssh > bras-base-toroon0817w-grc-26-184-146-121-215.dsl.bell.ca.64650: Flags [P.], seq 18876:19124, ack 1, win 501, length 248
03:20:06.039938 IP lamp-ubuntu-s-1vcpu-1gb-tor1-01.ssh > bras-base-toroon0817w-grc-26-184-146-121-215.dsl.bell.ca.64650: Flags [P.], seq 19124:19160, ack 1, win 501, length 36
03:20:06.039989 IP lamp-ubuntu-s-1vcpu-1gb-tor1-01.ssh > bras-base-toroon0817w-grc-26-184-146-121-215.dsl.bell.ca.64650: Flags [P.], seq 19160:19408, ack 1, win 501, length 248
03:20:06.040063 IP lamp-ubuntu-s-1vcpu-1gb-tor1-01.ssh > bras-base-toroon0817w-grc-26-184-146-121-215.dsl.bell.ca.64650: Flags [P.], seq 19620:19868, ack 1, win 501, length 248
03:20:06.040140 IP lamp-ubuntu-s-1vcpu-1gb-tor1-01.ssh > bras-base-toroon0817w-grc-26-184-146-121-215.dsl.bell.ca.64650: Flags [P.], seq 19904:20116, ack 1, win 501, length 212
03:20:06.040172 IP lamp-ubuntu-s-1vcpu-1gb-tor1-01.ssh > bras-base-toroon0817w-grc-26-184-146-121-215.dsl.bell.ca.64650: Flags [P.], seq 20116:20152, ack 1, win 501, length 36
03:20:06.040245 IP lamp-ubuntu-s-1vcpu-1gb-tor1-01.ssh > bras-base-toroon0817w-grc-26-184-146-121-215.dsl.bell.ca.64650: Flags [P.], seq 20364:20612, ack 1, win 501, length 248
03:20:06.040284 IP lamp-ubuntu-s-1vcpu-1gb-tor1-01.ssh > bras-base-toroon0817w-grc-26-184-146-121-215.dsl.bell.ca.64650: Flags [P.], seq 20612:20648, ack 1, win 501, length 36
03:20:06.040327 IP lamp-ubuntu-s-1vcpu-1gb-tor1-01.ssh > bras-base-toroon0817w-grc-26-184-146-121-215.dsl.bell.ca.64650: Flags [P.], seq 20648:20896, ack 1, win 501, length 248
03:20:06.040410 IP lamp-ubuntu-s-1vcpu-1gb-tor1-01.ssh > bras-base-toroon0817w-grc-26-184-146-121-215.dsl.bell.ca.64650: Flags [P.], seq 21108:21144, ack 1, win 501, length 36
03:20:06.040540 IP lamp-ubuntu-s-1vcpu-1gb-tor1-01.ssh > bras-base-toroon0817w-grc-26-184-146-121-215.dsl.bell.ca.64650: Flags [P.], seq 21392:21604, ack 1, win 501, length 212
03:20:06.040618 IP lamp-ubuntu-s-1vcpu-1gb-tor1-01.ssh > bras-base-toroon0817w-grc-26-184-146-121-215.dsl.bell.ca.64650: Flags [P.], seq 21604:21852, ack 1, win 501, length 248
03:20:06.040674 IP lamp-ubuntu-s-1vcpu-1gb-tor1-01.ssh > bras-base-toroon0817w-grc-26-184-146-121-215.dsl.bell.ca.64650: Flags [P.], seq 21852:21888, ack 1, win 501, length 36
03:20:06.040781 IP lamp-ubuntu-s-1vcpu-1gb-tor1-01.ssh > bras-base-toroon0817w-grc-26-184-146-121-215.dsl.bell.ca.64650: Flags [P.], seq 22124:22160, ack 1, win 501, length 36
03:20:06.040871 IP lamp-ubuntu-s-1vcpu-1gb-tor1-01.ssh > bras-base-toroon0817w-grc-26-184-146-121-215.dsl.bell.ca.64650: Flags [P.], seq 22372:22408, ack 1, win 501, length 36
03:20:06.040930 IP lamp-ubuntu-s-1vcpu-1gb-tor1-01.ssh > bras-base-toroon0817w-grc-26-184-146-121-215.dsl.bell.ca.64650: Flags [P.], seq 22620:22656, ack 1, win 501, length 36
03:20:06.040968 IP lamp-ubuntu-s-1vcpu-1gb-tor1-01.ssh > bras-base-toroon0817w-grc-26-184-146-121-215.dsl.bell.ca.64650: Flags [P.], seq 22656:22888, ack 1, win 501, length 232
03:20:06.041040 IP lamp-ubuntu-s-1vcpu-1gb-tor1-01.ssh > bras-base-toroon0817w-grc-26-184-146-121-215.dsl.bell.ca.64650: Flags [P.], seq 23084:23120, ack 1, win 501, length 36
03:20:06.041114 IP lamp-ubuntu-s-1vcpu-1gb-tor1-01.ssh > bras-base-toroon0817w-grc-26-184-146-121-215.dsl.bell.ca.64650: Flags [P.], seq 23332:23580, ack 1, win 501, length 248
03:20:06.041150 IP lamp-ubuntu-s-1vcpu-1gb-tor1-01.ssh > bras-base-toroon0817w-grc-26-184-146-121-215.dsl.bell.ca.64650: Flags [P.], seq 23580:23616, ack 1, win 501, length 36
03:20:06.041225 IP lamp-ubuntu-s-1vcpu-1gb-tor1-01.ssh > bras-base-toroon0817w-grc-26-184-146-121-215.dsl.bell.ca.64650: Flags [P.], seq 23828:23864, ack 1, win 501, length 36
03:20:06.041297 IP lamp-ubuntu-s-1vcpu-1gb-tor1-01.ssh > bras-base-toroon0817w-grc-26-184-146-121-215.dsl.bell.ca.64650: Flags [P.], seq 24060:24096, ack 1, win 501, length 36
03:20:06.041418 IP lamp-ubuntu-s-1vcpu-1gb-tor1-01.ssh > bras-base-toroon0817w-grc-26-184-146-121-215.dsl.bell.ca.64650: Flags [P.], seq 24292:24328, ack 1, win 501, length 36
03:20:06.041544 IP lamp-ubuntu-s-1vcpu-1gb-tor1-01.ssh > bras-base-toroon0817w-grc-26-184-146-121-215.dsl.bell.ca.64650: Flags [P.], seq 24524:24560, ack 1, win 501, length 36
03:20:06.041631 IP lamp-ubuntu-s-1vcpu-1gb-tor1-01.ssh > bras-base-toroon0817w-grc-26-184-146-121-215.dsl.bell.ca.64650: Flags [P.], seq 24772:24808, ack 1, win 501, length 36
03:20:06.041686 IP lamp-ubuntu-s-1vcpu-1gb-tor1-01.ssh > bras-base-toroon0817w-grc-26-184-146-121-215.dsl.bell.ca.64650: Flags [P.], seq 25020:25056, ack 1, win 501, length 36
03:20:06.041775 IP lamp-ubuntu-s-1vcpu-1gb-tor1-01.ssh > bras-base-toroon0817w-grc-26-184-146-121-215.dsl.bell.ca.64650: Flags [P.], seq 25268:25516, ack 1, win 501, length 248
03:20:06.041817 IP lamp-ubuntu-s-1vcpu-1gb-tor1-01.ssh > bras-base-toroon0817w-grc-26-184-146-121-215.dsl.bell.ca.64650: Flags [P.], seq 25516:25764, ack 1, win 501, length 248
03:20:06.041861 IP lamp-ubuntu-s-1vcpu-1gb-tor1-01.ssh > bras-base-toroon0817w-grc-26-184-146-121-215.dsl.bell.ca.64650: Flags [P.], seq 25764:25800, ack 1, win 501, length 36
03:20:06.041902 IP lamp-ubuntu-s-1vcpu-1gb-tor1-01.ssh > bras-base-toroon0817w-grc-26-184-146-121-215.dsl.bell.ca.64650: Flags [P.], seq 25800:26048, ack 1, win 501, length 248
03:20:06.041994 IP lamp-ubuntu-s-1vcpu-1gb-tor1-01.ssh > bras-base-toroon0817w-grc-26-184-146-121-215.dsl.bell.ca.64650: Flags [P.], seq 26296:26508, ack 1, win 501, length 212
03:20:06.042032 IP lamp-ubuntu-s-1vcpu-1gb-tor1-01.ssh > bras-base-toroon0817w-grc-26-184-146-121-215.dsl.bell.ca.64650: Flags [P.], seq 26508:26544, ack 1, win 501, length 36
03:20:06.042140 IP lamp-ubuntu-s-1vcpu-1gb-tor1-01.ssh > bras-base-toroon0817w-grc-26-184-146-121-215.dsl.bell.ca.64650: Flags [P.], seq 26756:26792, ack 1, win 501, length 36
03:20:06.042229 IP lamp-ubuntu-s-1vcpu-1gb-tor1-01.ssh > bras-base-toroon0817w-grc-26-184-146-121-215.dsl.bell.ca.64650: Flags [P.], seq 27004:27040, ack 1, win 501, length 36
03:20:06.042335 IP lamp-ubuntu-s-1vcpu-1gb-tor1-01.ssh > bras-base-toroon0817w-grc-26-184-146-121-215.dsl.bell.ca.64650: Flags [P.], seq 27252:27288, ack 1, win 501, length 36
03:20:06.042426 IP lamp-ubuntu-s-1vcpu-1gb-tor1-01.ssh > bras-base-toroon0817w-grc-26-184-146-121-215.dsl.bell.ca.64650: Flags [P.], seq 27500:27748, ack 1, win 501, length 248
03:20:06.042472 IP lamp-ubuntu-s-1vcpu-1gb-tor1-01.ssh > bras-base-toroon0817w-grc-26-184-146-121-215.dsl.bell.ca.64650: Flags [P.], seq 27748:27784, ack 1, win 501, length 36
03:20:06.042522 IP lamp-ubuntu-s-1vcpu-1gb-tor1-01.ssh > bras-base-toroon0817w-grc-26-184-146-121-215.dsl.bell.ca.64650: Flags [P.], seq 27996:28032, ack 1, win 501, length 36
03:20:06.042633 IP lamp-ubuntu-s-1vcpu-1gb-tor1-01.ssh > bras-base-toroon0817w-grc-26-184-146-121-215.dsl.bell.ca.64650: Flags [P.], seq 28280:28492, ack 1, win 501, length 212
03:20:06.042667 IP lamp-ubuntu-s-1vcpu-1gb-tor1-01.ssh > bras-base-toroon0817w-grc-26-184-146-121-215.dsl.bell.ca.64650: Flags [P.], seq 28492:28528, ack 1, win 501, length 36
03:20:06.042737 IP lamp-ubuntu-s-1vcpu-1gb-tor1-01.ssh > bras-base-toroon0817w-grc-26-184-146-121-215.dsl.bell.ca.64650: Flags [P.], seq 28740:28776, ack 1, win 501, length 36
03:20:06.042777 IP lamp-ubuntu-s-1vcpu-1gb-tor1-01.ssh > bras-base-toroon0817w-grc-26-184-146-121-215.dsl.bell.ca.64650: Flags [P.], seq 28776:29024, ack 1, win 501, length 248
03:20:06.042864 IP lamp-ubuntu-s-1vcpu-1gb-tor1-01.ssh > bras-base-toroon0817w-grc-26-184-146-121-215.dsl.bell.ca.64650: Flags [P.], seq 29236:29484, ack 1, win 501, length 248
03:20:06.042915 IP lamp-ubuntu-s-1vcpu-1gb-tor1-01.ssh > bras-base-toroon0817w-grc-26-184-146-121-215.dsl.bell.ca.64650: Flags [P.], seq 29484:29520, ack 1, win 501, length 36
03:20:06.042963 IP lamp-ubuntu-s-1vcpu-1gb-tor1-01.ssh > bras-base-toroon0817w-grc-26-184-146-121-215.dsl.bell.ca.64650: Flags [P.], seq 29520:29768, ack 1, win 501, length 248
03:20:06.043045 IP lamp-ubuntu-s-1vcpu-1gb-tor1-01.ssh > bras-base-toroon0817w-grc-26-184-146-121-215.dsl.bell.ca.64650: Flags [P.], seq 29980:30016, ack 1, win 501, length 36
03:20:06.043118 IP lamp-ubuntu-s-1vcpu-1gb-tor1-01.ssh > bras-base-toroon0817w-grc-26-184-146-121-215.dsl.bell.ca.64650: Flags [P.], seq 30228:30264, ack 1, win 501, length 36
03:20:06.043157 IP lamp-ubuntu-s-1vcpu-1gb-tor1-01.ssh > bras-base-toroon0817w-grc-26-184-146-121-215.dsl.bell.ca.64650: Flags [P.], seq 30264:30476, ack 1, win 501, length 212
03:20:06.043228 IP lamp-ubuntu-s-1vcpu-1gb-tor1-01.ssh > bras-base-toroon0817w-grc-26-184-146-121-215.dsl.bell.ca.64650: Flags [P.], seq 30476:30688, ack 1, win 501, length 212
03:20:06.043260 IP lamp-ubuntu-s-1vcpu-1gb-tor1-01.ssh > bras-base-toroon0817w-grc-26-184-146-121-215.dsl.bell.ca.64650: Flags [P.], seq 30688:31084, ack 1, win 501, length 396
03:20:06.043314 IP lamp-ubuntu-s-1vcpu-1gb-tor1-01.ssh > bras-base-toroon0817w-grc-26-184-146-121-215.dsl.bell.ca.64650: Flags [P.], seq 31084:31296, ack 1, win 501, length 212
03:20:06.043341 IP lamp-ubuntu-s-1vcpu-1gb-tor1-01.ssh > bras-base-toroon0817w-grc-26-184-146-121-215.dsl.bell.ca.64650: Flags [P.], seq 31296:31516, ack 1, win 501, length 220
03:20:06.043404 IP bras-base-toroon0817w-grc-26-184-146-121-215.dsl.bell.ca.64650 > lamp-ubuntu-s-1vcpu-1gb-tor1-01.ssh: Flags [.], ack 25056, win 1022, length 0
03:20:06.043424 IP lamp-ubuntu-s-1vcpu-1gb-tor1-01.ssh > bras-base-toroon0817w-grc-26-184-146-121-215.dsl.bell.ca.64650: Flags [P.], seq 31516:31904, ack 1, win 501, length 388
03:20:06.043539 IP lamp-ubuntu-s-1vcpu-1gb-tor1-01.ssh > bras-base-toroon0817w-grc-26-184-146-121-215.dsl.bell.ca.64650: Flags [P.], seq 31904:33180, ack 1, win 501, length 1276
03:20:06.043621 IP lamp-ubuntu-s-1vcpu-1gb-tor1-01.ssh > bras-base-toroon0817w-grc-26-184-146-121-215.dsl.bell.ca.64650: Flags [P.], seq 33180:34104, ack 1, win 501, length 924
03:20:06.043631 IP bras-base-toroon0817w-grc-26-184-146-121-215.dsl.bell.ca.64650 > lamp-ubuntu-s-1vcpu-1gb-tor1-01.ssh: Flags [.], ack 26296, win 1026, length 0
03:20:06.043700 IP lamp-ubuntu-s-1vcpu-1gb-tor1-01.ssh > bras-base-toroon0817w-grc-26-184-146-121-215.dsl.bell.ca.64650: Flags [P.], seq 34104:34852, ack 1, win 501, length 748
03:20:06.043770 IP lamp-ubuntu-s-1vcpu-1gb-tor1-01.ssh > bras-base-toroon0817w-grc-26-184-146-121-215.dsl.bell.ca.64650: Flags [P.], seq 34852:35600, ack 1, win 501, length 748
03:20:06.043831 IP lamp-ubuntu-s-1vcpu-1gb-tor1-01.ssh > bras-base-toroon0817w-grc-26-184-146-121-215.dsl.bell.ca.64650: Flags [P.], seq 35600:36172, ack 1, win 501, length 572
03:20:06.043888 IP bras-base-toroon0817w-grc-26-184-146-121-215.dsl.bell.ca.64650 > lamp-ubuntu-s-1vcpu-1gb-tor1-01.ssh: Flags [.], ack 27252, win 1022, length 0
03:20:06.043909 IP lamp-ubuntu-s-1vcpu-1gb-tor1-01.ssh > bras-base-toroon0817w-grc-26-184-146-121-215.dsl.bell.ca.64650: Flags [P.], seq 36172:36920, ack 1, win 501, length 748
03:20:06.043980 IP lamp-ubuntu-s-1vcpu-1gb-tor1-01.ssh > bras-base-toroon0817w-grc-26-184-146-121-215.dsl.bell.ca.64650: Flags [P.], seq 36920:37652, ack 1, win 501, length 732
03:20:06.044030 IP bras-base-toroon0817w-grc-26-184-146-121-215.dsl.bell.ca.64650 > lamp-ubuntu-s-1vcpu-1gb-tor1-01.ssh: Flags [.], ack 28280, win 1026, length 0
03:20:06.044047 IP lamp-ubuntu-s-1vcpu-1gb-tor1-01.ssh > bras-base-toroon0817w-grc-26-184-146-121-215.dsl.bell.ca.64650: Flags [P.], seq 37652:38208, ack 1, win 501, length 556
03:20:06.044126 IP lamp-ubuntu-s-1vcpu-1gb-tor1-01.ssh > bras-base-toroon0817w-grc-26-184-146-121-215.dsl.bell.ca.64650: Flags [P.], seq 38208:39124, ack 1, win 501, length 916
03:20:06.044184 IP lamp-ubuntu-s-1vcpu-1gb-tor1-01.ssh > bras-base-toroon0817w-grc-26-184-146-121-215.dsl.bell.ca.64650: Flags [P.], seq 39124:39680, ack 1, win 501, length 556
03:20:06.044269 IP lamp-ubuntu-s-1vcpu-1gb-tor1-01.ssh > bras-base-toroon0817w-grc-26-184-146-121-215.dsl.bell.ca.64650: Flags [P.], seq 39680:40076, ack 1, win 501, length 396
03:20:06.044338 IP lamp-ubuntu-s-1vcpu-1gb-tor1-01.ssh > bras-base-toroon0817w-grc-26-184-146-121-215.dsl.bell.ca.64650: Flags [P.], seq 40076:40288, ack 1, win 501, length 212
03:20:06.044399 IP bras-base-toroon0817w-grc-26-184-146-121-215.dsl.bell.ca.64650 > lamp-ubuntu-s-1vcpu-1gb-tor1-01.ssh: Flags [.], ack 29236, win 1022, length 0
03:20:06.044406 IP lamp-ubuntu-s-1vcpu-1gb-tor1-01.ssh > bras-base-toroon0817w-grc-26-184-146-121-215.dsl.bell.ca.64650: Flags [P.], seq 40288:40500, ack 1, win 501, length 212
03:20:06.044465 IP lamp-ubuntu-s-1vcpu-1gb-tor1-01.ssh > bras-base-toroon0817w-grc-26-184-146-121-215.dsl.bell.ca.64650: Flags [P.], seq 40500:40880, ack 1, win 501, length 380
03:20:06.044525 IP lamp-ubuntu-s-1vcpu-1gb-tor1-01.ssh > bras-base-toroon0817w-grc-26-184-146-121-215.dsl.bell.ca.64650: Flags [P.], seq 40880:41092, ack 1, win 501, length 212
03:20:06.044578 IP lamp-ubuntu-s-1vcpu-1gb-tor1-01.ssh > bras-base-toroon0817w-grc-26-184-146-121-215.dsl.bell.ca.64650: Flags [P.], seq 41092:41304, ack 1, win 501, length 212
03:20:06.044630 IP bras-base-toroon0817w-grc-26-184-146-121-215.dsl.bell.ca.64650 > lamp-ubuntu-s-1vcpu-1gb-tor1-01.ssh: Flags [.], ack 30264, win 1026, length 0
03:20:06.044639 IP lamp-ubuntu-s-1vcpu-1gb-tor1-01.ssh > bras-base-toroon0817w-grc-26-184-146-121-215.dsl.bell.ca.64650: Flags [P.], seq 41304:41516, ack 1, win 501, length 212
03:20:06.044697 IP lamp-ubuntu-s-1vcpu-1gb-tor1-01.ssh > bras-base-toroon0817w-grc-26-184-146-121-215.dsl.bell.ca.64650: Flags [P.], seq 41516:41896, ack 1, win 501, length 380
03:20:06.044750 IP lamp-ubuntu-s-1vcpu-1gb-tor1-01.ssh > bras-base-toroon0817w-grc-26-184-146-121-215.dsl.bell.ca.64650: Flags [P.], seq 41896:42108, ack 1, win 501, length 212
03:20:06.044762 IP bras-base-toroon0817w-grc-26-184-146-121-215.dsl.bell.ca.64650 > lamp-ubuntu-s-1vcpu-1gb-tor1-01.ssh: Flags [.], ack 31516, win 1021, length 0
03:20:06.044825 IP lamp-ubuntu-s-1vcpu-1gb-tor1-01.ssh > bras-base-toroon0817w-grc-26-184-146-121-215.dsl.bell.ca.64650: Flags [P.], seq 42108:42488, ack 1, win 501, length 380
03:20:06.044892 IP lamp-ubuntu-s-1vcpu-1gb-tor1-01.ssh > bras-base-toroon0817w-grc-26-184-146-121-215.dsl.bell.ca.64650: Flags [P.], seq 42488:42700, ack 1, win 501, length 212
03:20:06.044947 IP lamp-ubuntu-s-1vcpu-1gb-tor1-01.ssh > bras-base-toroon0817w-grc-26-184-146-121-215.dsl.bell.ca.64650: Flags [P.], seq 42700:42912, ack 1, win 501, length 212
03:20:06.045003 IP lamp-ubuntu-s-1vcpu-1gb-tor1-01.ssh > bras-base-toroon0817w-grc-26-184-146-121-215.dsl.bell.ca.64650: Flags [P.], seq 42912:43124, ack 1, win 501, length 212
03:20:06.045056 IP lamp-ubuntu-s-1vcpu-1gb-tor1-01.ssh > bras-base-toroon0817w-grc-26-184-146-121-215.dsl.bell.ca.64650: Flags [P.], seq 43124:43336, ack 1, win 501, length 212
03:20:06.045112 IP lamp-ubuntu-s-1vcpu-1gb-tor1-01.ssh > bras-base-toroon0817w-grc-26-184-146-121-215.dsl.bell.ca.64650: Flags [P.], seq 43336:43548, ack 1, win 501, length 212
03:20:06.045170 IP lamp-ubuntu-s-1vcpu-1gb-tor1-01.ssh > bras-base-toroon0817w-grc-26-184-146-121-215.dsl.bell.ca.64650: Flags [P.], seq 43548:43760, ack 1, win 501, length 212
03:20:06.045183 IP bras-base-toroon0817w-grc-26-184-146-121-215.dsl.bell.ca.64650 > lamp-ubuntu-s-1vcpu-1gb-tor1-01.ssh: Flags [.], ack 31904, win 1026, length 0
03:20:06.045232 IP lamp-ubuntu-s-1vcpu-1gb-tor1-01.ssh > bras-base-toroon0817w-grc-26-184-146-121-215.dsl.bell.ca.64650: Flags [P.], seq 43760:44140, ack 1, win 501, length 380
03:20:06.045285 IP lamp-ubuntu-s-1vcpu-1gb-tor1-01.ssh > bras-base-toroon0817w-grc-26-184-146-121-215.dsl.bell.ca.64650: Flags [P.], seq 44140:44352, ack 1, win 501, length 212
03:20:06.045337 IP lamp-ubuntu-s-1vcpu-1gb-tor1-01.ssh > bras-base-toroon0817w-grc-26-184-146-121-215.dsl.bell.ca.64650: Flags [P.], seq 44352:44564, ack 1, win 501, length 212
03:20:06.045435 IP bras-base-toroon0817w-grc-26-184-146-121-215.dsl.bell.ca.64650 > lamp-ubuntu-s-1vcpu-1gb-tor1-01.ssh: Flags [.], ack 34104, win 1026, length 0
03:20:06.045446 IP lamp-ubuntu-s-1vcpu-1gb-tor1-01.ssh > bras-base-toroon0817w-grc-26-184-146-121-215.dsl.bell.ca.64650: Flags [P.], seq 44564:44776, ack 1, win 501, length 212
03:20:06.045509 IP lamp-ubuntu-s-1vcpu-1gb-tor1-01.ssh > bras-base-toroon0817w-grc-26-184-146-121-215.dsl.bell.ca.64650: Flags [P.], seq 44776:45156, ack 1, win 501, length 380
03:20:06.045566 IP lamp-ubuntu-s-1vcpu-1gb-tor1-01.ssh > bras-base-toroon0817w-grc-26-184-146-121-215.dsl.bell.ca.64650: Flags [P.], seq 45156:45368, ack 1, win 501, length 212
03:20:06.045623 IP lamp-ubuntu-s-1vcpu-1gb-tor1-01.ssh > bras-base-toroon0817w-grc-26-184-146-121-215.dsl.bell.ca.64650: Flags [P.], seq 45368:45580, ack 1, win 501, length 212
03:20:06.045635 IP bras-base-toroon0817w-grc-26-184-146-121-215.dsl.bell.ca.64650 > lamp-ubuntu-s-1vcpu-1gb-tor1-01.ssh: Flags [.], ack 36920, win 1026, length 0
03:20:06.045684 IP lamp-ubuntu-s-1vcpu-1gb-tor1-01.ssh > bras-base-toroon0817w-grc-26-184-146-121-215.dsl.bell.ca.64650: Flags [P.], seq 45580:45960, ack 1, win 501, length 380
03:20:06.045736 IP lamp-ubuntu-s-1vcpu-1gb-tor1-01.ssh > bras-base-toroon0817w-grc-26-184-146-121-215.dsl.bell.ca.64650: Flags [P.], seq 45960:46172, ack 1, win 501, length 212
03:20:06.045787 IP lamp-ubuntu-s-1vcpu-1gb-tor1-01.ssh > bras-base-toroon0817w-grc-26-184-146-121-215.dsl.bell.ca.64650: Flags [P.], seq 46172:46384, ack 1, win 501, length 212
03:20:06.045838 IP lamp-ubuntu-s-1vcpu-1gb-tor1-01.ssh > bras-base-toroon0817w-grc-26-184-146-121-215.dsl.bell.ca.64650: Flags [P.], seq 46384:46596, ack 1, win 501, length 212
03:20:06.045891 IP lamp-ubuntu-s-1vcpu-1gb-tor1-01.ssh > bras-base-toroon0817w-grc-26-184-146-121-215.dsl.bell.ca.64650: Flags [P.], seq 46596:46808, ack 1, win 501, length 212
03:20:06.045942 IP lamp-ubuntu-s-1vcpu-1gb-tor1-01.ssh > bras-base-toroon0817w-grc-26-184-146-121-215.dsl.bell.ca.64650: Flags [P.], seq 46808:47020, ack 1, win 501, length 212
03:20:06.045993 IP lamp-ubuntu-s-1vcpu-1gb-tor1-01.ssh > bras-base-toroon0817w-grc-26-184-146-121-215.dsl.bell.ca.64650: Flags [P.], seq 47020:47232, ack 1, win 501, length 212
03:20:06.046044 IP bras-base-toroon0817w-grc-26-184-146-121-215.dsl.bell.ca.64650 > lamp-ubuntu-s-1vcpu-1gb-tor1-01.ssh: Flags [.], ack 40288, win 1026, length 0
03:20:06.046059 IP lamp-ubuntu-s-1vcpu-1gb-tor1-01.ssh > bras-base-toroon0817w-grc-26-184-146-121-215.dsl.bell.ca.64650: Flags [P.], seq 47232:47444, ack 1, win 501, length 212
03:20:06.046112 IP lamp-ubuntu-s-1vcpu-1gb-tor1-01.ssh > bras-base-toroon0817w-grc-26-184-146-121-215.dsl.bell.ca.64650: Flags [P.], seq 47444:47824, ack 1, win 501, length 380
03:20:06.046169 IP lamp-ubuntu-s-1vcpu-1gb-tor1-01.ssh > bras-base-toroon0817w-grc-26-184-146-121-215.dsl.bell.ca.64650: Flags [P.], seq 47824:48036, ack 1, win 501, length 212
03:20:06.046225 IP lamp-ubuntu-s-1vcpu-1gb-tor1-01.ssh > bras-base-toroon0817w-grc-26-184-146-121-215.dsl.bell.ca.64650: Flags [P.], seq 48036:48248, ack 1, win 501, length 212
03:20:06.046282 IP lamp-ubuntu-s-1vcpu-1gb-tor1-01.ssh > bras-base-toroon0817w-grc-26-184-146-121-215.dsl.bell.ca.64650: Flags [P.], seq 48248:48460, ack 1, win 501, length 212
03:20:06.046292 IP bras-base-toroon0817w-grc-26-184-146-121-215.dsl.bell.ca.64650 > lamp-ubuntu-s-1vcpu-1gb-tor1-01.ssh: Flags [.], ack 41896, win 1026, length 0
03:20:06.046341 IP lamp-ubuntu-s-1vcpu-1gb-tor1-01.ssh > bras-base-toroon0817w-grc-26-184-146-121-215.dsl.bell.ca.64650: Flags [P.], seq 48460:48840, ack 1, win 501, length 380
03:20:06.046400 IP lamp-ubuntu-s-1vcpu-1gb-tor1-01.ssh > bras-base-toroon0817w-grc-26-184-146-121-215.dsl.bell.ca.64650: Flags [P.], seq 48840:49052, ack 1, win 501, length 212
03:20:06.046457 IP lamp-ubuntu-s-1vcpu-1gb-tor1-01.ssh > bras-base-toroon0817w-grc-26-184-146-121-215.dsl.bell.ca.64650: Flags [P.], seq 49052:49264, ack 1, win 501, length 212
03:20:06.046509 IP lamp-ubuntu-s-1vcpu-1gb-tor1-01.ssh > bras-base-toroon0817w-grc-26-184-146-121-215.dsl.bell.ca.64650: Flags [P.], seq 49264:49476, ack 1, win 501, length 212
03:20:06.046520 IP bras-base-toroon0817w-grc-26-184-146-121-215.dsl.bell.ca.64650 > lamp-ubuntu-s-1vcpu-1gb-tor1-01.ssh: Flags [.], ack 43124, win 1021, length 0
03:20:06.046571 IP lamp-ubuntu-s-1vcpu-1gb-tor1-01.ssh > bras-base-toroon0817w-grc-26-184-146-121-215.dsl.bell.ca.64650: Flags [P.], seq 49476:49856, ack 1, win 501, length 380
03:20:06.046621 IP lamp-ubuntu-s-1vcpu-1gb-tor1-01.ssh > bras-base-toroon0817w-grc-26-184-146-121-215.dsl.bell.ca.64650: Flags [P.], seq 49856:50068, ack 1, win 501, length 212
03:20:06.046631 IP bras-base-toroon0817w-grc-26-184-146-121-215.dsl.bell.ca.64650 > lamp-ubuntu-s-1vcpu-1gb-tor1-01.ssh: Flags [.], ack 44352, win 1026, length 0
03:20:06.046679 IP lamp-ubuntu-s-1vcpu-1gb-tor1-01.ssh > bras-base-toroon0817w-grc-26-184-146-121-215.dsl.bell.ca.64650: Flags [P.], seq 50068:50448, ack 1, win 501, length 380
03:20:06.046732 IP lamp-ubuntu-s-1vcpu-1gb-tor1-01.ssh > bras-base-toroon0817w-grc-26-184-146-121-215.dsl.bell.ca.64650: Flags [P.], seq 50448:50660, ack 1, win 501, length 212
03:20:06.046789 IP lamp-ubuntu-s-1vcpu-1gb-tor1-01.ssh > bras-base-toroon0817w-grc-26-184-146-121-215.dsl.bell.ca.64650: Flags [P.], seq 50660:50872, ack 1, win 501, length 212
