03:19:10.296800 IP 184.146.121.215.64650 > 159.203.21.7.22: Flags [.], ack 2719940, win 826, length 0
03:19:10.296849 IP 159.203.21.7.22 > 184.146.121.215.64650: Flags [P.], seq 2724684:2724944, ack 397, win 501, length 260
03:19:10.296909 IP 159.203.21.7.22 > 184.146.121.215.64650: Flags [P.], seq 2724944:2725108, ack 397, win 501, length 164
03:19:10.296977 IP 159.203.21.7.22 > 184.146.121.215.64650: Flags [P.], seq 2725108:2725272, ack 397, win 501, length 164
03:19:10.297035 IP 159.203.21.7.22 > 184.146.121.215.64650: Flags [P.], seq 2725272:2725436, ack 397, win 501, length 164
03:19:10.297086 IP 159.203.21.7.22 > 184.146.121.215.64650: Flags [P.], seq 2725436:2725600, ack 397, win 501, length 164
03:19:10.297137 IP 159.203.21.7.22 > 184.146.121.215.64650: Flags [P.], seq 2725600:2725764, ack 397, win 501, length 164
03:19:10.297190 IP 159.203.21.7.22 > 184.146.121.215.64650: Flags [P.], seq 2725764:2725928, ack 397, win 501, length 164
03:19:10.297200 IP 184.146.121.215.64650 > 159.203.21.7.22: Flags [.], ack 2720952, win 823, length 0
03:19:10.297249 IP 159.203.21.7.22 > 184.146.121.215.64650: Flags [P.], seq 2725928:2726188, ack 397, win 501, length 260
03:19:10.297304 IP 184.146.121.215.64650 > 159.203.21.7.22: Flags [.], ack 2721772, win 819, length 0
03:19:10.297312 IP 159.203.21.7.22 > 184.146.121.215.64650: Flags [P.], seq 2726188:2726352, ack 397, win 501, length 164
03:19:10.297374 IP 159.203.21.7.22 > 184.146.121.215.64650: Flags [P.], seq 2726352:2726612, ack 397, win 501, length 260
03:19:10.297464 IP 159.203.21.7.22 > 184.146.121.215.64650: Flags [P.], seq 2726612:2726776, ack 397, win 501, length 164
03:19:10.297524 IP 159.203.21.7.22 > 184.146.121.215.64650: Flags [P.], seq 2726776:2726940, ack 397, win 501, length 164
03:19:10.297585 IP 159.203.21.7.22 > 184.146.121.215.64650: Flags [P.], seq 2726940:2727104, ack 397, win 501, length 164
03:19:10.297643 IP 159.203.21.7.22 > 184.146.121.215.64650: Flags [P.], seq 2727104:2727268, ack 397, win 501, length 164
03:19:10.297696 IP 159.203.21.7.22 > 184.146.121.215.64650: Flags [P.], seq 2727268:2727432, ack 397, win 501, length 164
03:19:10.297706 IP 184.146.121.215.64650 > 159.203.21.7.22: Flags [.], ack 2722688, win 816, length 0
03:19:10.297756 IP 159.203.21.7.22 > 184.146.121.215.64650: Flags [P.], seq 2727432:2727692, ack 397, win 501, length 260
03:19:10.297807 IP 159.203.21.7.22 > 184.146.121.215.64650: Flags [P.], seq 2727692:2727856, ack 397, win 501, length 164
03:19:10.297856 IP 159.203.21.7.22 > 184.146.121.215.64650: Flags [P.], seq 2727856:2728020, ack 397, win 501, length 164
03:19:10.297907 IP 159.203.21.7.22 > 184.146.121.215.64650: Flags [P.], seq 2728020:2728184, ack 397, win 501, length 164
03:19:10.297956 IP 159.203.21.7.22 > 184.146.121.215.64650: Flags [P.], seq 2728184:2728348, ack 397, win 501, length 164
03:19:10.298007 IP 159.203.21.7.22 > 184.146.121.215.64650: Flags [P.], seq 2728348:2728512, ack 397, win 501, length 164
03:19:10.298058 IP 184.146.121.215.64650 > 159.203.21.7.22: Flags [.], ack 2723440, win 813, length 0
03:19:10.298064 IP 159.203.21.7.22 > 184.146.121.215.64650: Flags [P.], seq 2728512:2728676, ack 397, win 501, length 164
03:19:10.298118 IP 159.203.21.7.22 > 184.146.121.215.64650: Flags [P.], seq 2728676:2728936, ack 397, win 501, length 260
03:19:10.298181 IP 159.203.21.7.22 > 184.146.121.215.64650: Flags [P.], seq 2728936:2729100, ack 397, win 501, length 164
03:19:10.298244 IP 159.203.21.7.22 > 184.146.121.215.64650: Flags [P.], seq 2729100:2729264, ack 397, win 501, length 164
03:19:10.298305 IP 159.203.21.7.22 > 184.146.121.215.64650: Flags [P.], seq 2729264:2729428, ack 397, win 501, length 164
03:19:10.298366 IP 159.203.21.7.22 > 184.146.121.215.64650: Flags [P.], seq 2729428:2729592, ack 397, win 501, length 164
03:19:10.298433 IP 159.203.21.7.22 > 184.146.121.215.64650: Flags [P.], seq 2729592:2729756, ack 397, win 501, length 164
03:19:10.298497 IP 184.146.121.215.64650 > 159.203.21.7.22: Flags [.], ack 2724520, win 809, length 0
03:19:10.298505 IP 159.203.21.7.22 > 184.146.121.215.64650: Flags [P.], seq 2729756:2729920, ack 397, win 501, length 164
03:19:10.298598 IP 159.203.21.7.22 > 184.146.121.215.64650: Flags [P.], seq 2729920:2730180, ack 397, win 501, length 260
03:19:10.298653 IP 159.203.21.7.22 > 184.146.121.215.64650: Flags [P.], seq 2730180:2730344, ack 397, win 501, length 164
03:19:10.298666 IP 184.146.121.215.64650 > 159.203.21.7.22: Flags [.], ack 2725436, win 805, length 0
03:19:10.298711 IP 159.203.21.7.22 > 184.146.121.215.64650: Flags [P.], seq 2730344:2730604, ack 397, win 501, length 260
03:19:10.298775 IP 159.203.21.7.22 > 184.146.121.215.64650: Flags [P.], seq 2730604:2730768, ack 397, win 501, length 164
03:19:10.298835 IP 159.203.21.7.22 > 184.146.121.215.64650: Flags [P.], seq 2730768:2730932, ack 397, win 501, length 164
03:19:10.298848 IP 184.146.121.215.64650 > 159.203.21.7.22: Flags [.], ack 2726352, win 801, length 0
03:19:10.298897 IP 159.203.21.7.22 > 184.146.121.215.64650: Flags [P.], seq 2730932:2731192, ack 397, win 501, length 260
03:19:10.298959 IP 159.203.21.7.22 > 184.146.121.215.64650: Flags [P.], seq 2731192:2731356, ack 397, win 501, length 164
03:19:10.299021 IP 159.203.21.7.22 > 184.146.121.215.64650: Flags [P.], seq 2731356:2731520, ack 397, win 501, length 164
03:19:10.299083 IP 159.203.21.7.22 > 184.146.121.215.64650: Flags [P.], seq 2731520:2731684, ack 397, win 501, length 164
03:19:10.299145 IP 159.203.21.7.22 > 184.146.121.215.64650: Flags [P.], seq 2731684:2731848, ack 397, win 501, length 164
03:19:10.299208 IP 159.203.21.7.22 > 184.146.121.215.64650: Flags [P.], seq 2731848:2732012, ack 397, win 501, length 164
03:19:10.299220 IP 184.146.121.215.64650 > 159.203.21.7.22: Flags [.], ack 2727268, win 798, length 0
03:19:10.299268 IP 159.203.21.7.22 > 184.146.121.215.64650: Flags [P.], seq 2732012:2732272, ack 397, win 501, length 260
03:19:10.299333 IP 159.203.21.7.22 > 184.146.121.215.64650: Flags [P.], seq 2732272:2732436, ack 397, win 501, length 164
03:19:10.299397 IP 159.203.21.7.22 > 184.146.121.215.64650: Flags [P.], seq 2732436:2732600, ack 397, win 501, length 164
03:19:10.299466 IP 159.203.21.7.22 > 184.146.121.215.64650: Flags [P.], seq 2732600:2732764, ack 397, win 501, length 164
03:19:10.299481 IP 184.146.121.215.64650 > 159.203.21.7.22: Flags [.], ack 2728184, win 794, length 0
03:19:10.299531 IP 159.203.21.7.22 > 184.146.121.215.64650: Flags [P.], seq 2732764:2733024, ack 397, win 501, length 260
03:19:10.299540 IP 184.146.121.215.64650 > 159.203.21.7.22: Flags [.], ack 2729100, win 791, length 0
03:19:10.299591 IP 159.203.21.7.22 > 184.146.121.215.64650: Flags [P.], seq 2733024:2733284, ack 397, win 501, length 260
03:19:10.299643 IP 159.203.21.7.22 > 184.146.121.215.64650: Flags [P.], seq 2733284:2733448, ack 397, win 501, length 164
03:19:10.299694 IP 159.203.21.7.22 > 184.146.121.215.64650: Flags [P.], seq 2733448:2733612, ack 397, win 501, length 164
03:19:10.299745 IP 159.203.21.7.22 > 184.146.121.215.64650: Flags [P.], seq 2733612:2733776, ack 397, win 501, length 164
03:19:10.299797 IP 159.203.21.7.22 > 184.146.121.215.64650: Flags [P.], seq 2733776:2733940, ack 397, win 501, length 164
03:19:10.299858 IP 159.203.21.7.22 > 184.146.121.215.64650: Flags [P.], seq 2733940:2734104, ack 397, win 501, length 164
03:19:10.299911 IP 159.203.21.7.22 > 184.146.121.215.64650: Flags [P.], seq 2734104:2734268, ack 397, win 501, length 164
03:19:10.299928 IP 184.146.121.215.64650 > 159.203.21.7.22: Flags [.], ack 2729756, win 788, length 0
03:19:10.299974 IP 159.203.21.7.22 > 184.146.121.215.64650: Flags [P.], seq 2734268:2734528, ack 397, win 501, length 260
03:19:10.300025 IP 159.203.21.7.22 > 184.146.121.215.64650: Flags [P.], seq 2734528:2734692, ack 397, win 501, length 164
03:19:10.300076 IP 159.203.21.7.22 > 184.146.121.215.64650: Flags [P.], seq 2734692:2734856, ack 397, win 501, length 164
03:19:10.300128 IP 159.203.21.7.22 > 184.146.121.215.64650: Flags [P.], seq 2734856:2735020, ack 397, win 501, length 164
03:19:10.300180 IP 159.203.21.7.22 > 184.146.121.215.64650: Flags [P.], seq 2735020:2735184, ack 397, win 501, length 164
03:19:10.300192 IP 184.146.121.215.64650 > 159.203.21.7.22: Flags [.], ack 2730344, win 786, length 0
03:19:10.300240 IP 159.203.21.7.22 > 184.146.121.215.64650: Flags [P.], seq 2735184:2735444, ack 397, win 501, length 260
03:19:10.300292 IP 159.203.21.7.22 > 184.146.121.215.64650: Flags [P.], seq 2735444:2735608, ack 397, win 501, length 164
03:19:10.300344 IP 159.203.21.7.22 > 184.146.121.215.64650: Flags [P.], seq 2735608:2735772, ack 397, win 501, length 164
03:19:10.300398 IP 159.203.21.7.22 > 184.146.121.215.64650: Flags [P.], seq 2735772:2735936, ack 397, win 501, length 164
03:19:10.300457 IP 184.146.121.215.64650 > 159.203.21.7.22: Flags [.], ack 2731356, win 782, length 0
03:19:10.300467 IP 159.203.21.7.22 > 184.146.121.215.64650: Flags [P.], seq 2735936:2736100, ack 397, win 501, length 164
03:19:10.300535 IP 159.203.21.7.22 > 184.146.121.215.64650: Flags [P.], seq 2736100:2736360, ack 397, win 501, length 260
03:19:10.300587 IP 159.203.21.7.22 > 184.146.121.215.64650: Flags [P.], seq 2736360:2736524, ack 397, win 501, length 164
03:19:10.300641 IP 159.203.21.7.22 > 184.146.121.215.64650: Flags [P.], seq 2736524:2736688, ack 397, win 501, length 164
03:19:10.300707 IP 159.203.21.7.22 > 184.146.121.215.64650: Flags [P.], seq 2736688:2736852, ack 397, win 501, length 164
03:19:10.300720 IP 184.146.121.215.64650 > 159.203.21.7.22: Flags [.], ack 2732012, win 779, length 0
03:19:10.300770 IP 159.203.21.7.22 > 184.146.121.215.64650: Flags [P.], seq 2736852:2737112, ack 397, win 501, length 260
03:19:10.300823 IP 159.203.21.7.22 > 184.146.121.215.64650: Flags [P.], seq 2737112:2737276, ack 397, win 501, length 164
03:19:10.300874 IP 159.203.21.7.22 > 184.146.121.215.64650: Flags [P.], seq 2737276:2737440, ack 397, win 501, length 164
03:19:10.300936 IP 159.203.21.7.22 > 184.146.121.215.64650: Flags [P.], seq 2737440:2737604, ack 397, win 501, length 164
03:19:10.300991 IP 159.203.21.7.22 > 184.146.121.215.64650: Flags [P.], seq 2737604:2737768, ack 397, win 501, length 164
03:19:10.301043 IP 159.203.21.7.22 > 184.146.121.215.64650: Flags [P.], seq 2737768:2737932, ack 397, win 501, length 164
03:19:10.301054 IP 184.146.121.215.64650 > 159.203.21.7.22: Flags [.], ack 2732764, win 776, length 0
03:19:10.301103 IP 159.203.21.7.22 > 184.146.121.215.64650: Flags [P.], seq 2737932:2738192, ack 397, win 501, length 260
03:19:10.301153 IP 159.203.21.7.22 > 184.146.121.215.64650: Flags [P.], seq 2738192:2738356, ack 397, win 501, length 164
03:19:10.301203 IP 159.203.21.7.22 > 184.146.121.215.64650: Flags [P.], seq 2738356:2738520, ack 397, win 501, length 164
03:19:10.301253 IP 159.203.21.7.22 > 184.146.121.215.64650: Flags [P.], seq 2738520:2738684, ack 397, win 501, length 164
03:19:10.301304 IP 184.146.121.215.64650 > 159.203.21.7.22: Flags [.], ack 2733776, win 772, length 0
03:19:10.301312 IP 159.203.21.7.22 > 184.146.121.215.64650: Flags [P.], seq 2738684:2738848, ack 397, win 501, length 164
03:19:10.301366 IP 159.203.21.7.22 > 184.146.121.215.64650: Flags [P.], seq 2738848:2739108, ack 397, win 501, length 260
03:19:10.301446 IP 159.203.21.7.22 > 184.146.121.215.64650: Flags [P.], seq 2739108:2739272, ack 397, win 501, length 164
03:19:10.301520 IP 159.203.21.7.22 > 184.146.121.215.64650: Flags [P.], seq 2739272:2739436, ack 397, win 501, length 164
03:19:10.301572 IP 159.203.21.7.22 > 184.146.121.215.64650: Flags [P.], seq 2739436:2739600, ack 397, win 501, length 164
03:19:10.301584 IP 184.146.121.215.64650 > 159.203.21.7.22: Flags [.], ack 2734692, win 769, length 0
03:19:10.301633 IP 159.203.21.7.22 > 184.146.121.215.64650: Flags [P.], seq 2739600:2739860, ack 397, win 501, length 260
03:19:10.301685 IP 184.146.121.215.64650 > 159.203.21.7.22: Flags [.], ack 2735608, win 765, length 0
03:19:10.301693 IP 159.203.21.7.22 > 184.146.121.215.64650: Flags [P.], seq 2739860:2740024, ack 397, win 501, length 164
03:19:10.301746 IP 159.203.21.7.22 > 184.146.121.215.64650: Flags [P.], seq 2740024:2740284, ack 397, win 501, length 260
03:19:10.301797 IP 159.203.21.7.22 > 184.146.121.215.64650: Flags [P.], seq 2740284:2740448, ack 397, win 501, length 164
03:19:10.301847 IP 159.203.21.7.22 > 184.146.121.215.64650: Flags [P.], seq 2740448:2740612, ack 397, win 501, length 164
03:19:10.301905 IP 159.203.21.7.22 > 184.146.121.215.64650: Flags [P.], seq 2740612:2740776, ack 397, win 501, length 164
03:19:10.301965 IP 159.203.21.7.22 > 184.146.121.215.64650: Flags [P.], seq 2740776:2740940, ack 397, win 501, length 164
03:19:10.302015 IP 159.203.21.7.22 > 184.146.121.215.64650: Flags [P.], seq 2740940:2741104, ack 397, win 501, length 164
03:19:10.302068 IP 184.146.121.215.64650 > 159.203.21.7.22: Flags [.], ack 2736524, win 762, length 0
03:19:10.302075 IP 159.203.21.7.22 > 184.146.121.215.64650: Flags [P.], seq 2741104:2741268, ack 397, win 501, length 164
03:19:10.302129 IP 159.203.21.7.22 > 184.146.121.215.64650: Flags [P.], seq 2741268:2741528, ack 397, win 501, length 260
03:19:10.302179 IP 159.203.21.7.22 > 184.146.121.215.64650: Flags [P.], seq 2741528:2741692, ack 397, win 501, length 164
03:19:10.302228 IP 159.203.21.7.22 > 184.146.121.215.64650: Flags [P.], seq 2741692:2741856, ack 397, win 501, length 164
03:19:10.302278 IP 159.203.21.7.22 > 184.146.121.215.64650: Flags [P.], seq 2741856:2742020, ack 397, win 501, length 164
03:19:10.302288 IP 184.146.121.215.64650 > 159.203.21.7.22: Flags [.], ack 2737276, win 759, length 0
03:19:10.302335 IP 159.203.21.7.22 > 184.146.121.215.64650: Flags [P.], seq 2742020:2742280, ack 397, win 501, length 260
03:19:10.302386 IP 159.203.21.7.22 > 184.146.121.215.64650: Flags [P.], seq 2742280:2742444, ack 397, win 501, length 164
03:19:10.302448 IP 159.203.21.7.22 > 184.146.121.215.64650: Flags [P.], seq 2742444:2742608, ack 397, win 501, length 164
03:19:10.302499 IP 159.203.21.7.22 > 184.146.121.215.64650: Flags [P.], seq 2742608:2742772, ack 397, win 501, length 164
03:19:10.302549 IP 159.203.21.7.22 > 184.146.121.215.64650: Flags [P.], seq 2742772:2742936, ack 397, win 501, length 164
03:19:10.302599 IP 159.203.21.7.22 > 184.146.121.215.64650: Flags [P.], seq 2742936:2743100, ack 397, win 501, length 164
03:19:10.302662 IP 159.203.21.7.22 > 184.146.121.215.64650: Flags [P.], seq 2743100:2743264, ack 397, win 501, length 164
03:19:10.302714 IP 184.146.121.215.64650 > 159.203.21.7.22: Flags [.], ack 2738192, win 755, length 0
03:19:10.302721 IP 159.203.21.7.22 > 184.146.121.215.64650: Flags [P.], seq 2743264:2743428, ack 397, win 501, length 164
03:19:10.302775 IP 159.203.21.7.22 > 184.146.121.215.64650: Flags [P.], seq 2743428:2743688, ack 397, win 501, length 260
03:19:10.302826 IP 184.146.121.215.64650 > 159.203.21.7.22: Flags [.], ack 2738848, win 753, length 0
03:19:10.302834 IP 159.203.21.7.22 > 184.146.121.215.64650: Flags [P.], seq 2743688:2743852, ack 397, win 501, length 164
03:19:10.302905 IP 159.203.21.7.22 > 184.146.121.215.64650: Flags [P.], seq 2743852:2744112, ack 397, win 501, length 260
03:19:10.302962 IP 159.203.21.7.22 > 184.146.121.215.64650: Flags [P.], seq 2744112:2744276, ack 397, win 501, length 164
03:19:10.303028 IP 159.203.21.7.22 > 184.146.121.215.64650: Flags [P.], seq 2744276:2744440, ack 397, win 501, length 164
03:19:10.303086 IP 184.146.121.215.64650 > 159.203.21.7.22: Flags [.], ack 2739600, win 750, length 0
03:19:10.303094 IP 159.203.21.7.22 > 184.146.121.215.64650: Flags [P.], seq 2744440:2744604, ack 397, win 501, length 164
03:19:10.303150 IP 159.203.21.7.22 > 184.146.121.215.64650: Flags [P.], seq 2744604:2744864, ack 397, win 501, length 260
03:19:10.303202 IP 159.203.21.7.22 > 184.146.121.215.64650: Flags [P.], seq 2744864:2745028, ack 397, win 501, length 164
03:19:10.303252 IP 159.203.21.7.22 > 184.146.121.215.64650: Flags [P.], seq 2745028:2745192, ack 397, win 501, length 164
03:19:10.303303 IP 159.203.21.7.22 > 184.146.121.215.64650: Flags [P.], seq 2745192:2745356, ack 397, win 501, length 164
03:19:10.303353 IP 159.203.21.7.22 > 184.146.121.215.64650: Flags [P.], seq 2745356:2745520, ack 397, win 501, length 164
03:19:10.303404 IP 159.203.21.7.22 > 184.146.121.215.64650: Flags [P.], seq 2745520:2745684, ack 397, win 501, length 164
03:19:10.303467 IP 159.203.21.7.22 > 184.146.121.215.64650: Flags [P.], seq 2745684:2745848, ack 397, win 501, length 164
03:19:10.303519 IP 159.203.21.7.22 > 184.146.121.215.64650: Flags [P.], seq 2745848:2746012, ack 397, win 501, length 164
03:19:10.303571 IP 159.203.21.7.22 > 184.146.121.215.64650: Flags [P.], seq 2746012:2746176, ack 397, win 501, length 164
03:19:10.303584 IP 184.146.121.215.64650 > 159.203.21.7.22: Flags [.], ack 2740612, win 746, length 0
03:19:10.303632 IP 159.203.21.7.22 > 184.146.121.215.64650: Flags [P.], seq 2746176:2746436, ack 397, win 501, length 260
03:19:10.303683 IP 159.203.21.7.22 > 184.146.121.215.64650: Flags [P.], seq 2746436:2746600, ack 397, win 501, length 164
03:19:10.303743 IP 159.203.21.7.22 > 184.146.121.215.64650: Flags [P.], seq 2746600:2746764, ack 397, win 501, length 164
03:19:10.303800 IP 159.203.21.7.22 > 184.146.121.215.64650: Flags [P.], seq 2746764:2746928, ack 397, win 501, length 164
03:19:10.303852 IP 159.203.21.7.22 > 184.146.121.215.64650: Flags [P.], seq 2746928:2747092, ack 397, win 501, length 164
03:19:10.303864 IP 184.146.121.215.64650 > 159.203.21.7.22: Flags [.], ack 2741268, win 743, length 0
03:19:10.303912 IP 159.203.21.7.22 > 184.146.121.215.64650: Flags [P.], seq 2747092:2747352, ack 397, win 501, length 260
03:19:10.303923 IP 184.146.121.215.64650 > 159.203.21.7.22: Flags [.], ack 2742444, win 739, length 0
03:19:10.303974 IP 159.203.21.7.22 > 184.146.121.215.64650: Flags [P.], seq 2747352:2747612, ack 397, win 501, length 260
03:19:10.304028 IP 159.203.21.7.22 > 184.146.121.215.64650: Flags [P.], seq 2747612:2747776, ack 397, win 501, length 164
03:19:10.304098 IP 184.146.121.215.64650 > 159.203.21.7.22: Flags [.], ack 2743264, win 735, length 0
03:19:10.304106 IP 159.203.21.7.22 > 184.146.121.215.64650: Flags [P.], seq 2747776:2747940, ack 397, win 501, length 164
03:19:10.304158 IP 159.203.21.7.22 > 184.146.121.215.64650: Flags [P.], seq 2747940:2748200, ack 397, win 501, length 260
03:19:10.304210 IP 159.203.21.7.22 > 184.146.121.215.64650: Flags [P.], seq 2748200:2748364, ack 397, win 501, length 164
03:19:10.304260 IP 159.203.21.7.22 > 184.146.121.215.64650: Flags [P.], seq 2748364:2748528, ack 397, win 501, length 164
03:19:10.304309 IP 159.203.21.7.22 > 184.146.121.215.64650: Flags [P.], seq 2748528:2748692, ack 397, win 501, length 164
03:19:10.304361 IP 159.203.21.7.22 > 184.146.121.215.64650: Flags [P.], seq 2748692:2748856, ack 397, win 501, length 164
03:19:10.304411 IP 159.203.21.7.22 > 184.146.121.215.64650: Flags [P.], seq 2748856:2749020, ack 397, win 501, length 164
03:19:10.304479 IP 159.203.21.7.22 > 184.146.121.215.64650: Flags [P.], seq 2749020:2749184, ack 397, win 501, length 164
03:19:10.304491 IP 184.146.121.215.64650 > 159.203.21.7.22: Flags [.], ack 2744112, win 732, length 0
03:19:10.304538 IP 159.203.21.7.22 > 184.146.121.215.64650: Flags [P.], seq 2749184:2749444, ack 397, win 501, length 260
03:19:10.304589 IP 159.203.21.7.22 > 184.146.121.215.64650: Flags [P.], seq 2749444:2749608, ack 397, win 501, length 164
03:19:10.304640 IP 159.203.21.7.22 > 184.146.121.215.64650: Flags [P.], seq 2749608:2749772, ack 397, win 501, length 164
03:19:10.304691 IP 159.203.21.7.22 > 184.146.121.215.64650: Flags [P.], seq 2749772:2749936, ack 397, win 501, length 164
03:19:10.304702 IP 184.146.121.215.64650 > 159.203.21.7.22: Flags [.], ack 2745028, win 728, length 0
03:19:10.304750 IP 159.203.21.7.22 > 184.146.121.215.64650: Flags [P.], seq 2749936:2750196, ack 397, win 501, length 260
03:19:10.304801 IP 159.203.21.7.22 > 184.146.121.215.64650: Flags [P.], seq 2750196:2750360, ack 397, win 501, length 164
03:19:10.304851 IP 159.203.21.7.22 > 184.146.121.215.64650: Flags [P.], seq 2750360:2750524, ack 397, win 501, length 164
03:19:10.304902 IP 159.203.21.7.22 > 184.146.121.215.64650: Flags [P.], seq 2750524:2750688, ack 397, win 501, length 164
03:19:10.304951 IP 159.203.21.7.22 > 184.146.121.215.64650: Flags [P.], seq 2750688:2750852, ack 397, win 501, length 164
03:19:10.304964 IP 184.146.121.215.64650 > 159.203.21.7.22: Flags [.], ack 2745848, win 725, length 0
03:19:10.305012 IP 159.203.21.7.22 > 184.146.121.215.64650: Flags [P.], seq 2750852:2751112, ack 397, win 501, length 260
03:19:10.305065 IP 159.203.21.7.22 > 184.146.121.215.64650: Flags [P.], seq 2751112:2751276, ack 397, win 501, length 164
03:19:10.305133 IP 159.203.21.7.22 > 184.146.121.215.64650: Flags [P.], seq 2751276:2751440, ack 397, win 501, length 164
03:19:10.305194 IP 159.203.21.7.22 > 184.146.121.215.64650: Flags [P.], seq 2751440:2751604, ack 397, win 501, length 164
03:19:10.305256 IP 159.203.21.7.22 > 184.146.121.215.64650: Flags [P.], seq 2751604:2751768, ack 397, win 501, length 164
03:19:10.305320 IP 159.203.21.7.22 > 184.146.121.215.64650: Flags [P.], seq 2751768:2751932, ack 397, win 501, length 164
03:19:10.305332 IP 184.146.121.215.64650 > 159.203.21.7.22: Flags [.], ack 2746764, win 722, length 0
03:19:10.305387 IP 159.203.21.7.22 > 184.146.121.215.64650: Flags [P.], seq 2751932:2752192, ack 397, win 501, length 260
03:19:10.305476 IP 159.203.21.7.22 > 184.146.121.215.64650: Flags [P.], seq 2752192:2752356, ack 397, win 501, length 164
03:19:10.305541 IP 159.203.21.7.22 > 184.146.121.215.64650: Flags [P.], seq 2752356:2752520, ack 397, win 501, length 164
03:19:10.305553 IP 184.146.121.215.64650 > 159.203.21.7.22: Flags [.], ack 2747612, win 718, length 0
03:19:10.305599 IP 159.203.21.7.22 > 184.146.121.215.64650: Flags [P.], seq 2752520:2752780, ack 397, win 501, length 260
03:19:10.305666 IP 159.203.21.7.22 > 184.146.121.215.64650: Flags [P.], seq 2752780:2752944, ack 397, win 501, length 164
03:19:10.305731 IP 159.203.21.7.22 > 184.146.121.215.64650: Flags [P.], seq 2752944:2753108, ack 397, win 501, length 164
03:19:10.305795 IP 159.203.21.7.22 > 184.146.121.215.64650: Flags [P.], seq 2753108:2753272, ack 397, win 501, length 164
03:19:10.305808 IP 184.146.121.215.64650 > 159.203.21.7.22: Flags [.], ack 2748528, win 715, length 0
03:19:10.305856 IP 159.203.21.7.22 > 184.146.121.215.64650: Flags [P.], seq 2753272:2753532, ack 397, win 501, length 260
03:19:10.305909 IP 159.203.21.7.22 > 184.146.121.215.64650: Flags [P.], seq 2753532:2753696, ack 397, win 501, length 164
03:19:10.305922 IP 184.146.121.215.64650 > 159.203.21.7.22: Flags [.], ack 2749184, win 712, length 0
03:19:10.305989 IP 159.203.21.7.22 > 184.146.121.215.64650: Flags [P.], seq 2753696:2753956, ack 397, win 501, length 260
03:19:10.306047 IP 159.203.21.7.22 > 184.146.121.215.64650: Flags [P.], seq 2753956:2754120, ack 397, win 501, length 164
03:19:10.306098 IP 159.203.21.7.22 > 184.146.121.215.64650: Flags [P.], seq 2754120:2754284, ack 397, win 501, length 164
03:19:10.306149 IP 159.203.21.7.22 > 184.146.121.215.64650: Flags [P.], seq 2754284:2754448, ack 397, win 501, length 164
03:19:10.306199 IP 159.203.21.7.22 > 184.146.121.215.64650: Flags [P.], seq 2754448:2754612, ack 397, win 501, length 164
03:19:10.306250 IP 159.203.21.7.22 > 184.146.121.215.64650: Flags [P.], seq 2754612:2754776, ack 397, win 501, length 164
03:19:10.306301 IP 159.203.21.7.22 > 184.146.121.215.64650: Flags [P.], seq 2754776:2754940, ack 397, win 501, length 164
03:19:10.306312 IP 184.146.121.215.64650 > 159.203.21.7.22: Flags [.], ack 2750196, win 708, length 0
03:19:10.306361 IP 159.203.21.7.22 > 184.146.121.215.64650: Flags [P.], seq 2754940:2755200, ack 397, win 501, length 260
03:19:10.306413 IP 159.203.21.7.22 > 184.146.121.215.64650: Flags [P.], seq 2755200:2755364, ack 397, win 501, length 164
03:19:10.306463 IP 159.203.21.7.22 > 184.146.121.215.64650: Flags [P.], seq 2755364:2755528, ack 397, win 501, length 164
03:19:10.306514 IP 159.203.21.7.22 > 184.146.121.215.64650: Flags [P.], seq 2755528:2755692, ack 397, win 501, length 164
03:19:10.306565 IP 159.203.21.7.22 > 184.146.121.215.64650: Flags [P.], seq 2755692:2755856, ack 397, win 501, length 164
03:19:10.306575 IP 184.146.121.215.64650 > 159.203.21.7.22: Flags [.], ack 2751112, win 705, length 0
03:19:10.306623 IP 159.203.21.7.22 > 184.146.121.215.64650: Flags [P.], seq 2755856:2756116, ack 397, win 501, length 260
03:19:10.306674 IP 159.203.21.7.22 > 184.146.121.215.64650: Flags [P.], seq 2756116:2756280, ack 397, win 501, length 164
03:19:10.306724 IP 159.203.21.7.22 > 184.146.121.215.64650: Flags [P.], seq 2756280:2756444, ack 397, win 501, length 164
03:19:10.306776 IP 159.203.21.7.22 > 184.146.121.215.64650: Flags [P.], seq 2756444:2756608, ack 397, win 501, length 164
03:19:10.306826 IP 159.203.21.7.22 > 184.146.121.215.64650: Flags [P.], seq 2756608:2756772, ack 397, win 501, length 164
03:19:10.306878 IP 159.203.21.7.22 > 184.146.121.215.64650: Flags [P.], seq 2756772:2756936, ack 397, win 501, length 164
03:19:10.306930 IP 159.203.21.7.22 > 184.146.121.215.64650: Flags [P.], seq 2756936:2757100, ack 397, win 501, length 164
03:19:10.306941 IP 184.146.121.215.64650 > 159.203.21.7.22: Flags [.], ack 2751768, win 702, length 0
03:19:10.306988 IP 159.203.21.7.22 > 184.146.121.215.64650: Flags [P.], seq 2757100:2757360, ack 397, win 501, length 260
03:19:10.307048 IP 159.203.21.7.22 > 184.146.121.215.64650: Flags [P.], seq 2757360:2757524, ack 397, win 501, length 164
03:19:10.307056 IP 184.146.121.215.64650 > 159.203.21.7.22: Flags [.], ack 2752520, win 699, length 0
03:19:10.307109 IP 159.203.21.7.22 > 184.146.121.215.64650: Flags [P.], seq 2757524:2757784, ack 397, win 501, length 260
03:19:10.307171 IP 159.203.21.7.22 > 184.146.121.215.64650: Flags [P.], seq 2757784:2757948, ack 397, win 501, length 164
03:19:10.307223 IP 159.203.21.7.22 > 184.146.121.215.64650: Flags [P.], seq 2757948:2758112, ack 397, win 501, length 164
03:19:10.307273 IP 159.203.21.7.22 > 184.146.121.215.64650: Flags [P.], seq 2758112:2758276, ack 397, win 501, length 164
03:19:10.307325 IP 159.203.21.7.22 > 184.146.121.215.64650: Flags [P.], seq 2758276:2758440, ack 397, win 501, length 164
03:19:10.307335 IP 184.146.121.215.64650 > 159.203.21.7.22: Flags [.], ack 2753272, win 696, length 0
03:19:10.307393 IP 159.203.21.7.22 > 184.146.121.215.64650: Flags [P.], seq 2758440:2758700, ack 397, win 501, length 260
03:19:10.307448 IP 159.203.21.7.22 > 184.146.121.215.64650: Flags [P.], seq 2758700:2758864, ack 397, win 501, length 164
03:19:10.307501 IP 159.203.21.7.22 > 184.146.121.215.64650: Flags [P.], seq 2758864:2759028, ack 397, win 501, length 164
03:19:10.307551 IP 159.203.21.7.22 > 184.146.121.215.64650: Flags [P.], seq 2759028:2759192, ack 397, win 501, length 164
03:19:10.307606 IP 159.203.21.7.22 > 184.146.121.215.64650: Flags [P.], seq 2759192:2759356, ack 397, win 501, length 164
03:19:10.307666 IP 159.203.21.7.22 > 184.146.121.215.64650: Flags [P.], seq 2759356:2759520, ack 397, win 501, length 164
03:19:10.307677 IP 184.146.121.215.64650 > 159.203.21.7.22: Flags [.], ack 2754120, win 693, length 0
03:19:10.307730 IP 159.203.21.7.22 > 184.146.121.215.64650: Flags [P.], seq 2759520:2759780, ack 397, win 501, length 260
03:19:10.307782 IP 159.203.21.7.22 > 184.146.121.215.64650: Flags [P.], seq 2759780:2759944, ack 397, win 501, length 164
03:19:10.307832 IP 159.203.21.7.22 > 184.146.121.215.64650: Flags [P.], seq 2759944:2760108, ack 397, win 501, length 164
03:19:10.307882 IP 159.203.21.7.22 > 184.146.121.215.64650: Flags [P.], seq 2760108:2760272, ack 397, win 501, length 164
03:19:10.307933 IP 159.203.21.7.22 > 184.146.121.215.64650: Flags [P.], seq 2760272:2760436, ack 397, win 501, length 164
03:19:10.307983 IP 159.203.21.7.22 > 184.146.121.215.64650: Flags [P.], seq 2760436:2760600, ack 397, win 501, length 164
03:19:10.308033 IP 159.203.21.7.22 > 184.146.121.215.64650: Flags [P.], seq 2760600:2760764, ack 397, win 501, length 164
03:19:10.308044 IP 184.146.121.215.64650 > 159.203.21.7.22: Flags [.], ack 2754940, win 690, length 0
03:19:10.308092 IP 159.203.21.7.22 > 184.146.121.215.64650: Flags [P.], seq 2760764:2761024, ack 397, win 501, length 260
03:19:10.308143 IP 159.203.21.7.22 > 184.146.121.215.64650: Flags [P.], seq 2761024:2761188, ack 397, win 501, length 164
03:19:10.308193 IP 159.203.21.7.22 > 184.146.121.215.64650: Flags [P.], seq 2761188:2761352, ack 397, win 501, length 164
03:19:10.308243 IP 159.203.21.7.22 > 184.146.121.215.64650: Flags [P.], seq 2761352:2761516, ack 397, win 501, length 164
03:19:10.308293 IP 159.203.21.7.22 > 184.146.121.215.64650: Flags [P.], seq 2761516:2761680, ack 397, win 501, length 164
03:19:10.308343 IP 159.203.21.7.22 > 184.146.121.215.64650: Flags [P.], seq 2761680:2761844, ack 397, win 501, length 164
03:19:10.308397 IP 159.203.21.7.22 > 184.146.121.215.64650: Flags [P.], seq 2761844:2762008, ack 397, win 501, length 164
03:19:10.308462 IP 159.203.21.7.22 > 184.146.121.215.64650: Flags [P.], seq 2762008:2762172, ack 397, win 501, length 164
03:19:10.308515 IP 159.203.21.7.22 > 184.146.121.215.64650: Flags [P.], seq 2762172:2762336, ack 397, win 501, length 164
03:19:10.308566 IP 159.203.21.7.22 > 184.146.121.215.64650: Flags [P.], seq 2762336:2762500, ack 397, win 501, length 164
03:19:10.308619 IP 184.146.121.215.64650 > 159.203.21.7.22: Flags [.], ack 2755856, win 686, length 0
03:19:10.308674 IP 184.146.121.215.64650 > 159.203.21.7.22: Flags [.], ack 2756772, win 683, length 0
03:19:10.308675 IP 184.146.121.215.64650 > 159.203.21.7.22: Flags [.], ack 2757524, win 680, length 0
03:19:10.308675 IP 184.146.121.215.64650 > 159.203.21.7.22: Flags [.], ack 2758440, win 676, length 0
03:19:10.308697 IP 159.203.21.7.22 > 184.146.121.215.64650: Flags [P.], seq 2762500:2762760, ack 397, win 501, length 260
03:19:10.308770 IP 159.203.21.7.22 > 184.146.121.215.64650: Flags [P.], seq 2762760:2763228, ack 397, win 501, length 468
03:19:10.308821 IP 159.203.21.7.22 > 184.146.121.215.64650: Flags [P.], seq 2763228:2763392, ack 397, win 501, length 164
03:19:10.308872 IP 159.203.21.7.22 > 184.146.121.215.64650: Flags [P.], seq 2763392:2763556, ack 397, win 501, length 164
03:19:10.308923 IP 159.203.21.7.22 > 184.146.121.215.64650: Flags [P.], seq 2763556:2763720, ack 397, win 501, length 164
03:19:10.308936 IP 184.146.121.215.64650 > 159.203.21.7.22: Flags [.], ack 2759028, win 674, length 0
03:19:10.308984 IP 159.203.21.7.22 > 184.146.121.215.64650: Flags [P.], seq 2763720:2763980, ack 397, win 501, length 260
03:19:10.309046 IP 159.203.21.7.22 > 184.146.121.215.64650: Flags [P.], seq 2763980:2764144, ack 397, win 501, length 164
03:19:10.309115 IP 159.203.21.7.22 > 184.146.121.215.64650: Flags [P.], seq 2764144:2764308, ack 397, win 501, length 164
03:19:10.309167 IP 159.203.21.7.22 > 184.146.121.215.64650: Flags [P.], seq 2764308:2764472, ack 397, win 501, length 164
03:19:10.309218 IP 159.203.21.7.22 > 184.146.121.215.64650: Flags [P.], seq 2764472:2764636, ack 397, win 501, length 164
03:19:10.309268 IP 159.203.21.7.22 > 184.146.121.215.64650: Flags [P.], seq 2764636:2764800, ack 397, win 501, length 164
03:19:10.309321 IP 159.203.21.7.22 > 184.146.121.215.64650: Flags [P.], seq 2764800:2764964, ack 397, win 501, length 164
03:19:10.309382 IP 159.203.21.7.22 > 184.146.121.215.64650: Flags [P.], seq 2764964:2765128, ack 397, win 501, length 164
03:19:10.309477 IP 159.203.21.7.22 > 184.146.121.215.64650: Flags [P.], seq 2765128:2765292, ack 397, win 501, length 164
03:19:10.309492 IP 184.146.121.215.64650 > 159.203.21.7.22: Flags [.], ack 2760108, win 670, length 0
03:19:10.309542 IP 184.146.121.215.64650 > 159.203.21.7.22: Flags [.], ack 2761188, win 665, length 0
03:19:10.309552 IP 159.203.21.7.22 > 184.146.121.215.64650: Flags [P.], seq 2765292:2765552, ack 397, win 501, length 260
03:19:10.309612 IP 159.203.21.7.22 > 184.146.121.215.64650: Flags [P.], seq 2765552:2765812, ack 397, win 501, length 260
03:19:10.309668 IP 159.203.21.7.22 > 184.146.121.215.64650: Flags [P.], seq 2765812:2765976, ack 397, win 501, length 164
03:19:10.309726 IP 159.203.21.7.22 > 184.146.121.215.64650: Flags [P.], seq 2765976:2766140, ack 397, win 501, length 164
03:19:10.309785 IP 159.203.21.7.22 > 184.146.121.215.64650: Flags [P.], seq 2766140:2766304, ack 397, win 501, length 164
03:19:10.309844 IP 159.203.21.7.22 > 184.146.121.215.64650: Flags [P.], seq 2766304:2766468, ack 397, win 501, length 164
03:19:10.309914 IP 159.203.21.7.22 > 184.146.121.215.64650: Flags [P.], seq 2766468:2766632, ack 397, win 501, length 164
03:19:10.309927 IP 184.146.121.215.64650 > 159.203.21.7.22: Flags [.], ack 2762008, win 662, length 0
03:19:10.309980 IP 159.203.21.7.22 > 184.146.121.215.64650: Flags [P.], seq 2766632:2766892, ack 397, win 501, length 260
03:19:10.310032 IP 184.146.121.215.64650 > 159.203.21.7.22: Flags [.], ack 2762500, win 660, length 0
03:19:10.310042 IP 159.203.21.7.22 > 184.146.121.215.64650: Flags [P.], seq 2766892:2767056, ack 397, win 501, length 164
03:19:10.310093 IP 159.203.21.7.22 > 184.146.121.215.64650: Flags [P.], seq 2767056:2767316, ack 397, win 501, length 260
03:19:10.310146 IP 159.203.21.7.22 > 184.146.121.215.64650: Flags [P.], seq 2767316:2767480, ack 397, win 501, length 164
03:19:10.310198 IP 159.203.21.7.22 > 184.146.121.215.64650: Flags [P.], seq 2767480:2767644, ack 397, win 501, length 164
03:19:10.310249 IP 159.203.21.7.22 > 184.146.121.215.64650: Flags [P.], seq 2767644:2767808, ack 397, win 501, length 164
03:19:10.310299 IP 159.203.21.7.22 > 184.146.121.215.64650: Flags [P.], seq 2767808:2767972, ack 397, win 501, length 164
03:19:10.310351 IP 159.203.21.7.22 > 184.146.121.215.64650: Flags [P.], seq 2767972:2768136, ack 397, win 501, length 164
03:19:10.310411 IP 159.203.21.7.22 > 184.146.121.215.64650: Flags [P.], seq 2768136:2768300, ack 397, win 501, length 164
03:19:10.310424 IP 184.146.121.215.64650 > 159.203.21.7.22: Flags [.], ack 2763556, win 656, length 0
03:19:10.310473 IP 159.203.21.7.22 > 184.146.121.215.64650: Flags [P.], seq 2768300:2768560, ack 397, win 501, length 260
03:19:10.310524 IP 159.203.21.7.22 > 184.146.121.215.64650: Flags [P.], seq 2768560:2768724, ack 397, win 501, length 164
03:19:10.310575 IP 159.203.21.7.22 > 184.146.121.215.64650: Flags [P.], seq 2768724:2768888, ack 397, win 501, length 164
03:19:10.310626 IP 159.203.21.7.22 > 184.146.121.215.64650: Flags [P.], seq 2768888:2769052, ack 397, win 501, length 164
03:19:10.310678 IP 184.146.121.215.64650 > 159.203.21.7.22: Flags [.], ack 2764308, win 653, length 0
03:19:10.310688 IP 159.203.21.7.22 > 184.146.121.215.64650: Flags [P.], seq 2769052:2769216, ack 397, win 501, length 164
03:19:10.310749 IP 159.203.21.7.22 > 184.146.121.215.64650: Flags [P.], seq 2769216:2769476, ack 397, win 501, length 260
03:19:10.310801 IP 159.203.21.7.22 > 184.146.121.215.64650: Flags [P.], seq 2769476:2769640, ack 397, win 501, length 164
03:19:10.310856 IP 159.203.21.7.22 > 184.146.121.215.64650: Flags [P.], seq 2769640:2769804, ack 397, win 501, length 164
03:19:10.310908 IP 159.203.21.7.22 > 184.146.121.215.64650: Flags [P.], seq 2769804:2769968, ack 397, win 501, length 164
03:19:10.310919 IP 184.146.121.215.64650 > 159.203.21.7.22: Flags [.], ack 2765128, win 650, length 0
03:19:10.310978 IP 159.203.21.7.22 > 184.146.121.215.64650: Flags [P.], seq 2769968:2770228, ack 397, win 501, length 260
03:19:10.311036 IP 159.203.21.7.22 > 184.146.121.215.64650: Flags [P.], seq 2770228:2770392, ack 397, win 501, length 164
03:19:10.311090 IP 159.203.21.7.22 > 184.146.121.215.64650: Flags [P.], seq 2770392:2770556, ack 397, win 501, length 164
03:19:10.311140 IP 159.203.21.7.22 > 184.146.121.215.64650: Flags [P.], seq 2770556:2770720, ack 397, win 501, length 164
03:19:10.311194 IP 159.203.21.7.22 > 184.146.121.215.64650: Flags [P.], seq 2770720:2770884, ack 397, win 501, length 164
03:19:10.311206 IP 184.146.121.215.64650 > 159.203.21.7.22: Flags [.], ack 2765976, win 647, length 0
03:19:10.311256 IP 159.203.21.7.22 > 184.146.121.215.64650: Flags [P.], seq 2770884:2771144, ack 397, win 501, length 260
03:19:10.311306 IP 159.203.21.7.22 > 184.146.121.215.64650: Flags [P.], seq 2771144:2771308, ack 397, win 501, length 164
03:19:10.311356 IP 159.203.21.7.22 > 184.146.121.215.64650: Flags [P.], seq 2771308:2771472, ack 397, win 501, length 164
03:19:10.311409 IP 159.203.21.7.22 > 184.146.121.215.64650: Flags [P.], seq 2771472:2771636, ack 397, win 501, length 164
03:19:10.311469 IP 159.203.21.7.22 > 184.146.121.215.64650: Flags [P.], seq 2771636:2771800, ack 397, win 501, length 164
03:19:10.311481 IP 184.146.121.215.64650 > 159.203.21.7.22: Flags [.], ack 2766632, win 644, length 0
03:19:10.311529 IP 159.203.21.7.22 > 184.146.121.215.64650: Flags [P.], seq 2771800:2772060, ack 397, win 501, length 260
03:19:10.311589 IP 159.203.21.7.22 > 184.146.121.215.64650: Flags [P.], seq 2772060:2772224, ack 397, win 501, length 164
03:19:10.311640 IP 159.203.21.7.22 > 184.146.121.215.64650: Flags [P.], seq 2772224:2772388, ack 397, win 501, length 164
03:19:10.311691 IP 159.203.21.7.22 > 184.146.121.215.64650: Flags [P.], seq 2772388:2772552, ack 397, win 501, length 164
03:19:10.311703 IP 184.146.121.215.64650 > 159.203.21.7.22: Flags [.], ack 2767480, win 641, length 0
03:19:10.311750 IP 159.203.21.7.22 > 184.146.121.215.64650: Flags [P.], seq 2772552:2772812, ack 397, win 501, length 260
03:19:10.311802 IP 159.203.21.7.22 > 184.146.121.215.64650: Flags [P.], seq 2772812:2772976, ack 397, win 501, length 164
03:19:10.311852 IP 159.203.21.7.22 > 184.146.121.215.64650: Flags [P.], seq 2772976:2773140, ack 397, win 501, length 164
03:19:10.311901 IP 159.203.21.7.22 > 184.146.121.215.64650: Flags [P.], seq 2773140:2773304, ack 397, win 501, length 164
03:19:10.311955 IP 184.146.121.215.64650 > 159.203.21.7.22: Flags [.], ack 2768136, win 638, length 0
03:19:10.311966 IP 159.203.21.7.22 > 184.146.121.215.64650: Flags [P.], seq 2773304:2773468, ack 397, win 501, length 164
03:19:10.312034 IP 159.203.21.7.22 > 184.146.121.215.64650: Flags [P.], seq 2773468:2773728, ack 397, win 501, length 260
03:19:10.312087 IP 159.203.21.7.22 > 184.146.121.215.64650: Flags [P.], seq 2773728:2773892, ack 397, win 501, length 164
03:19:10.312139 IP 159.203.21.7.22 > 184.146.121.215.64650: Flags [P.], seq 2773892:2774056, ack 397, win 501, length 164
03:19:10.312190 IP 159.203.21.7.22 > 184.146.121.215.64650: Flags [P.], seq 2774056:2774220, ack 397, win 501, length 164
03:19:10.312202 IP 184.146.121.215.64650 > 159.203.21.7.22: Flags [.], ack 2769052, win 635, length 0
03:19:10.312252 IP 159.203.21.7.22 > 184.146.121.215.64650: Flags [P.], seq 2774220:2774480, ack 397, win 501, length 260
03:19:10.312303 IP 159.203.21.7.22 > 184.146.121.215.64650: Flags [P.], seq 2774480:2774644, ack 397, win 501, length 164
03:19:10.312354 IP 159.203.21.7.22 > 184.146.121.215.64650: Flags [P.], seq 2774644:2774808, ack 397, win 501, length 164
03:19:10.312404 IP 159.203.21.7.22 > 184.146.121.215.64650: Flags [P.], seq 2774808:2774972, ack 397, win 501, length 164
03:19:10.312456 IP 159.203.21.7.22 > 184.146.121.215.64650: Flags [P.], seq 2774972:2775136, ack 397, win 501, length 164
03:19:10.312468 IP 184.146.121.215.64650 > 159.203.21.7.22: Flags [.], ack 2769804, win 632, length 0
03:19:10.312515 IP 159.203.21.7.22 > 184.146.121.215.64650: Flags [P.], seq 2775136:2775396, ack 397, win 501, length 260
03:19:10.312567 IP 159.203.21.7.22 > 184.146.121.215.64650: Flags [P.], seq 2775396:2775560, ack 397, win 501, length 164
03:19:10.312618 IP 159.203.21.7.22 > 184.146.121.215.64650: Flags [P.], seq 2775560:2775724, ack 397, win 501, length 164
03:19:10.312667 IP 159.203.21.7.22 > 184.146.121.215.64650: Flags [P.], seq 2775724:2775888, ack 397, win 501, length 164
