root@lamp-ubuntu-s-1vcpu-1gb-tor1-01:~# sudo tcpdump -i any -w all_traffic
tcpdump: listening on any, link-type LINUX_SLL (Linux cooked v1), capture size 262144 bytes
^C12 packets captured
15 packets received by filter
0 packets dropped by kernel
root@lamp-ubuntu-s-1vcpu-1gb-tor1-01:~# sudo tcpdump -i any
tcpdump: verbose output suppressed, use -v or -vv for full protocol decode
listening on any, link-type LINUX_SLL (Linux cooked v1), capture size 262144 bytes
04:08:35.773446 IP lamp-ubuntu-s-1vcpu-1gb-tor1-01.ssh > bras-base-toroon0817w-grc-26-184-146-121-215.dsl.bell.ca.64650: Flags [P.], seq 1418709803:1418709911, ack 1339836342, win 501, length 108
04:08:35.773514 IP lamp-ubuntu-s-1vcpu-1gb-tor1-01.ssh > bras-base-toroon0817w-grc-26-184-146-121-215.dsl.bell.ca.64650: Flags [P.], seq 108:260, ack 1, win 501, length 152
04:08:35.773621 IP lamp-ubuntu-s-1vcpu-1gb-tor1-01.ssh > bras-base-toroon0817w-grc-26-184-146-121-215.dsl.bell.ca.64650: Flags [P.], seq 260:296, ack 1, win 501, length 36
04:08:35.773886 IP localhost.51495 > localhost.domain: 44415+ [1au] PTR? 215.121.146.184.in-addr.arpa. (57)
04:08:35.774236 IP lamp-ubuntu-s-1vcpu-1gb-tor1-01.33973 > 67.207.67.3.domain: 13549+ [1au] PTR? 215.121.146.184.in-addr.arpa. (57)
04:08:35.774297 IP lamp-ubuntu-s-1vcpu-1gb-tor1-01.46841 > 67.207.67.2.domain: 60934+ [1au] PTR? 215.121.146.184.in-addr.arpa. (57)
04:08:35.774340 IP lamp-ubuntu-s-1vcpu-1gb-tor1-01.51999 > 67.207.67.3.domain: 11915+ [1au] PTR? 215.121.146.184.in-addr.arpa. (57)
04:08:35.943735 IP lamp-ubuntu-s-1vcpu-1gb-tor1-01.ssh > bras-base-toroon0817w-grc-26-184-146-121-215.dsl.bell.ca.64650: Flags [P.], seq 532:780, ack 1, win 501, length 248
04:08:35.943806 IP lamp-ubuntu-s-1vcpu-1gb-tor1-01.ssh > bras-base-toroon0817w-grc-26-184-146-121-215.dsl.bell.ca.64650: Flags [P.], seq 780:1028, ack 1, win 501, length 248
04:08:35.943899 IP lamp-ubuntu-s-1vcpu-1gb-tor1-01.ssh > bras-base-toroon0817w-grc-26-184-146-121-215.dsl.bell.ca.64650: Flags [P.], seq 1028:1064, ack 1, win 501, length 36
04:08:35.944281 IP lamp-ubuntu-s-1vcpu-1gb-tor1-01.ssh > bras-base-toroon0817w-grc-26-184-146-121-215.dsl.bell.ca.64650: Flags [P.], seq 1212:1248, ack 1, win 501, length 36
04:08:35.945668 IP bras-base-toroon0817w-grc-26-184-146-121-215.dsl.bell.ca.64650 > lamp-ubuntu-s-1vcpu-1gb-tor1-01.ssh: Flags [.], ack 1064, win 1022, length 0
04:08:36.013742 IP lamp-ubuntu-s-1vcpu-1gb-tor1-01.ssh > bras-base-toroon0817w-grc-26-184-146-121-215.dsl.bell.ca.64650: Flags [P.], seq 1628:1836, ack 1, win 501, length 208
04:08:36.013853 IP lamp-ubuntu-s-1vcpu-1gb-tor1-01.ssh > bras-base-toroon0817w-grc-26-184-146-121-215.dsl.bell.ca.64650: Flags [P.], seq 1872:2084, ack 1, win 501, length 212
04:08:36.013922 IP lamp-ubuntu-s-1vcpu-1gb-tor1-01.ssh > bras-base-toroon0817w-grc-26-184-146-121-215.dsl.bell.ca.64650: Flags [P.], seq 2084:2368, ack 1, win 501, length 284
04:08:36.013994 IP lamp-ubuntu-s-1vcpu-1gb-tor1-01.ssh > bras-base-toroon0817w-grc-26-184-146-121-215.dsl.bell.ca.64650: Flags [P.], seq 2368:2828, ack 1, win 501, length 460
04:08:36.014063 IP lamp-ubuntu-s-1vcpu-1gb-tor1-01.ssh > bras-base-toroon0817w-grc-26-184-146-121-215.dsl.bell.ca.64650: Flags [P.], seq 2828:2864, ack 1, win 501, length 36
04:08:36.014134 IP lamp-ubuntu-s-1vcpu-1gb-tor1-01.ssh > bras-base-toroon0817w-grc-26-184-146-121-215.dsl.bell.ca.64650: Flags [P.], seq 2864:3096, ack 1, win 501, length 232
04:08:36.014206 IP lamp-ubuntu-s-1vcpu-1gb-tor1-01.ssh > bras-base-toroon0817w-grc-26-184-146-121-215.dsl.bell.ca.64650: Flags [P.], seq 3096:3344, ack 1, win 501, length 248
04:08:36.014278 IP lamp-ubuntu-s-1vcpu-1gb-tor1-01.ssh > bras-base-toroon0817w-grc-26-184-146-121-215.dsl.bell.ca.64650: Flags [P.], seq 3344:3804, ack 1, win 501, length 460
04:08:36.014348 IP lamp-ubuntu-s-1vcpu-1gb-tor1-01.ssh > bras-base-toroon0817w-grc-26-184-146-121-215.dsl.bell.ca.64650: Flags [P.], seq 3804:4052, ack 1, win 501, length 248
04:08:36.014465 IP lamp-ubuntu-s-1vcpu-1gb-tor1-01.ssh > bras-base-toroon0817w-grc-26-184-146-121-215.dsl.bell.ca.64650: Flags [P.], seq 4052:4088, ack 1, win 501, length 36
04:08:36.014525 IP lamp-ubuntu-s-1vcpu-1gb-tor1-01.ssh > bras-base-toroon0817w-grc-26-184-146-121-215.dsl.bell.ca.64650: Flags [P.], seq 4088:4336, ack 1, win 501, length 248
04:08:36.014594 IP lamp-ubuntu-s-1vcpu-1gb-tor1-01.ssh > bras-base-toroon0817w-grc-26-184-146-121-215.dsl.bell.ca.64650: Flags [P.], seq 4336:4584, ack 1, win 501, length 248
04:08:36.015550 IP bras-base-toroon0817w-grc-26-184-146-121-215.dsl.bell.ca.64650 > lamp-ubuntu-s-1vcpu-1gb-tor1-01.ssh: Flags [.], ack 1872, win 1024, length 0
04:08:36.015579 IP lamp-ubuntu-s-1vcpu-1gb-tor1-01.ssh > bras-base-toroon0817w-grc-26-184-146-121-215.dsl.bell.ca.64650: Flags [P.], seq 4584:6072, ack 1, win 501, length 1488
04:08:36.015686 IP lamp-ubuntu-s-1vcpu-1gb-tor1-01.ssh > bras-base-toroon0817w-grc-26-184-146-121-215.dsl.bell.ca.64650: Flags [P.], seq 6072:6304, ack 1, win 501, length 232
04:08:36.015697 IP bras-base-toroon0817w-grc-26-184-146-121-215.dsl.bell.ca.64650 > lamp-ubuntu-s-1vcpu-1gb-tor1-01.ssh: Flags [.], ack 2084, win 1024, length 0
04:08:36.015743 IP lamp-ubuntu-s-1vcpu-1gb-tor1-01.ssh > bras-base-toroon0817w-grc-26-184-146-121-215.dsl.bell.ca.64650: Flags [P.], seq 6304:6552, ack 1, win 501, length 248
04:08:36.015777 IP bras-base-toroon0817w-grc-26-184-146-121-215.dsl.bell.ca.64650 > lamp-ubuntu-s-1vcpu-1gb-tor1-01.ssh: Flags [.], ack 2828, win 1021, length 0
04:08:36.015834 IP lamp-ubuntu-s-1vcpu-1gb-tor1-01.ssh > bras-base-toroon0817w-grc-26-184-146-121-215.dsl.bell.ca.64650: Flags [P.], seq 6552:6996, ack 1, win 501, length 444
04:08:36.015937 IP bras-base-toroon0817w-grc-26-184-146-121-215.dsl.bell.ca.64650 > lamp-ubuntu-s-1vcpu-1gb-tor1-01.ssh: Flags [.], ack 3096, win 1026, length 0
04:08:36.015945 IP lamp-ubuntu-s-1vcpu-1gb-tor1-01.ssh > bras-base-toroon0817w-grc-26-184-146-121-215.dsl.bell.ca.64650: Flags [P.], seq 6996:7280, ack 1, win 501, length 284
04:08:36.016013 IP lamp-ubuntu-s-1vcpu-1gb-tor1-01.ssh > bras-base-toroon0817w-grc-26-184-146-121-215.dsl.bell.ca.64650: Flags [P.], seq 7280:7724, ack 1, win 501, length 444
04:08:36.016102 IP lamp-ubuntu-s-1vcpu-1gb-tor1-01.ssh > bras-base-toroon0817w-grc-26-184-146-121-215.dsl.bell.ca.64650: Flags [P.], seq 7724:7992, ack 1, win 501, length 268
04:08:36.016152 IP lamp-ubuntu-s-1vcpu-1gb-tor1-01.ssh > bras-base-toroon0817w-grc-26-184-146-121-215.dsl.bell.ca.64650: Flags [P.], seq 7992:8452, ack 1, win 501, length 460
04:08:36.016185 IP lamp-ubuntu-s-1vcpu-1gb-tor1-01.ssh > bras-base-toroon0817w-grc-26-184-146-121-215.dsl.bell.ca.64650: Flags [P.], seq 8452:8488, ack 1, win 501, length 36
04:08:36.016193 IP bras-base-toroon0817w-grc-26-184-146-121-215.dsl.bell.ca.64650 > lamp-ubuntu-s-1vcpu-1gb-tor1-01.ssh: Flags [.], ack 3804, win 1023, length 0
04:08:36.016193 IP bras-base-toroon0817w-grc-26-184-146-121-215.dsl.bell.ca.64650 > lamp-ubuntu-s-1vcpu-1gb-tor1-01.ssh: Flags [.], ack 4088, win 1022, length 0
04:08:36.016261 IP lamp-ubuntu-s-1vcpu-1gb-tor1-01.ssh > bras-base-toroon0817w-grc-26-184-146-121-215.dsl.bell.ca.64650: Flags [P.], seq 8488:8736, ack 1, win 501, length 248
04:08:36.016331 IP lamp-ubuntu-s-1vcpu-1gb-tor1-01.ssh > bras-base-toroon0817w-grc-26-184-146-121-215.dsl.bell.ca.64650: Flags [P.], seq 8736:9232, ack 1, win 501, length 496
04:08:36.016401 IP lamp-ubuntu-s-1vcpu-1gb-tor1-01.ssh > bras-base-toroon0817w-grc-26-184-146-121-215.dsl.bell.ca.64650: Flags [P.], seq 9232:9660, ack 1, win 501, length 428
04:08:36.016473 IP lamp-ubuntu-s-1vcpu-1gb-tor1-01.ssh > bras-base-toroon0817w-grc-26-184-146-121-215.dsl.bell.ca.64650: Flags [P.], seq 9660:9944, ack 1, win 501, length 284
04:08:36.016479 IP bras-base-toroon0817w-grc-26-184-146-121-215.dsl.bell.ca.64650 > lamp-ubuntu-s-1vcpu-1gb-tor1-01.ssh: Flags [.], ack 4584, win 1026, length 0
04:08:36.016549 IP lamp-ubuntu-s-1vcpu-1gb-tor1-01.ssh > bras-base-toroon0817w-grc-26-184-146-121-215.dsl.bell.ca.64650: Flags [P.], seq 9944:10404, ack 1, win 501, length 460
04:08:36.016615 IP lamp-ubuntu-s-1vcpu-1gb-tor1-01.ssh > bras-base-toroon0817w-grc-26-184-146-121-215.dsl.bell.ca.64650: Flags [P.], seq 10404:10688, ack 1, win 501, length 284
04:08:36.016686 IP lamp-ubuntu-s-1vcpu-1gb-tor1-01.ssh > bras-base-toroon0817w-grc-26-184-146-121-215.dsl.bell.ca.64650: Flags [P.], seq 10688:11132, ack 1, win 501, length 444
04:08:36.016765 IP lamp-ubuntu-s-1vcpu-1gb-tor1-01.ssh > bras-base-toroon0817w-grc-26-184-146-121-215.dsl.bell.ca.64650: Flags [P.], seq 11132:11416, ack 1, win 501, length 284
04:08:36.016844 IP lamp-ubuntu-s-1vcpu-1gb-tor1-01.ssh > bras-base-toroon0817w-grc-26-184-146-121-215.dsl.bell.ca.64650: Flags [P.], seq 11416:11912, ack 1, win 501, length 496
04:08:36.016922 IP lamp-ubuntu-s-1vcpu-1gb-tor1-01.ssh > bras-base-toroon0817w-grc-26-184-146-121-215.dsl.bell.ca.64650: Flags [P.], seq 11912:12160, ack 1, win 501, length 248
04:08:36.016989 IP lamp-ubuntu-s-1vcpu-1gb-tor1-01.ssh > bras-base-toroon0817w-grc-26-184-146-121-215.dsl.bell.ca.64650: Flags [P.], seq 12160:12408, ack 1, win 501, length 248
04:08:36.017065 IP lamp-ubuntu-s-1vcpu-1gb-tor1-01.ssh > bras-base-toroon0817w-grc-26-184-146-121-215.dsl.bell.ca.64650: Flags [P.], seq 12408:12656, ack 1, win 501, length 248
04:08:36.017131 IP lamp-ubuntu-s-1vcpu-1gb-tor1-01.ssh > bras-base-toroon0817w-grc-26-184-146-121-215.dsl.bell.ca.64650: Flags [P.], seq 12656:12904, ack 1, win 501, length 248
04:08:36.017202 IP lamp-ubuntu-s-1vcpu-1gb-tor1-01.ssh > bras-base-toroon0817w-grc-26-184-146-121-215.dsl.bell.ca.64650: Flags [P.], seq 12904:13152, ack 1, win 501, length 248
04:08:36.017273 IP lamp-ubuntu-s-1vcpu-1gb-tor1-01.ssh > bras-base-toroon0817w-grc-26-184-146-121-215.dsl.bell.ca.64650: Flags [P.], seq 13152:13400, ack 1, win 501, length 248
04:08:36.017345 IP lamp-ubuntu-s-1vcpu-1gb-tor1-01.ssh > bras-base-toroon0817w-grc-26-184-146-121-215.dsl.bell.ca.64650: Flags [P.], seq 13400:13648, ack 1, win 501, length 248
04:08:36.017354 IP bras-base-toroon0817w-grc-26-184-146-121-215.dsl.bell.ca.64650 > lamp-ubuntu-s-1vcpu-1gb-tor1-01.ssh: Flags [.], ack 4584, win 1026, options [nop,nop,sack 1 {6036:6072}], length 0
04:08:36.017417 IP lamp-ubuntu-s-1vcpu-1gb-tor1-01.ssh > bras-base-toroon0817w-grc-26-184-146-121-215.dsl.bell.ca.64650: Flags [P.], seq 13648:13896, ack 1, win 501, length 248
04:08:36.017488 IP lamp-ubuntu-s-1vcpu-1gb-tor1-01.ssh > bras-base-toroon0817w-grc-26-184-146-121-215.dsl.bell.ca.64650: Flags [P.], seq 13896:14380, ack 1, win 501, length 484
04:08:36.017561 IP lamp-ubuntu-s-1vcpu-1gb-tor1-01.ssh > bras-base-toroon0817w-grc-26-184-146-121-215.dsl.bell.ca.64650: Flags [P.], seq 14380:14664, ack 1, win 501, length 284
04:08:36.017651 IP lamp-ubuntu-s-1vcpu-1gb-tor1-01.ssh > bras-base-toroon0817w-grc-26-184-146-121-215.dsl.bell.ca.64650: Flags [P.], seq 14664:14912, ack 1, win 501, length 248
04:08:36.017664 IP bras-base-toroon0817w-grc-26-184-146-121-215.dsl.bell.ca.64650 > lamp-ubuntu-s-1vcpu-1gb-tor1-01.ssh: Flags [.], ack 6072, win 1026, length 0
04:08:36.017664 IP bras-base-toroon0817w-grc-26-184-146-121-215.dsl.bell.ca.64650 > lamp-ubuntu-s-1vcpu-1gb-tor1-01.ssh: Flags [.], ack 6552, win 1024, length 0
04:08:36.017664 IP bras-base-toroon0817w-grc-26-184-146-121-215.dsl.bell.ca.64650 > lamp-ubuntu-s-1vcpu-1gb-tor1-01.ssh: Flags [.], ack 6996, win 1023, options [nop,nop,sack 1 {7724:7992}], length 0
04:08:36.017664 IP bras-base-toroon0817w-grc-26-184-146-121-215.dsl.bell.ca.64650 > lamp-ubuntu-s-1vcpu-1gb-tor1-01.ssh: Flags [.], ack 7280, win 1021, options [nop,nop,sack 1 {7724:7992}], length 0
04:08:36.017736 IP lamp-ubuntu-s-1vcpu-1gb-tor1-01.ssh > bras-base-toroon0817w-grc-26-184-146-121-215.dsl.bell.ca.64650: Flags [P.], seq 14912:15160, ack 1, win 501, length 248
04:08:36.017806 IP lamp-ubuntu-s-1vcpu-1gb-tor1-01.ssh > bras-base-toroon0817w-grc-26-184-146-121-215.dsl.bell.ca.64650: Flags [P.], seq 15160:15588, ack 1, win 501, length 428
04:08:36.017887 IP lamp-ubuntu-s-1vcpu-1gb-tor1-01.ssh > bras-base-toroon0817w-grc-26-184-146-121-215.dsl.bell.ca.64650: Flags [P.], seq 15588:15896, ack 1, win 501, length 308
04:08:36.017918 IP bras-base-toroon0817w-grc-26-184-146-121-215.dsl.bell.ca.64650 > lamp-ubuntu-s-1vcpu-1gb-tor1-01.ssh: Flags [.], ack 7992, win 1026, length 0
04:08:36.017918 IP bras-base-toroon0817w-grc-26-184-146-121-215.dsl.bell.ca.64650 > lamp-ubuntu-s-1vcpu-1gb-tor1-01.ssh: Flags [.], ack 8488, win 1024, length 0
04:08:36.017918 IP bras-base-toroon0817w-grc-26-184-146-121-215.dsl.bell.ca.64650 > lamp-ubuntu-s-1vcpu-1gb-tor1-01.ssh: Flags [.], ack 8736, win 1023, length 0
04:08:36.018086 IP lamp-ubuntu-s-1vcpu-1gb-tor1-01.ssh > bras-base-toroon0817w-grc-26-184-146-121-215.dsl.bell.ca.64650: Flags [P.], seq 15896:16664, ack 1, win 501, length 768
04:08:36.018174 IP lamp-ubuntu-s-1vcpu-1gb-tor1-01.ssh > bras-base-toroon0817w-grc-26-184-146-121-215.dsl.bell.ca.64650: Flags [P.], seq 16664:17144, ack 1, win 501, length 480
04:08:36.018183 IP bras-base-toroon0817w-grc-26-184-146-121-215.dsl.bell.ca.64650 > lamp-ubuntu-s-1vcpu-1gb-tor1-01.ssh: Flags [.], ack 9660, win 1026, length 0
04:08:36.018257 IP lamp-ubuntu-s-1vcpu-1gb-tor1-01.ssh > bras-base-toroon0817w-grc-26-184-146-121-215.dsl.bell.ca.64650: Flags [P.], seq 17144:17572, ack 1, win 501, length 428
04:08:36.018267 IP bras-base-toroon0817w-grc-26-184-146-121-215.dsl.bell.ca.64650 > lamp-ubuntu-s-1vcpu-1gb-tor1-01.ssh: Flags [.], ack 10404, win 1023, length 0
04:08:36.018267 IP bras-base-toroon0817w-grc-26-184-146-121-215.dsl.bell.ca.64650 > lamp-ubuntu-s-1vcpu-1gb-tor1-01.ssh: Flags [.], ack 11132, win 1026, length 0
04:08:36.018341 IP lamp-ubuntu-s-1vcpu-1gb-tor1-01.ssh > bras-base-toroon0817w-grc-26-184-146-121-215.dsl.bell.ca.64650: Flags [P.], seq 17572:17856, ack 1, win 501, length 284
04:08:36.018457 IP lamp-ubuntu-s-1vcpu-1gb-tor1-01.ssh > bras-base-toroon0817w-grc-26-184-146-121-215.dsl.bell.ca.64650: Flags [P.], seq 17856:18104, ack 1, win 501, length 248
04:08:36.018510 IP lamp-ubuntu-s-1vcpu-1gb-tor1-01.ssh > bras-base-toroon0817w-grc-26-184-146-121-215.dsl.bell.ca.64650: Flags [P.], seq 18104:18548, ack 1, win 501, length 444
04:08:36.018544 IP lamp-ubuntu-s-1vcpu-1gb-tor1-01.ssh > bras-base-toroon0817w-grc-26-184-146-121-215.dsl.bell.ca.64650: Flags [P.], seq 18548:18584, ack 1, win 501, length 36
04:08:36.018571 IP bras-base-toroon0817w-grc-26-184-146-121-215.dsl.bell.ca.64650 > lamp-ubuntu-s-1vcpu-1gb-tor1-01.ssh: Flags [.], ack 12160, win 1022, length 0
04:08:36.018571 IP bras-base-toroon0817w-grc-26-184-146-121-215.dsl.bell.ca.64650 > lamp-ubuntu-s-1vcpu-1gb-tor1-01.ssh: Flags [.], ack 12408, win 1021, length 0
04:08:36.018694 IP lamp-ubuntu-s-1vcpu-1gb-tor1-01.ssh > bras-base-toroon0817w-grc-26-184-146-121-215.dsl.bell.ca.64650: Flags [P.], seq 18780:19048, ack 1, win 501, length 268
04:08:36.018775 IP lamp-ubuntu-s-1vcpu-1gb-tor1-01.ssh > bras-base-toroon0817w-grc-26-184-146-121-215.dsl.bell.ca.64650: Flags [P.], seq 19048:19508, ack 1, win 501, length 460
04:08:36.018845 IP lamp-ubuntu-s-1vcpu-1gb-tor1-01.ssh > bras-base-toroon0817w-grc-26-184-146-121-215.dsl.bell.ca.64650: Flags [P.], seq 19508:19792, ack 1, win 501, length 284
04:08:36.018853 IP bras-base-toroon0817w-grc-26-184-146-121-215.dsl.bell.ca.64650 > lamp-ubuntu-s-1vcpu-1gb-tor1-01.ssh: Flags [.], ack 12904, win 1026, length 0
04:08:36.018853 IP bras-base-toroon0817w-grc-26-184-146-121-215.dsl.bell.ca.64650 > lamp-ubuntu-s-1vcpu-1gb-tor1-01.ssh: Flags [.], ack 13400, win 1024, length 0
04:08:36.018921 IP lamp-ubuntu-s-1vcpu-1gb-tor1-01.ssh > bras-base-toroon0817w-grc-26-184-146-121-215.dsl.bell.ca.64650: Flags [P.], seq 19792:20236, ack 1, win 501, length 444
04:08:36.018990 IP lamp-ubuntu-s-1vcpu-1gb-tor1-01.ssh > bras-base-toroon0817w-grc-26-184-146-121-215.dsl.bell.ca.64650: Flags [P.], seq 20236:20504, ack 1, win 501, length 268
04:08:36.019063 IP lamp-ubuntu-s-1vcpu-1gb-tor1-01.ssh > bras-base-toroon0817w-grc-26-184-146-121-215.dsl.bell.ca.64650: Flags [P.], seq 20504:21000, ack 1, win 501, length 496
04:08:36.019069 IP bras-base-toroon0817w-grc-26-184-146-121-215.dsl.bell.ca.64650 > lamp-ubuntu-s-1vcpu-1gb-tor1-01.ssh: Flags [.], ack 13896, win 1022, length 0
04:08:36.019134 IP lamp-ubuntu-s-1vcpu-1gb-tor1-01.ssh > bras-base-toroon0817w-grc-26-184-146-121-215.dsl.bell.ca.64650: Flags [P.], seq 21000:21248, ack 1, win 501, length 248
04:08:36.019209 IP lamp-ubuntu-s-1vcpu-1gb-tor1-01.ssh > bras-base-toroon0817w-grc-26-184-146-121-215.dsl.bell.ca.64650: Flags [P.], seq 21248:21712, ack 1, win 501, length 464
04:08:36.019215 IP bras-base-toroon0817w-grc-26-184-146-121-215.dsl.bell.ca.64650 > lamp-ubuntu-s-1vcpu-1gb-tor1-01.ssh: Flags [.], ack 14664, win 1026, length 0
04:08:36.019292 IP lamp-ubuntu-s-1vcpu-1gb-tor1-01.ssh > bras-base-toroon0817w-grc-26-184-146-121-215.dsl.bell.ca.64650: Flags [P.], seq 21712:22172, ack 1, win 501, length 460
04:08:36.019363 IP lamp-ubuntu-s-1vcpu-1gb-tor1-01.ssh > bras-base-toroon0817w-grc-26-184-146-121-215.dsl.bell.ca.64650: Flags [P.], seq 22172:22456, ack 1, win 501, length 284
04:08:36.019367 IP bras-base-toroon0817w-grc-26-184-146-121-215.dsl.bell.ca.64650 > lamp-ubuntu-s-1vcpu-1gb-tor1-01.ssh: Flags [.], ack 15160, win 1024, length 0
04:08:36.019367 IP bras-base-toroon0817w-grc-26-184-146-121-215.dsl.bell.ca.64650 > lamp-ubuntu-s-1vcpu-1gb-tor1-01.ssh: Flags [.], ack 15896, win 1021, length 0
04:08:36.019516 IP lamp-ubuntu-s-1vcpu-1gb-tor1-01.ssh > bras-base-toroon0817w-grc-26-184-146-121-215.dsl.bell.ca.64650: Flags [P.], seq 22456:23416, ack 1, win 501, length 960
04:08:36.019600 IP lamp-ubuntu-s-1vcpu-1gb-tor1-01.ssh > bras-base-toroon0817w-grc-26-184-146-121-215.dsl.bell.ca.64650: Flags [P.], seq 23416:23876, ack 1, win 501, length 460
04:08:36.019673 IP lamp-ubuntu-s-1vcpu-1gb-tor1-01.ssh > bras-base-toroon0817w-grc-26-184-146-121-215.dsl.bell.ca.64650: Flags [P.], seq 23876:24340, ack 1, win 501, length 464
04:08:36.019693 IP bras-base-toroon0817w-grc-26-184-146-121-215.dsl.bell.ca.64650 > lamp-ubuntu-s-1vcpu-1gb-tor1-01.ssh: Flags [.], ack 17144, win 1026, length 0
04:08:36.019767 IP lamp-ubuntu-s-1vcpu-1gb-tor1-01.ssh > bras-base-toroon0817w-grc-26-184-146-121-215.dsl.bell.ca.64650: Flags [P.], seq 24340:24624, ack 1, win 501, length 284
04:08:36.019776 IP bras-base-toroon0817w-grc-26-184-146-121-215.dsl.bell.ca.64650 > lamp-ubuntu-s-1vcpu-1gb-tor1-01.ssh: Flags [.], ack 17856, win 1023, length 0
04:08:36.019827 IP lamp-ubuntu-s-1vcpu-1gb-tor1-01.ssh > bras-base-toroon0817w-grc-26-184-146-121-215.dsl.bell.ca.64650: Flags [P.], seq 24624:25084, ack 1, win 501, length 460
04:08:36.019914 IP lamp-ubuntu-s-1vcpu-1gb-tor1-01.ssh > bras-base-toroon0817w-grc-26-184-146-121-215.dsl.bell.ca.64650: Flags [P.], seq 25084:25564, ack 1, win 501, length 480
04:08:36.020001 IP lamp-ubuntu-s-1vcpu-1gb-tor1-01.ssh > bras-base-toroon0817w-grc-26-184-146-121-215.dsl.bell.ca.64650: Flags [P.], seq 25564:25832, ack 1, win 501, length 268
04:08:36.020009 IP bras-base-toroon0817w-grc-26-184-146-121-215.dsl.bell.ca.64650 > lamp-ubuntu-s-1vcpu-1gb-tor1-01.ssh: Flags [.], ack 18584, win 1020, length 0
04:08:36.020061 IP lamp-ubuntu-s-1vcpu-1gb-tor1-01.ssh > bras-base-toroon0817w-grc-26-184-146-121-215.dsl.bell.ca.64650: Flags [P.], seq 25832:26292, ack 1, win 501, length 460
04:08:36.020150 IP lamp-ubuntu-s-1vcpu-1gb-tor1-01.ssh > bras-base-toroon0817w-grc-26-184-146-121-215.dsl.bell.ca.64650: Flags [P.], seq 26292:26772, ack 1, win 501, length 480
04:08:36.020160 IP bras-base-toroon0817w-grc-26-184-146-121-215.dsl.bell.ca.64650 > lamp-ubuntu-s-1vcpu-1gb-tor1-01.ssh: Flags [.], ack 18780, win 1026, length 0
04:08:36.020243 IP lamp-ubuntu-s-1vcpu-1gb-tor1-01.ssh > bras-base-toroon0817w-grc-26-184-146-121-215.dsl.bell.ca.64650: Flags [P.], seq 26772:26808, ack 1, win 501, length 36
04:08:36.020292 IP lamp-ubuntu-s-1vcpu-1gb-tor1-01.ssh > bras-base-toroon0817w-grc-26-184-146-121-215.dsl.bell.ca.64650: Flags [P.], seq 26808:27020, ack 1, win 501, length 212
04:08:36.020330 IP lamp-ubuntu-s-1vcpu-1gb-tor1-01.ssh > bras-base-toroon0817w-grc-26-184-146-121-215.dsl.bell.ca.64650: Flags [P.], seq 27020:27056, ack 1, win 501, length 36
04:08:36.020403 IP lamp-ubuntu-s-1vcpu-1gb-tor1-01.ssh > bras-base-toroon0817w-grc-26-184-146-121-215.dsl.bell.ca.64650: Flags [P.], seq 27056:27500, ack 1, win 501, length 444
04:08:36.020477 IP lamp-ubuntu-s-1vcpu-1gb-tor1-01.ssh > bras-base-toroon0817w-grc-26-184-146-121-215.dsl.bell.ca.64650: Flags [P.], seq 27500:27784, ack 1, win 501, length 284
04:08:36.020541 IP lamp-ubuntu-s-1vcpu-1gb-tor1-01.ssh > bras-base-toroon0817w-grc-26-184-146-121-215.dsl.bell.ca.64650: Flags [P.], seq 27784:28032, ack 1, win 501, length 248
04:08:36.020612 IP lamp-ubuntu-s-1vcpu-1gb-tor1-01.ssh > bras-base-toroon0817w-grc-26-184-146-121-215.dsl.bell.ca.64650: Flags [P.], seq 28032:28528, ack 1, win 501, length 496
04:08:36.020620 IP bras-base-toroon0817w-grc-26-184-146-121-215.dsl.bell.ca.64650 > lamp-ubuntu-s-1vcpu-1gb-tor1-01.ssh: Flags [.], ack 19508, win 1023, length 0
04:08:36.020620 IP bras-base-toroon0817w-grc-26-184-146-121-215.dsl.bell.ca.64650 > lamp-ubuntu-s-1vcpu-1gb-tor1-01.ssh: Flags [.], ack 20236, win 1026, length 0
04:08:36.020620 IP bras-base-toroon0817w-grc-26-184-146-121-215.dsl.bell.ca.64650 > lamp-ubuntu-s-1vcpu-1gb-tor1-01.ssh: Flags [.], ack 21000, win 1023, length 0
04:08:36.020779 IP lamp-ubuntu-s-1vcpu-1gb-tor1-01.ssh > bras-base-toroon0817w-grc-26-184-146-121-215.dsl.bell.ca.64650: Flags [P.], seq 28528:29468, ack 1, win 501, length 940
04:08:36.020864 IP lamp-ubuntu-s-1vcpu-1gb-tor1-01.ssh > bras-base-toroon0817w-grc-26-184-146-121-215.dsl.bell.ca.64650: Flags [P.], seq 29468:29736, ack 1, win 501, length 268
04:08:36.020934 IP lamp-ubuntu-s-1vcpu-1gb-tor1-01.ssh > bras-base-toroon0817w-grc-26-184-146-121-215.dsl.bell.ca.64650: Flags [P.], seq 29736:30180, ack 1, win 501, length 444
04:08:36.021018 IP lamp-ubuntu-s-1vcpu-1gb-tor1-01.ssh > bras-base-toroon0817w-grc-26-184-146-121-215.dsl.bell.ca.64650: Flags [P.], seq 30180:30464, ack 1, win 501, length 284
04:08:36.021029 IP bras-base-toroon0817w-grc-26-184-146-121-215.dsl.bell.ca.64650 > lamp-ubuntu-s-1vcpu-1gb-tor1-01.ssh: Flags [.], ack 21712, win 1026, length 0
04:08:36.021029 IP bras-base-toroon0817w-grc-26-184-146-121-215.dsl.bell.ca.64650 > lamp-ubuntu-s-1vcpu-1gb-tor1-01.ssh: Flags [.], ack 22456, win 1023, length 0
04:08:36.021084 IP lamp-ubuntu-s-1vcpu-1gb-tor1-01.ssh > bras-base-toroon0817w-grc-26-184-146-121-215.dsl.bell.ca.64650: Flags [P.], seq 30464:30924, ack 1, win 501, length 460
04:08:36.021174 IP lamp-ubuntu-s-1vcpu-1gb-tor1-01.ssh > bras-base-toroon0817w-grc-26-184-146-121-215.dsl.bell.ca.64650: Flags [P.], seq 30924:31388, ack 1, win 501, length 464
04:08:36.021181 IP bras-base-toroon0817w-grc-26-184-146-121-215.dsl.bell.ca.64650 > lamp-ubuntu-s-1vcpu-1gb-tor1-01.ssh: Flags [.], ack 23876, win 1026, length 0
04:08:36.021257 IP lamp-ubuntu-s-1vcpu-1gb-tor1-01.ssh > bras-base-toroon0817w-grc-26-184-146-121-215.dsl.bell.ca.64650: Flags [P.], seq 31388:31672, ack 1, win 501, length 284
04:08:36.021321 IP lamp-ubuntu-s-1vcpu-1gb-tor1-01.ssh > bras-base-toroon0817w-grc-26-184-146-121-215.dsl.bell.ca.64650: Flags [P.], seq 31672:32116, ack 1, win 501, length 444
04:08:36.021352 IP lamp-ubuntu-s-1vcpu-1gb-tor1-01.ssh > bras-base-toroon0817w-grc-26-184-146-121-215.dsl.bell.ca.64650: Flags [P.], seq 32116:32152, ack 1, win 501, length 36
04:08:36.021423 IP lamp-ubuntu-s-1vcpu-1gb-tor1-01.ssh > bras-base-toroon0817w-grc-26-184-146-121-215.dsl.bell.ca.64650: Flags [P.], seq 32152:32400, ack 1, win 501, length 248
04:08:36.021498 IP bras-base-toroon0817w-grc-26-184-146-121-215.dsl.bell.ca.64650 > lamp-ubuntu-s-1vcpu-1gb-tor1-01.ssh: Flags [.], ack 24624, win 1023, length 0
04:08:36.021498 IP bras-base-toroon0817w-grc-26-184-146-121-215.dsl.bell.ca.64650 > lamp-ubuntu-s-1vcpu-1gb-tor1-01.ssh: Flags [.], ack 25564, win 1026, length 0
04:08:36.021508 IP lamp-ubuntu-s-1vcpu-1gb-tor1-01.ssh > bras-base-toroon0817w-grc-26-184-146-121-215.dsl.bell.ca.64650: Flags [P.], seq 32400:32648, ack 1, win 501, length 248
04:08:36.021570 IP lamp-ubuntu-s-1vcpu-1gb-tor1-01.ssh > bras-base-toroon0817w-grc-26-184-146-121-215.dsl.bell.ca.64650: Flags [P.], seq 32648:32896, ack 1, win 501, length 248
04:08:36.021639 IP lamp-ubuntu-s-1vcpu-1gb-tor1-01.ssh > bras-base-toroon0817w-grc-26-184-146-121-215.dsl.bell.ca.64650: Flags [P.], seq 32896:33144, ack 1, win 501, length 248
04:08:36.021720 IP lamp-ubuntu-s-1vcpu-1gb-tor1-01.ssh > bras-base-toroon0817w-grc-26-184-146-121-215.dsl.bell.ca.64650: Flags [P.], seq 33144:33608, ack 1, win 501, length 464
04:08:36.021726 IP bras-base-toroon0817w-grc-26-184-146-121-215.dsl.bell.ca.64650 > lamp-ubuntu-s-1vcpu-1gb-tor1-01.ssh: Flags [.], ack 26292, win 1023, length 0
04:08:36.021793 IP lamp-ubuntu-s-1vcpu-1gb-tor1-01.ssh > bras-base-toroon0817w-grc-26-184-146-121-215.dsl.bell.ca.64650: Flags [P.], seq 33608:34068, ack 1, win 501, length 460
04:08:36.021870 IP lamp-ubuntu-s-1vcpu-1gb-tor1-01.ssh > bras-base-toroon0817w-grc-26-184-146-121-215.dsl.bell.ca.64650: Flags [P.], seq 34068:34352, ack 1, win 501, length 284
04:08:36.021945 IP lamp-ubuntu-s-1vcpu-1gb-tor1-01.ssh > bras-base-toroon0817w-grc-26-184-146-121-215.dsl.bell.ca.64650: Flags [P.], seq 34352:34796, ack 1, win 501, length 444
04:08:36.022046 IP bras-base-toroon0817w-grc-26-184-146-121-215.dsl.bell.ca.64650 > lamp-ubuntu-s-1vcpu-1gb-tor1-01.ssh: Flags [.], ack 26808, win 1021, length 0
04:08:36.022053 IP lamp-ubuntu-s-1vcpu-1gb-tor1-01.ssh > bras-base-toroon0817w-grc-26-184-146-121-215.dsl.bell.ca.64650: Flags [P.], seq 34796:35080, ack 1, win 501, length 284
04:08:36.022102 IP lamp-ubuntu-s-1vcpu-1gb-tor1-01.ssh > bras-base-toroon0817w-grc-26-184-146-121-215.dsl.bell.ca.64650: Flags [P.], seq 35080:35328, ack 1, win 501, length 248
04:08:36.022169 IP lamp-ubuntu-s-1vcpu-1gb-tor1-01.ssh > bras-base-toroon0817w-grc-26-184-146-121-215.dsl.bell.ca.64650: Flags [P.], seq 35328:35772, ack 1, win 501, length 444
04:08:36.022239 IP lamp-ubuntu-s-1vcpu-1gb-tor1-01.ssh > bras-base-toroon0817w-grc-26-184-146-121-215.dsl.bell.ca.64650: Flags [P.], seq 35772:36056, ack 1, win 501, length 284
04:08:36.022310 IP lamp-ubuntu-s-1vcpu-1gb-tor1-01.ssh > bras-base-toroon0817w-grc-26-184-146-121-215.dsl.bell.ca.64650: Flags [P.], seq 36056:36516, ack 1, win 501, length 460
04:08:36.022404 IP lamp-ubuntu-s-1vcpu-1gb-tor1-01.ssh > bras-base-toroon0817w-grc-26-184-146-121-215.dsl.bell.ca.64650: Flags [P.], seq 36516:37012, ack 1, win 501, length 496
04:08:36.022413 IP bras-base-toroon0817w-grc-26-184-146-121-215.dsl.bell.ca.64650 > lamp-ubuntu-s-1vcpu-1gb-tor1-01.ssh: Flags [.], ack 27056, win 1026, length 0
04:08:36.022413 IP bras-base-toroon0817w-grc-26-184-146-121-215.dsl.bell.ca.64650 > lamp-ubuntu-s-1vcpu-1gb-tor1-01.ssh: Flags [.], ack 27784, win 1023, length 0
04:08:36.022413 IP bras-base-toroon0817w-grc-26-184-146-121-215.dsl.bell.ca.64650 > lamp-ubuntu-s-1vcpu-1gb-tor1-01.ssh: Flags [.], ack 28528, win 1026, length 0
04:08:36.022483 IP lamp-ubuntu-s-1vcpu-1gb-tor1-01.ssh > bras-base-toroon0817w-grc-26-184-146-121-215.dsl.bell.ca.64650: Flags [P.], seq 37012:37260, ack 1, win 501, length 248
04:08:36.022559 IP lamp-ubuntu-s-1vcpu-1gb-tor1-01.ssh > bras-base-toroon0817w-grc-26-184-146-121-215.dsl.bell.ca.64650: Flags [P.], seq 37260:37492, ack 1, win 501, length 232
04:08:36.022626 IP lamp-ubuntu-s-1vcpu-1gb-tor1-01.ssh > bras-base-toroon0817w-grc-26-184-146-121-215.dsl.bell.ca.64650: Flags [P.], seq 37492:37760, ack 1, win 501, length 268
04:08:36.022633 IP bras-base-toroon0817w-grc-26-184-146-121-215.dsl.bell.ca.64650 > lamp-ubuntu-s-1vcpu-1gb-tor1-01.ssh: Flags [.], ack 30464, win 1026, length 0
04:08:36.022711 IP lamp-ubuntu-s-1vcpu-1gb-tor1-01.ssh > bras-base-toroon0817w-grc-26-184-146-121-215.dsl.bell.ca.64650: Flags [P.], seq 37760:38204, ack 1, win 501, length 444
04:08:36.022797 IP lamp-ubuntu-s-1vcpu-1gb-tor1-01.ssh > bras-base-toroon0817w-grc-26-184-146-121-215.dsl.bell.ca.64650: Flags [P.], seq 38204:38832, ack 1, win 501, length 628
04:08:36.022877 IP bras-base-toroon0817w-grc-26-184-146-121-215.dsl.bell.ca.64650 > lamp-ubuntu-s-1vcpu-1gb-tor1-01.ssh: Flags [.], ack 31672, win 1021, length 0
04:08:36.022886 IP lamp-ubuntu-s-1vcpu-1gb-tor1-01.ssh > bras-base-toroon0817w-grc-26-184-146-121-215.dsl.bell.ca.64650: Flags [P.], seq 38832:39264, ack 1, win 501, length 432
04:08:36.022949 IP lamp-ubuntu-s-1vcpu-1gb-tor1-01.ssh > bras-base-toroon0817w-grc-26-184-146-121-215.dsl.bell.ca.64650: Flags [P.], seq 39264:39460, ack 1, win 501, length 196
04:08:36.023020 IP lamp-ubuntu-s-1vcpu-1gb-tor1-01.ssh > bras-base-toroon0817w-grc-26-184-146-121-215.dsl.bell.ca.64650: Flags [P.], seq 39460:39892, ack 1, win 501, length 432
04:08:36.023092 IP bras-base-toroon0817w-grc-26-184-146-121-215.dsl.bell.ca.64650 > lamp-ubuntu-s-1vcpu-1gb-tor1-01.ssh: Flags [.], ack 32648, win 1026, length 0
04:08:36.023100 IP lamp-ubuntu-s-1vcpu-1gb-tor1-01.ssh > bras-base-toroon0817w-grc-26-184-146-121-215.dsl.bell.ca.64650: Flags [P.], seq 39892:40104, ack 1, win 501, length 212
04:08:36.023164 IP lamp-ubuntu-s-1vcpu-1gb-tor1-01.ssh > bras-base-toroon0817w-grc-26-184-146-121-215.dsl.bell.ca.64650: Flags [P.], seq 40104:40484, ack 1, win 501, length 380
04:08:36.023235 IP lamp-ubuntu-s-1vcpu-1gb-tor1-01.ssh > bras-base-toroon0817w-grc-26-184-146-121-215.dsl.bell.ca.64650: Flags [P.], seq 40484:40732, ack 1, win 501, length 248
04:08:36.023307 IP lamp-ubuntu-s-1vcpu-1gb-tor1-01.ssh > bras-base-toroon0817w-grc-26-184-146-121-215.dsl.bell.ca.64650: Flags [P.], seq 40732:40944, ack 1, win 501, length 212
04:08:36.023385 IP lamp-ubuntu-s-1vcpu-1gb-tor1-01.ssh > bras-base-toroon0817w-grc-26-184-146-121-215.dsl.bell.ca.64650: Flags [P.], seq 40944:41156, ack 1, win 501, length 212
04:08:36.023449 IP bras-base-toroon0817w-grc-26-184-146-121-215.dsl.bell.ca.64650 > lamp-ubuntu-s-1vcpu-1gb-tor1-01.ssh: Flags [.], ack 34068, win 1021, length 0
04:08:36.023459 IP lamp-ubuntu-s-1vcpu-1gb-tor1-01.ssh > bras-base-toroon0817w-grc-26-184-146-121-215.dsl.bell.ca.64650: Flags [P.], seq 41156:41368, ack 1, win 501, length 212
04:08:36.023520 IP lamp-ubuntu-s-1vcpu-1gb-tor1-01.ssh > bras-base-toroon0817w-grc-26-184-146-121-215.dsl.bell.ca.64650: Flags [P.], seq 41368:41784, ack 1, win 501, length 416
04:08:36.023592 IP lamp-ubuntu-s-1vcpu-1gb-tor1-01.ssh > bras-base-toroon0817w-grc-26-184-146-121-215.dsl.bell.ca.64650: Flags [P.], seq 41784:41996, ack 1, win 501, length 212
04:08:36.023667 IP lamp-ubuntu-s-1vcpu-1gb-tor1-01.ssh > bras-base-toroon0817w-grc-26-184-146-121-215.dsl.bell.ca.64650: Flags [P.], seq 41996:42208, ack 1, win 501, length 212
04:08:36.023743 IP lamp-ubuntu-s-1vcpu-1gb-tor1-01.ssh > bras-base-toroon0817w-grc-26-184-146-121-215.dsl.bell.ca.64650: Flags [P.], seq 42208:42420, ack 1, win 501, length 212
04:08:36.023815 IP lamp-ubuntu-s-1vcpu-1gb-tor1-01.ssh > bras-base-toroon0817w-grc-26-184-146-121-215.dsl.bell.ca.64650: Flags [P.], seq 42420:42632, ack 1, win 501, length 212
04:08:36.023825 IP bras-base-toroon0817w-grc-26-184-146-121-215.dsl.bell.ca.64650 > lamp-ubuntu-s-1vcpu-1gb-tor1-01.ssh: Flags [.], ack 35328, win 1026, length 0
04:08:36.023888 IP lamp-ubuntu-s-1vcpu-1gb-tor1-01.ssh > bras-base-toroon0817w-grc-26-184-146-121-215.dsl.bell.ca.64650: Flags [P.], seq 42632:43012, ack 1, win 501, length 380
04:08:36.023958 IP lamp-ubuntu-s-1vcpu-1gb-tor1-01.ssh > bras-base-toroon0817w-grc-26-184-146-121-215.dsl.bell.ca.64650: Flags [P.], seq 43012:43224, ack 1, win 501, length 212
04:08:36.024029 IP lamp-ubuntu-s-1vcpu-1gb-tor1-01.ssh > bras-base-toroon0817w-grc-26-184-146-121-215.dsl.bell.ca.64650: Flags [P.], seq 43224:43436, ack 1, win 501, length 212
04:08:36.024101 IP lamp-ubuntu-s-1vcpu-1gb-tor1-01.ssh > bras-base-toroon0817w-grc-26-184-146-121-215.dsl.bell.ca.64650: Flags [P.], seq 43436:43648, ack 1, win 501, length 212
04:08:36.024111 IP bras-base-toroon0817w-grc-26-184-146-121-215.dsl.bell.ca.64650 > lamp-ubuntu-s-1vcpu-1gb-tor1-01.ssh: Flags [.], ack 36516, win 1021, length 0
04:08:36.024174 IP lamp-ubuntu-s-1vcpu-1gb-tor1-01.ssh > bras-base-toroon0817w-grc-26-184-146-121-215.dsl.bell.ca.64650: Flags [P.], seq 43648:44028, ack 1, win 501, length 380
04:08:36.024244 IP lamp-ubuntu-s-1vcpu-1gb-tor1-01.ssh > bras-base-toroon0817w-grc-26-184-146-121-215.dsl.bell.ca.64650: Flags [P.], seq 44028:44240, ack 1, win 501, length 212
04:08:36.024315 IP lamp-ubuntu-s-1vcpu-1gb-tor1-01.ssh > bras-base-toroon0817w-grc-26-184-146-121-215.dsl.bell.ca.64650: Flags [P.], seq 44240:44488, ack 1, win 501, length 248
04:08:36.024386 IP lamp-ubuntu-s-1vcpu-1gb-tor1-01.ssh > bras-base-toroon0817w-grc-26-184-146-121-215.dsl.bell.ca.64650: Flags [P.], seq 44488:44700, ack 1, win 501, length 212
04:08:36.024457 IP lamp-ubuntu-s-1vcpu-1gb-tor1-01.ssh > bras-base-toroon0817w-grc-26-184-146-121-215.dsl.bell.ca.64650: Flags [P.], seq 44700:44912, ack 1, win 501, length 212
04:08:36.024528 IP lamp-ubuntu-s-1vcpu-1gb-tor1-01.ssh > bras-base-toroon0817w-grc-26-184-146-121-215.dsl.bell.ca.64650: Flags [P.], seq 44912:45124, ack 1, win 501, length 212
04:08:36.024601 IP bras-base-toroon0817w-grc-26-184-146-121-215.dsl.bell.ca.64650 > lamp-ubuntu-s-1vcpu-1gb-tor1-01.ssh: Flags [.], ack 37760, win 1026, length 0
04:08:36.024612 IP lamp-ubuntu-s-1vcpu-1gb-tor1-01.ssh > bras-base-toroon0817w-grc-26-184-146-121-215.dsl.bell.ca.64650: Flags [P.], seq 45124:45372, ack 1, win 501, length 248
04:08:36.024673 IP lamp-ubuntu-s-1vcpu-1gb-tor1-01.ssh > bras-base-toroon0817w-grc-26-184-146-121-215.dsl.bell.ca.64650: Flags [P.], seq 45372:45752, ack 1, win 501, length 380
04:08:36.024751 IP lamp-ubuntu-s-1vcpu-1gb-tor1-01.ssh > bras-base-toroon0817w-grc-26-184-146-121-215.dsl.bell.ca.64650: Flags [P.], seq 45752:45964, ack 1, win 501, length 212
04:08:36.024823 IP lamp-ubuntu-s-1vcpu-1gb-tor1-01.ssh > bras-base-toroon0817w-grc-26-184-146-121-215.dsl.bell.ca.64650: Flags [P.], seq 45964:46176, ack 1, win 501, length 212
04:08:36.024833 IP bras-base-toroon0817w-grc-26-184-146-121-215.dsl.bell.ca.64650 > lamp-ubuntu-s-1vcpu-1gb-tor1-01.ssh: Flags [.], ack 39460, win 1026, length 0
04:08:36.024896 IP lamp-ubuntu-s-1vcpu-1gb-tor1-01.ssh > bras-base-toroon0817w-grc-26-184-146-121-215.dsl.bell.ca.64650: Flags [P.], seq 46176:46556, ack 1, win 501, length 380
04:08:36.024966 IP lamp-ubuntu-s-1vcpu-1gb-tor1-01.ssh > bras-base-toroon0817w-grc-26-184-146-121-215.dsl.bell.ca.64650: Flags [P.], seq 46556:46768, ack 1, win 501, length 212
04:08:36.025038 IP lamp-ubuntu-s-1vcpu-1gb-tor1-01.ssh > bras-base-toroon0817w-grc-26-184-146-121-215.dsl.bell.ca.64650: Flags [P.], seq 46768:46980, ack 1, win 501, length 212
04:08:36.025111 IP lamp-ubuntu-s-1vcpu-1gb-tor1-01.ssh > bras-base-toroon0817w-grc-26-184-146-121-215.dsl.bell.ca.64650: Flags [P.], seq 46980:47192, ack 1, win 501, length 212
04:08:36.025121 IP bras-base-toroon0817w-grc-26-184-146-121-215.dsl.bell.ca.64650 > lamp-ubuntu-s-1vcpu-1gb-tor1-01.ssh: Flags [.], ack 40944, win 1026, length 0
04:08:36.025184 IP lamp-ubuntu-s-1vcpu-1gb-tor1-01.ssh > bras-base-toroon0817w-grc-26-184-146-121-215.dsl.bell.ca.64650: Flags [P.], seq 47192:47572, ack 1, win 501, length 380
04:08:36.025256 IP lamp-ubuntu-s-1vcpu-1gb-tor1-01.ssh > bras-base-toroon0817w-grc-26-184-146-121-215.dsl.bell.ca.64650: Flags [P.], seq 47572:47784, ack 1, win 501, length 212
04:08:36.025282 IP bras-base-toroon0817w-grc-26-184-146-121-215.dsl.bell.ca.64650 > lamp-ubuntu-s-1vcpu-1gb-tor1-01.ssh: Flags [.], ack 41996, win 1022, length 0
04:08:36.025331 IP lamp-ubuntu-s-1vcpu-1gb-tor1-01.ssh > bras-base-toroon0817w-grc-26-184-146-121-215.dsl.bell.ca.64650: Flags [P.], seq 47784:48164, ack 1, win 501, length 380
04:08:36.025399 IP lamp-ubuntu-s-1vcpu-1gb-tor1-01.ssh > bras-base-toroon0817w-grc-26-184-146-121-215.dsl.bell.ca.64650: Flags [P.], seq 48164:48376, ack 1, win 501, length 212
04:08:36.025470 IP lamp-ubuntu-s-1vcpu-1gb-tor1-01.ssh > bras-base-toroon0817w-grc-26-184-146-121-215.dsl.bell.ca.64650: Flags [P.], seq 48376:48588, ack 1, win 501, length 212
04:08:36.025546 IP lamp-ubuntu-s-1vcpu-1gb-tor1-01.ssh > bras-base-toroon0817w-grc-26-184-146-121-215.dsl.bell.ca.64650: Flags [P.], seq 48588:48800, ack 1, win 501, length 212
04:08:36.025614 IP bras-base-toroon0817w-grc-26-184-146-121-215.dsl.bell.ca.64650 > lamp-ubuntu-s-1vcpu-1gb-tor1-01.ssh: Flags [.], ack 43012, win 1026, length 0
04:08:36.025623 IP lamp-ubuntu-s-1vcpu-1gb-tor1-01.ssh > bras-base-toroon0817w-grc-26-184-146-121-215.dsl.bell.ca.64650: Flags [P.], seq 48800:49012, ack 1, win 501, length 212
04:08:36.025688 IP lamp-ubuntu-s-1vcpu-1gb-tor1-01.ssh > bras-base-toroon0817w-grc-26-184-146-121-215.dsl.bell.ca.64650: Flags [P.], seq 49012:49392, ack 1, win 501, length 380
04:08:36.025765 IP lamp-ubuntu-s-1vcpu-1gb-tor1-01.ssh > bras-base-toroon0817w-grc-26-184-146-121-215.dsl.bell.ca.64650: Flags [P.], seq 49392:49604, ack 1, win 501, length 212
04:08:36.025845 IP lamp-ubuntu-s-1vcpu-1gb-tor1-01.ssh > bras-base-toroon0817w-grc-26-184-146-121-215.dsl.bell.ca.64650: Flags [P.], seq 49604:49816, ack 1, win 501, length 212
04:08:36.025854 IP bras-base-toroon0817w-grc-26-184-146-121-215.dsl.bell.ca.64650 > lamp-ubuntu-s-1vcpu-1gb-tor1-01.ssh: Flags [.], ack 44028, win 1022, length 0
04:08:36.025924 IP lamp-ubuntu-s-1vcpu-1gb-tor1-01.ssh > bras-base-toroon0817w-grc-26-184-146-121-215.dsl.bell.ca.64650: Flags [P.], seq 49816:50196, ack 1, win 501, length 380
04:08:36.025989 IP lamp-ubuntu-s-1vcpu-1gb-tor1-01.ssh > bras-base-toroon0817w-grc-26-184-146-121-215.dsl.bell.ca.64650: Flags [P.], seq 50196:50408, ack 1, win 501, length 212
04:08:36.026060 IP lamp-ubuntu-s-1vcpu-1gb-tor1-01.ssh > bras-base-toroon0817w-grc-26-184-146-121-215.dsl.bell.ca.64650: Flags [P.], seq 50408:50620, ack 1, win 501, length 212
04:08:36.026133 IP lamp-ubuntu-s-1vcpu-1gb-tor1-01.ssh > bras-base-toroon0817w-grc-26-184-146-121-215.dsl.bell.ca.64650: Flags [P.], seq 50620:50832, ack 1, win 501, length 212
04:08:36.026212 IP lamp-ubuntu-s-1vcpu-1gb-tor1-01.ssh > bras-base-toroon0817w-grc-26-184-146-121-215.dsl.bell.ca.64650: Flags [P.], seq 50832:51044, ack 1, win 501, length 212
04:08:36.026290 IP lamp-ubuntu-s-1vcpu-1gb-tor1-01.ssh > bras-base-toroon0817w-grc-26-184-146-121-215.dsl.bell.ca.64650: Flags [P.], seq 51044:51256, ack 1, win 501, length 212
04:08:36.026405 IP bras-base-toroon0817w-grc-26-184-146-121-215.dsl.bell.ca.64650 > lamp-ubuntu-s-1vcpu-1gb-tor1-01.ssh: Flags [.], ack 45124, win 1026, length 0
04:08:36.026415 IP lamp-ubuntu-s-1vcpu-1gb-tor1-01.ssh > bras-base-toroon0817w-grc-26-184-146-121-215.dsl.bell.ca.64650: Flags [P.], seq 51256:51468, ack 1, win 501, length 212
04:08:36.026496 IP lamp-ubuntu-s-1vcpu-1gb-tor1-01.ssh > bras-base-toroon0817w-grc-26-184-146-121-215.dsl.bell.ca.64650: Flags [P.], seq 51468:51848, ack 1, win 501, length 380
04:08:36.026572 IP lamp-ubuntu-s-1vcpu-1gb-tor1-01.ssh > bras-base-toroon0817w-grc-26-184-146-121-215.dsl.bell.ca.64650: Flags [P.], seq 51848:52060, ack 1, win 501, length 212
04:08:36.026581 IP bras-base-toroon0817w-grc-26-184-146-121-215.dsl.bell.ca.64650 > lamp-ubuntu-s-1vcpu-1gb-tor1-01.ssh: Flags [.], ack 46176, win 1022, length 0
04:08:36.026645 IP lamp-ubuntu-s-1vcpu-1gb-tor1-01.ssh > bras-base-toroon0817w-grc-26-184-146-121-215.dsl.bell.ca.64650: Flags [P.], seq 52060:52440, ack 1, win 501, length 380
04:08:36.026728 IP lamp-ubuntu-s-1vcpu-1gb-tor1-01.ssh > bras-base-toroon0817w-grc-26-184-146-121-215.dsl.bell.ca.64650: Flags [P.], seq 52440:52652, ack 1, win 501, length 212
04:08:36.026802 IP lamp-ubuntu-s-1vcpu-1gb-tor1-01.ssh > bras-base-toroon0817w-grc-26-184-146-121-215.dsl.bell.ca.64650: Flags [P.], seq 52652:52864, ack 1, win 501, length 212
04:08:36.026872 IP lamp-ubuntu-s-1vcpu-1gb-tor1-01.ssh > bras-base-toroon0817w-grc-26-184-146-121-215.dsl.bell.ca.64650: Flags [P.], seq 52864:53112, ack 1, win 501, length 248
